body,subreddit
"I came to London in the 80s and it was gloriously shit. Not everywhere obviously but large swathes of what are now considered lovely places to live were shit holes - fun to live in when you were young though. I lived in Stoke Newington in a flat in three story house - two mad speed punks downstairs, two fucked up Scottish guys upstairs selling hash and drinking in every spare moment. There was one bog with no light for all three flats. Our front room in the flat was also the bathroom and kitchen and the other room was divided into two bedrooms by a hardboard partition. No heating! The entire street was like that but our house was called the white house because we were literally the only white people in the street.  It was glourious chaos - the pub was full of fucked up people who worked their arses off in mainly manual jobs and the highlight of the evening was slipping some acid in some poor old gits beer and watch him start throwing bricks through people's windows. Meanwhile in Hackney everyone was squatting and/or taking smack or speed depending on your preference. Whole streets were squatted (there is a great storey about Ellingfort Road but that was later on) - lots and lots of hash being sold, loads of Anarcho Punks, Hippies, Dreads, quite a large gay scene, Lowlife parties (almost a forerunner of the rave scene) - it was colourful, mad and just the right side of scary. I could go on but I have to dash but if you want to see a flavour of it then check [this](https://www.instagram.com/tapeslidearchive/).   
ETA.. London now is drab and dreary in comparison but a much nicer place to live and work.",London
"I lived in London almost 30 years. The best bit of advice I got from someone was any random stranger who starts a conversation with you probably wants to rob you , have sex with you,  or both.

Friends of friends or people you know from work or hobbies might be an exception....might

Emphasis on random stranger.",London
"Hey there, I'm a London based girl and in a very similar position to yourself. I hate the dating apps and would much prefer to meet someone organically (out and about in coffee shops or parks for example). 

I have been thinking along similar lines recently. I would LOVE to be politely approached in public. Everyone is so scared to talk to each other these days, it's something I'm going to try to do more if I get a sense that someone's body language is open to it. Best of luck to you :)",London
"If you casually went to your local allotment and asked some old folk if they needed a hand you'd be surprised by the warmth of gardeners. There's a horticultural society just about everywhere, pop along to a meeting and have a chat. Most of us are chancing it, it's not maths so no purity of result, but even failing brings it's own rewards.",London
"Every day, multiple times. I live in SE, work around SW. So I usually start my day crossing to north, then after a few hours of work I cross to south, then north again. Then I cross to south again. At least 20 times a week.",London
"Take as many trips abroad as you can while you’re single, meeting people in foreign places is so much better, and even if you don’t you’ll enjoy yourself. London dating is awful, and not worth it trust me!",London
"If you like Guinness and get there reasonably early after work I like The Toucan, let the din of the place develop around you.

Also really like Bradley's Spanish Bar just of Oxford Street. Again its a small place so it can get busy.",London
"Your not going to find exactly the same in central london unless it was built around the same time. Closest I reckon is the old Victorian tenement buildings. But they all have communal gardens because that’s where you did your laundry and went to the toilet. My guess is that these buildings where built much later and do there was either communal laundry facilities and indoor toilets 

Even if it was peer washing machine, large scale laundry facilities where a bigger thing here than in London where most people still living in Victorian buildings had access to a laundry copper in the garden.",London
"In terms of people interacting, eye-contact has never been a big thing in London ( not for the last 35 yrs since I've been here, anyhow) but now it's just ridiculous; everyone just walks around peering into their phones or looking like they're talking to themselves.",London
"First thing first, London is a tourist city. people might not necessarily want to take picture of because you are not celebrity or someone special to them.

Also, if you don’t feel comfortable, you should go ahead and ask them not to share your pictures is reading if discussing it in hindsight.",London
I gave up using black cabs years ago. Too expensive and I got refused journeys several times - I used to live near Broadwater Farm and they flat out refused to take me there and then I moved South and several times they just drove away when I mentioned the exotic delights of Forest Hill.,London
"- know the quickest way to change lines at Green Park and Victoria tubes (aka not doing what the signs tell you)

- been evacuated by the cops from a whole street because of a terrorist alert, and instead of being scared being mildly annoyed because you wanted to go to pret 

- gone on a riverboat and being full of joy and wonder, thinking 'I should do this more often/I could commute this way/London is so beautiful on the river' and then not getting on another boat for at least 12 months 

- celebrated a heatwave by going to a pub (to stand outside the pub) every night after work for the whole week 

- got caught up by football fans, either on a crazy packed tube, foreign fans letting off smoke bombs and causing a station to be evacuated, having to get off a bus which had stopped because of celebrating fans blocking the road. Somehow these things become common occurrences and you end up shrugging your shoulders 

- really looking forward to an event but then thinking you can't be bothered because it's raining and you'll never get a cab, and don't want to take public transport because your feet will hurt 

- spend a stupid amount of money on fortnums or Selfridges food, because you went in for a look at Christmas and ended up actually buying loads of nonsense out of excitement",London
"I don't live in London but I am experiencing the same thing. Out of half of the dates I've been on, half of the guys have ghosted me. So many people have lied about various things, mainly their height! I really don't care how tall you are but to lie about it? Not a good start.",London
"Why now ? Do you know flight fulls of Brits fly to Orlando DAILY ( and have for years ) and many book crap hotels that tend to have bed bugs and fake them right back home , this isn’t a new thing by far .",London
"CT did what?? Super Slim was the fit !!

Seems they still offer Slim and Extra Slim but Super Slim was one step further.

These people seem to be lining themselves up for something similar but haven't tried them myself... 

[https://taperedmenswear.com/blogs/tapered-blog/charles-tyrwhitt-super-slim-fit-alternative](https://taperedmenswear.com/blogs/tapered-blog/charles-tyrwhitt-super-slim-fit-alternative)

""*Athletic fitted clothing for men designed for those with wide shoulders and a narrow waist.*""",London
"Honestly, it's going to happen rather you like it or not, sure you can sign, but all it will do probably is just delay, the amount of money and tourists that will come, will far outweigh any complaints of a petition, it's worth a try, but reality it'll happen.",London
The maker of a supposedly dairy-free yoghurt used in a Pret a Manger vegan wrap has broken down in tears as she spoke at the inquest into the death of a woman with a severe allergy.  https://news.sky.com/story/yogurt-firm-boss-breaks-down-in-tears-at-inquest-into-death-of-woman-with-severe-allergy-12698163,London
"Try this website out for now: https://www.recycleyourelectricals.org.uk/hypnocat-electricals-campaign/.
There's lots of useful and interesting info on recycling electricals.
Also, if the items are still functional, many charity shops will take them and PAT test them, I believe.
And interestingly, these waste products don't get paid for through taxes, it's all paid for by producers of the products.",London
"# Upvote/Downvote reminder

Like this image or appreciate it being posted? Upvote it and show it some love! Don't like it? Just downvote and move on. 

*Upvoting or downvoting images it the best way to control what you see on your feed and what gets to the top of the subreddit*


*I am a bot, and this action was performed automatically. Please [contact the moderators of this subreddit](/message/compose/?to=/r/london) if you have any questions or concerns.*",London
"It’s a mixture of everyone thinking they’ve got more or even better options out there so don’t want to commit and cost of living being high so dating just isn’t worth it. 

On the options bit I tend to find everyone ( including myself ) essentially thinks they’re better than they are and don’t extend grace to other people. Could be job requirements, the way someone looks, family etc. 

Dating in London past uni age is a shit show if you wish to commit, short term dating? ( really just sex and one party doesn’t want strings attached ) creates a lot of broken people and they never let it go.",London
"Stop talking to random people (or letting them approach you). One thing is for you to kindly reply to a need they may have (help getting somewhere for example) but don’t tell random people you “just arrived”. This city is a melting pot of many intentions, be mindful.",London
"Honestly it'll probably just be for their own records, if the police weren't involved on the night they won't be involved. 
I would be confident you'll be fine going back to Corsica haha , but don't stress too much. Just be smarter ??",London
">However, some of these friends then go onto find partners (as is the general direction of travel for people who are single), and those friends are just stale one-sentence replies every few weeks, which is boring.

I do have a partner and still find people tend to be absolutely boring lately in terms of lack of depth conversations. I just guess is a cultural 2023 thing and I am avoiding those neurotic Whatsapp / Text communications, my guess is that meeting people face to face more frequently rather than fueling those empty online chats could trigger more interesting frienships.",London
"Not a romantic one, but I met one of my very best friends on Tinder! Did one date and it wasn’t a match romantically, but we had a blast and decided to stay friends instead.

It’s been years and I love him to bits, and he met his current partner on Hinge so it’s a success story too! It does happen.",London
"The buildings aren't black. My main memory from those days is that the city was basically painted black (from coal smoke).

The amount people smoked. Ashtrays, butts and smoke everywhere.

Routemasters.

More colourful street culture. Punks, goths, ageing hippies, at least they dressed flamboyantly. Now it's black puffer jackets and trainers as far as the eye can see.

Housing was shitter and cheaper. I knew a young artist who had a one bed flat in Fitzrovia on housing benefit. Hard to imagine now, but that flat hadn't been renovated in 20 years back then. The first flat my aunt bought at the end of the 70s didn't even have an inside loo yet.

No-one picked up dog shit, but there were way fewer dogs. 

Mechanical parking meters lining the streets. 

Far far far fewer chains. Yes, smiths, boots, etc but it was before the big coffee chains took over, and there were far more independent shops. 

Army surplus shops were everywhere and you could get clothes dirt cheap in them. East German army shirts flooded into London after reunification. I wore an old air raid warden's coat that was the warmest thing I've ever seen.",London
"Personally I’d be quite wary if a random guy just came up to me and started making conversation.

But if you do go down this route, please be respectful. And always give out your number/social media without expecting/forcing reciprocation. Leave the ball in their court and let them reach out to you.",London
"Folk, Universal Works, Albam, Our Legacy, Margaret Howell, Oliver Spencer, Uniqlo, YMC, lots of decent stuff in END and Goodhood, Carhartt WIP, Norse Projects, worth checking for brands such as Gramicci, Patagonia, North Face, Mont Bell, Arcteryx and other outdoor wear that can be really good for layering and multi functional for both style and function.",London
Yeah. Went there in September and was shocked. No way am I paying that much. To hell with their subscription. I feel they’ve crossed the line where I might be able to justify the expense for the convenience.,London
"I took my autistic son Patrick in 2020 just before covid got out of hand, he was 18 and absolutely loved it, this meant we had to return the following day with his younger brother (13) and my wife (mid 40s but actually a big kid herself) 

It is very busy, there's a stage at one end of the hall on which various talks and performances are given a good half the hall is displays and sales with more sales littered around other side rooms, I don't remember how much it was but it can't have been that much otherwise I'd remember and remind everyone whatca great dad I am for spending £xx on something so inherently pointless,  book early and buy a tee shirt and lanyard, Patrick was the only one in the family with a tee shirt and lanyard and everyone else was jealous. 

The following year we went back, honestly it was just awesome, our daughter (20)went with her boyfriend but being older and wiser did some research and decided not to buy a mystery box because they're a con, anyway they bought a mystery box and confirmed that they are indeed a con, so DON'T BUY A MYSTERY BOX, while walking around my wife and I met and chatted to Indiana Jones or at least someone cos playing as him, Patrick recognised and chatted to Peter cullen, (the voice of optimus prime) and stood up and asked him a question and afterwards was shocked that he'd done that, it was yet another fantastic day, on thexway home we mentioned our conversation with Indiana Jones and no one else had seen him, then after a few seconds the boyfriend leant forward and said quietly ""are you sure it wasn't woody from toy story?"" We just looked at each other and laughed. 

It truly is worth going to.",London
"Outer Circle, in Regents Park. You know the amazing villas you see if you walk down the regents canal towpath from Camden to Little Venice and look across the canal at their pristine gardens and grand facades. I'll have one of them please!

edit: something like this https://www.google.com/maps/@51.530123,-0.1662532,3a,75y,104.54h,101.65t/data=!3m6!1e1!3m4!1snxcemap8FX7V5ITp78mf_g!2e0!7i13312!8i6656?entry=ttu",London
"Tories: “the rich only stay because the U.K. is low tax. Make taxes lower! Cut public spending!”

Rich people “we only stayed because fair taxes ensures thriving arts, good roads, fair police, efficient councils, quick courts, and public safety. We leave when they are ruined. Bye.”",London
There’s a flower Kiosk immediately outside Angel station that’s very affordable. For a bit more selection there’s a another more expensive stand outside the York near Camden Passage. Otherwise for the nicest and most expensive selection there’s Dansk on Upper Street.,London
I would offer a treasury housing bonds to the market. The money would build council (treasury) homes. The homes would be rented out at 40 to 60 % of the private market and the money recouped thru rent would be split between the bond holder and the govt. After ten years the house would be sold to first time buyers at a price that gives bond holders a reasonable return.,London
"I’ve been off sick this week and binge watching Unbreakable Kimmy Schmidt (took me three goes to get into but now loving it)

Anyways there’s a scene where she finds her mum (Lisa Kudrow) who is a “roller coaster junkie” - this plays out in jokes over an episode or two but in the end she basically lets on that

“You can scream your soul out and no one bats an eyelid”

So this entire fever ramble to say: roller coasters.",London
Recently as they’ve got worse I’ve caught folk not-so-sneakily filming my involuntary ticks. It’s cruel enough to think they’re ‘just’ sending it to their friends in the group chat… the worry about becoming a “look at this freak on the bus” tiktok is always in the back of my mind.,London
"I lived near that area for a while in the early 2000’s. 

Not a nice place to be. 

I now own basically the same house as this (design wise not the mess) in Croydon which I bought for less than half the price of this place. Still only 15 mins from Victoria by train.",London
"I think that, in a time where a lot of stuff feels pretty bad, some people are just out to make themselves feel good, regardless of how they have to behave to do it — so they inevitably end up hurting people. 

Last year, I had someone tell me after three fairly intense months that he didn’t want anything serious; that he knew he should have ended it sooner (which I also gave him the option to do), but was being selfish because when we were together he always had such a good time. 

There’s not much you can do with that type of fuckery, apart from be hyper vigilant and keep your guard up — ideal conditions for dating!",London
"A classic example of Enshittification, it happens to all tech companies eventually. At first they make the platform extremely appealing to customers. Once they have the customer base they start screwing the customers to attract more businesses to the platform. Finally they start fucking the businesses too and the whole thing descends into a pointless shamble. Happens every time.",London
"I remember in my school times when traffic police team came up for a presentation on road awareness. 

For walking on the side of footpath, safest would be the option where you can see the opposite vehicle coming towards you rather than vehicle coming from the behind. It increases the probability of safe reaction required by the person walking or the one driving the vehicle. In short, walk on the side WHERE YOU CAN SEE AND BE SEEN AS WELL.",London
"Yes. Many more gangs in very close proximity in South. Mostly around Brixton sort of area with significant gangs in numerous estates there, Stockwell, Camberwell and Kennington. In some cases the estates literally spill over into each other

Nothing to do with poverty levels because there’s plenty of that everywhere else. 

You can go on the drill sub on here and look at what is being idolised by the kids. Pathetic postcode wars with the thin veil of music - a few musicians obviously have made a name for themselves from these areas.",London
"Problem is, to make housing more affordable you likely reduce current homeowners equity and current homeowners are more likely to be voters (I.e. older/Boomers)

It would also actually impact the Millenials who have managed to buy most. If house prices come down to ""affordable"" it may shave £100-150k off a Boomers Equity...but it could be devastating to Millenials who have beaten the odds to get on the ladder.

If prices come down, interest rates will climb further undoubtedly, our recent 'historic lows' have had to be because of the prices. If those come down and interest rates rise, Millenials on the ladder could have the double whammy of Negative Equity and Spiraling interest rates, leaving them unable to sell and unable to afford their mortgages.

Disclaimer: Ive finally managed to just get on the ladder. And what I dreamed of for years (affordable housing) would be catastrophic for me now. But I understand it's needed overall.",London
"No longer dating, but can still answer.

Directness: easier to just disappear
Caring less: reversion to the 90s where it’s not cool to care 
Look for: depends on the guy and the time, but hotness does make up for a lot. Also, making the guys ego feel great mixed with hot sex also makes men ignore what they really want.
Black women/interracial: yes",London
"This happened to another person I met recently too. He was taking selfies when it happened so he actually has a photo where you can see the thief approaching on a bicycle. They snatched it and just threw it away when he ran behind them.

New Pixel he had just bought, so like the others said, it seems that thieves prefer iPhones.",London
"Had neighbours like this many years ago. First it was me being too loud on the Xbox. 

Then it was the tv being too loud at 10pm. 

Then it was the tv being too loud at 8pm… 

Then it was the dog barking (we had family stay with us for a week, they heard that loud dog ONCE)",London
"I know that the currently government doesn‘t want to spend another penny on rail, but jeez, Stratford station needs a complete rebuild. It was rebuilt in the 1970s with those ugly yellow tiles and, 50 years or so later with the addition of the Liz Line, DLR, and many more people and services, is no longer fit for purpose. 

It‘s a classic UK “botch it and hope for the best“ job. Rebuild the lot. Totally separate the Greater Anglia and Liz Line platforms, sink the Central Line so it‘s underground rather than just be surface-level for one station, have a walkway to the International station, and generally make the station entry points less of a horrific experience. Give everyone more space.

Granted, the station was an absolute shithole in the 80s/90s and it‘s better, but it‘s still nowhere near the “major station“ status it deserves.",London
"How about: if you own a property in London which was valued above £450k on 1 January 2020 that isn’t your main residence (and never has been), your council tax on that property is adjusted to the existing council tax plus market value of rent on that property. 

So if you buy a £5 million second home in London and the rent is £4k a week, you would pay the council an additional £16k a month as a cost of ownership.",London
"Put me down for Windmill lane, Arkley. It's 'just' London (Barnet) and since it's only 20 minutes from where I live now, and more convenient for wife's work and son's football, It'd be perfect.

There's a house with an actual windmill and indoor pool on there. Dibs that one.

Example house- [https://www.rightmove.co.uk/properties/120598232#/?channel=RES\_BUY](https://www.rightmove.co.uk/properties/120598232#/?channel=RES_BUY)",London
"The UK doesn’t have the space luxury that the US has, so here we have to reuse space. Add to the equation that, some buildings over here are so old that they are protected for historical significance. So you will find churches that have been deconsecrated that are well situated so that land can’t be left abandoned and the building can’t be destroyed, so they get converted into flats, homes, bars and restaurants. 

How it is to live in depends entirely on the quality of the refurbishment. Old churches have thick walls so they can be very sturdy builds, but of course it depends entirely on the builder and the budget. 

These buildings can still be owned by the church, which may account for the reasonable rent, however the churches have been known to be sold to private individuals as well.",London
"Is it just me or is this not creepy at all?

A man struck up a conversation with you, you walked around the shopping centre and then he asked if you wanted to join him outside for a cigarette. He then asked for your number and it ruined your day. Personally, it tends to make my day when someone hits on me, even if I’m not interested. I really don’t see the issue here.",London
"I know The Alex in Wimbledon used to host these every Monday (not sure if still do), but this was part of a thing called Meet Up Mondays

[https://www.facebook.com/MeetUpMondays/](https://www.facebook.com/MeetUpMondays/)

You could consider finding a local cafe or pub to host this. It's good for local community, reduces loneliness, and the pub might get repeat customers out of it, in exchange for offering free teas and coffees.",London
"Bear in mind that the Sainsbury’s in the station, and the ones over the road are more expensive than the one two minutes walk away in the Cut. 

Lower Marsh has a good choice of little lunch places including a Greggs, which is probably cheapest.",London
"What area. You can get suggestions on here, yes of course. But honestly there may be a pub that would. But no one mentions it. Easiest way do the footwork. And ask. I know it's going to take extra effort. But if it's what you want to do. Then it's worth it. Also find a pub already hosting one. Ask them for advice.",London
"Must be a schoolkid's from that area. If you happen to remember the uniforms of kids on that route maybe you can trace the school that way?

In fact the same group might be getting the tube around the same time tomorrow?",London
"There’s 14 million people in the metropolitan area of London. It’s literally a megacity. 

Have you never been to a big city before? 

If you think London is busy, I suggest going to New York, São Paulo, Bangkok… let alone Tokyo, Seoul, Shanghai…

Being in a big city will hopefully teach you that there are literally billions of other people in this world and millions in your own settlement, you’re not that special. “What on earth are these people doing” - literally an infinite number of possible things.",London
