body,subreddit
"À Rennes, pour payer un ""ticket"" (titre de transport), une simple CB suffit. Et c'est le FEU. À Paris, il faut envoyer un SMS et le montrer au conducteur... Je trouve que le paiement par carte est tellement mieux et plus simple..

EDIT : et encore le SMS, c'est récent. Avant, t'avais pas de ticket ou d'espèce (l'appoint), t'allais te faire foutre ?? je ne comprends pas pourquoi une ville comme Paris n'a pas encore mis ça en place.",Paris
"Depuis que je suis arrivé sur Paris il y a six ans j'ai déménagé à chaque nouvelle année scolaire. 

J'aime juste bien bouger franchement et découvrir de nouveaux quartiers. Aussi avant j'avais ce délire d'agrandir mon appartement tout les ans vu que le premier j'étais solo en studio et après tout les ans je rajoutais un colloc. Bon ça s'est arrêté à quatre max mais je perds pas espoir de reprendre un jour",Paris
Si tu as les moyens je peux te conseiller kokoon. En gros suivant tes critères ils se chargent de te trouver un apparte de le visiter pour toi etc. Attention par contre quand je m'étais renseigné c'était dans les 1600€.,Paris
"Entre les prix du quartier qui explosent à cause des touristes (en bonne partie à cause du café de Flore, Deux Magots et Procope qui sont de sacrés attrape touristes) et les milliardaires tels Bolloré qui font pression sur le monde de l'édition c'est pas gagné.",Paris
J ai vu un mec qui mettait des gros chassés dans la gueule des gens qui essayaient de monter (ligne 7) parce que selon lui la rame était bien trop pleine et qu il allait mourir de ne pas pouvoir respirer (c est vrai que la rame était bondée mais quand même). Au bout de 2-3 arrêts ça a commencé à s échauffer dans la rame et avec un autre mec on l a poussé en dehors de la rame parce qu il devenait menaçant et s était violemment embrouillé avec une femme enceinte qui critiquait sa façon d agir.,Paris
"Je pense vraiment qu’en supprimant les 50cc, les tmax et les xadv le problème serait vite résolu. 

Un début de solution serait  un péage à l’entré de paris pour faire fuir les banlieusards qui viennent faire vroom vroom. Il faut également que les livreurs passent en vélo (ou que les gens arrêtent de se faire livrer de la nourriture …) . Je comprends toujours pas comment la moitié des livraisons sont faites avec des 2 temps non homologués alors qu’un vélo est plus rapide.    
Tout cela revient au même constat, l’essence n’est pas assez chère. 

C’est pas un problème parisien, mes parents habitent dans une ville moyenne et c’est tous les jours un balais incessant de Harley Davidson, tmax.",Paris
"Je crois que c'est déclaratif, au moins en partie !

Dans les systèmes qui fonctionnent par contre on a le Transilien avec [l'affluence à bord en temps réel par voiture.](https://www.transilien.com/fr/itinerary/search/?departure=Vaires+-+Torcy+%28Vaires-sur-Marne%29&departureId=stop_area%3AIDFM%3A68419&arrival=Gare+de+l%27Est+%28Paris%29&arrivalId=stop_area%3AIDFM%3A71359&dateType=DEPARTURE&haveBusBypassed=false&date=2023-09-22&time=07%3A45) et c'est franchement assez fiable. C'est affiché sur les panneaux sur le quai, et ça permet de se placer intelligemment pour viser où rentrer dans le train.",Paris
"Je suis d'accord avec les autres, c'est plus les humains le problème... Aprés y a des proprio de chiens qui respectent pas le fait de ramasser la crôte. Mais franchement des fois je me demande si c'est des crottes de chiens vu la taille... Dans le 20eim c'est de pire en pire dans les petites rues.",Paris
"CPCU is the public company providing centralized hot water to some (but far from all) buildings in Paris. They do need to stop their service from time to time for maintenance, but never city-wide. See here for a map https://www.cpcu.fr/info-travaux/

Also, October 7th was four days ago, and it was not even a Friday...",Paris
"As a person of color, been considering moving to Berlin. I currently reside in Paris and the French lifestyle is too… French and unaccommodating for English speaking people who just want to live and work here and not be hindered so much by language. 
Of course learning French is a useful skill but at a certain point it’s silly that nobody can understand or English.",Paris
"J'ai emmenagé dans le 5eme il y a deux mois (juste en dessous de la Rue Mouffetard vers Gobelins), je ne savais pas que c'était un arrondissement aussi attractif. J'habitais dans le 11eme avant j'aimais beaucoup le quartier vers Pere Lachaise",Paris
"The mumbling at the end of the announcement is actually the spanish version, and it is extremely awkward and unintelligble yes.  Couldn't stop laughing last time I took the L.

He says : Cuidado el anden",Paris
"One of the most romantic memories I have is waking up very early on a snowy day and being the first to walk to the bord de Seine. that was utterly magical and free. 

Be spontaneous, seize the moments. Night time walk by the river, picnic in the park, rooftop terrace, the George is nice btw!",Paris
"On n'a vraiment pas besoin d'une ligne de plus vers la capitale qui est déjà surpeuplée.

On construit des lignes pour que les personnes qui vivent en province fassent 4h de transport par jour pour aller travailler à Paris, mais est-ce que ce ne serait pas plus judicieux de construire des lignes inter-citées pour se déplacer de banlieue à d'autres banlieues.

Ça motiverait peut-être des entreprises à aller s'installer en banlieue où les prix de location des locaux sont moins chères.",Paris
"Je travaille à La Défense et je déteste y aller. Il y a trop de monde pendant les heures de travail, et le quartier est complètement mort le soir.  Il n'y a aucun espace vert. Les restaurants sont super chers et de mauvaise qualité . Dès que j'entends ""La Défense"" en arrivant le matin par le RER, ça me stresse.",Paris
Husband is from Paris and just got back from  visiting our daughter. He was struck by how clean the city was. And how friendly. And how much cheaper it is than where we live in the US. Not kidding. All the family living there has commented on the improvements in Paris. Maybe you stepped in something.,Paris
"C'est beau ... c'est tellement beau ... un chef d'oeuvre de connerie ... 

Qui est le grand génie qui a pensé ""tiens, pourquoi on emmènerai pas nos prisonniers courir dans les bois les plus grands de la région ?"" ?",Paris
"Ils ont tendance à tous fréquenter les mêmes restos et comme à 19h il n'y a qu'eux, ils finissent toujours par faire connaissance avec leurs voisins de table et à discuter d'une table à l'autre entre Ricains. Le mal du pays sans doute",Paris
"Salut, je suis canadien qui vient de déménager à Paris pour mes études. Pour être Américain, surtout les jeunes, il faut porter des vêtements 'sportifs', mais de style normal (ex: Hoodie Nike avec des shorts et des souliers Nike)

Voici des illustrations: 

[https://media-photos.depop.com/b0/15484129/1218020895\_c3e88c6591f44f48bd3e99686b50ab73/P0.jpg](https://media-photos.depop.com/b0/15484129/1218020895_c3e88c6591f44f48bd3e99686b50ab73/P0.jpg)

[https://images.milled.com/2020-08-24/uVmxp7MBmHc4FA1g/FPrhbzTu1G9N.png](https://images.milled.com/2020-08-24/uVmxp7MBmHc4FA1g/FPrhbzTu1G9N.png)

[https://static.nike.com/a/images/f\_auto,cs\_srgb/w\_1536,c\_limit/97362593-614c-40e7-8ac2-5d6d62d2454e/comment-porter-votre-sweat-%C3%A0-capuche-ou-sweat-shirt-pr%C3%A9f%C3%A9r%C3%A9-en-toute-occasion.jpg](https://static.nike.com/a/images/f_auto,cs_srgb/w_1536,c_limit/97362593-614c-40e7-8ac2-5d6d62d2454e/comment-porter-votre-sweat-%C3%A0-capuche-ou-sweat-shirt-pr%C3%A9f%C3%A9r%C3%A9-en-toute-occasion.jpg)",Paris
"Yes, they are more judgmental, but probably not about doing things alone or learning how to skateboard in a random park. 

They will judge you on things like: how you speak French, what you are wearing, how loudly you talk, whether you follow social etiquette (say ""bonjour"" when you enter a shop), how much you eat, etc. 

In other countries, if you are a foreigner, people won't really expect that you follow their social conventions, and most won't expect that you speak their language, certainly not to a high level. In Paris, using bad French could get you laughed at and even ridiculed (it certainly happened to me!), whereas in other countries people are happy and flattered at even rudimentary attempts to speak there language. 

In Eastern Europe, the Arab world and most of Latin America, it is a sign of hospitality to offer a lot to eat and urge your guests to eat more. France is the only country I've encountered where someone will subtly shame you if they think you're eating too much. 

The French are also highly sensitive to any type of criticism, so expect this post to receive a lot of downvotes!",Paris
"American in France for 7 years - are you looking for white bread to drop in the toaster? If so you can find it in just about any grocery store. (Franprix, Monoprix, carrefour, etc..) 

There is always a bread aisle with bagged sliced bread. The white bread you find there will be closest to typical American toast. 

As someone else said, it’s called pain de mie.

https://www.monoprix.fr/courses/pain-de-mie-nature-extra-moelleux-monoprix-1557583-p",Paris
"La Seine. Le Palais de Justice et le pont Saint-Michel depuis le quai Saint-Michel. Paris (VIème).

The Seine. The Palais de Justice and the Saint-Michel bridge from the Quai Saint-Michel.  Paris (6th).

https://www.galerie-roger-viollet.fr/en/photo-a-212285-3011668196",Paris
"Cute decoration (check bouillon racine)

Basic, stereotypical french dishes, quality/price ratio is generally correct, service is generally fast (notably at Chartier).

Might be a good choice to enjoy some classic french dishes on a budget and within a ''postcard'' place. You won't be stunned by the food, but it's worth a visit.",Paris
"> Ne trouvez vous pas que nous avons un problème avec le pipi de chien partout sur les trottoirs?

Oui

> Est-ce que vous trouveriez normal que les propriétaires soient taxés?

Oui

J'en peux plus des animaux en ville. J'en peux plus non plus des gens qui pissent n'importe où, avant qu'on m'en parle.",Paris
"Look at the apartments of the police officers in Engrenages (not Gilot).

It'll make you think that the police service is well paid.

The frequency of the smell of urine (of unknown sources) at random times (especially on/near corners) and dog poop making you skip on the sidewalk, you lucky if you don't break an ankle off of one the trotinettes that they are apparently getting rid of.

Every boulangerie has clients that park on the road, not even off to the side, with their hazard lights on, blocking traffic and buses.

People spit frequently on the street, an muslim friend of mine (yes, it's not illegal to have Muslim friends) laughed when I mentioned it saying you'll find it more common during the Ramadan fasting period.

The British have set the standard for people waiting courteously for those in front of them in a line, that doesn't exist here, regardless of what you're told.

The racism echo chamber is usually disguised initially as immigration reform ideas/discussion which then usually transform to outright racism, depending on the group demographic %'s at the time but this is a touchy subject because it's easily swept under the rug, mainly because in order to witness it in full you need to not be a member of the ethnic group being lambasted or be one table over during peak election or world cup seasons.",Paris
"Hi, I don't think it's paranoia. It's in the press because of the season. Paris has had a large bedbug population for years now. I picked up my first bedbugs in July 2021 after staying in an Airbnb in the 17th. Flew back with them in my bag to my country and they infested my home. The problem is not the likelihood of catching them. It's that if you do, they are hell to get rid of.",Paris
"Je te comprends tellement pour l'accent. Le problème quand quelqu'un nous imite, c'est qu'on est toujours en train de se demander s'il se fout de notre gueule ou pas. Arrêtez de faire ça avec des inconnus les gens !",Paris
"La ligne 8 c'est pas mieux...Bondé aux heures de pointe, souvent des retards cause régulation ou bagage oublié ou autre...Bref je ne connais pas les statistiques sur la régularité de cette ligne sur 2022, mais ça doit pas être rose..",Paris
"L'opération n'est pas remboursée du tout (sécu / mutuelle) ? On t'a donné quel prix ?

Je vais devoir le faire aussi mais je suis pas sur Paris et les RDV prennent 6 mois donc j'ai pas encore vu le chirurgien...",Paris
"Vers 2005. À La Défense. Un type de 30-35 ans, avec un attache case et un joli costard, propre. Je le regarde de profil : ses dents du haut sont tellement déformées qu’elles sont à l’HORIZONTALE ! Et là je crois comprendre pourquoi : le mec suce son pouce allègrement, tout en se bavant dessus, à tel point qu’une flaque de bave s’est formée à ses pieds. Inoubliable !",Paris
"""Rich kids"" sounds about right. It started off primarily as a school for American children of US military / diplomatic / etc. people stationed in Paris after WW2, when the American presence in Paris was still large. By the 1970s it was a ""have fun in Paris""school. :-)",Paris
"Métro parisien il y a quelques années, sans doute ligne 14 car une longue rame continue. Un type style sdf avec une jambe gangreneuse, bien moche avec l'odeur qui va avec, circule. Soudain il s'arrête, pousse des cris / râles énervés, et les passagers autour de lui s'enfuient.
Clairement sa jambe le grattait terriblement. Je vois le couteau dans sa main, il s'entaillait la jambe et retirait des petits lambeaux putrides.",Paris
"Si l'intérim est possible dans ta branche, voici le mode opératoire pour avoir un travail très rapidement :
- tu envoies ton CV à 3 boîtes d'intérim qui t'intéressent
-tu appelles chaque intérim 2h après avoir envoyé ton CV pour savoir s'il a bien été reçu, et pour savoir s'ils ont donc une mission pour toi. Ils vont te dire non, ils vont peut-être te dire qu'ils regarderont et te rappeler ont.
La cest la partie la plus importante :
Tu rappelles tous.les.matins. à 9h en demandant s'ils ont une mission pour toi.
Ça ne les fait pas chier. Ça n'est pas cringe. Ça montre justement que tu veux du travail, tu sais communiquer de façon professionnelle et que tu te lèves le matin.
Si tu applique à la lettre mes recommandations je pense que d'ici 3 semaines max tu auras un travail.",Paris
"J'en ai subi des dingueries dans les transports, mais il y en a une qui m'a vraiment traumatisée et à laquelle je repense encore souvent alors que ça s'est passé en 2016. Je préfère prévenir que l'histoire qui va suivre est NSFW.

2016 donc, en plein été. Avec mon mec de l'époque et une copine, on a prévu de s'envoler pour l'Espagne. On prend donc le métro de Lille pour se rendre à l'aéroport dans la joie et la bonne humeur. Un homme et son fils entrent dans le métro et commencent à râler parce que nos valises lui bloquent le passage. Ni une ni deux, on les déplace pour leur permettre de passer, mais cela ne calme pas le monsieur. Il commence à nous insulter, et moi plus particulièrement (vous savez, le genre d'insultes sexistes et dégradantes qu'on entend souvent quand on est une femme en robe d'été dans le métro). 

Nous on est trop contents de partir en Espagne alors on ne fait pas gaffe à ce gars qui continue de nous insulter avec son fils d'une douzaine d'années, on laisse couler et je lui tourne le dos. On passe à autre chose, on discute une dizaine de minutes, et tout d'un coup ma pote regarde par-dessus mon épaule et son visage se décompose. Je me retourne pour voir ce qui la trouble, et là, je vois le mec en train de se masturber à quelques centimètres de moi. Il était le chibre à l'air, en train de se branler compulsivement en me regardant droit dans les yeux, avec une haine indescriptible. Et son gamin était là, à le regarder comme si tout était normal, bien tranquille, pas choqué pour un sous, ce qui m'a fait penser qu'il avait souvent vu son père faire ça devant lui...

Le pire c'est que cette scène nous a tellement choqué qu'on a rien su dire. On a changé de rame de métro, laissant le petit tout seul avec son cinglé de père. Je m'en veux beaucoup de n'avoir pas eu de réflexe. J'aurais pu changer la vie de ce pauvre gosse si j'avais appelé la police, mais je crois que j'étais trop sidérée pour réagir correctement.",Paris
"Apparemment, c'est pas une si mauvaise idée. Et je trouve pas ça étonnant : ils vont pas passer leurs vies en prison et il faut bien leur montrer qu'on leur fait confiance.

Par contre pour les 2 gus qui se sont échappés, je sais pas s'ils ont fait le bon choix. J'imagine qu'il vont être retrouvé rapidement et j'ose  espérer que leur retour en prison sera pas aussi cool.",Paris
"Someone started talking about it. Social media went with this trend. Normal medias followed. You woul have come 2 months ago, it would have been the same.

There is no guarantee that you will get some, but no zero chance either that you will not.

Other big cities and tourists spots elsewhere in Europe and USA are dealing with bed bugs too.",Paris
"The more we decrease our dependency on car-centric infrastructure the better. Instead of campaigning to make things easier for drivers, we need to campaign for a public transit system that better serves these outlying suburbs. A non-cyclable, non-walkable city is not a city worth living in.",Montreal
"You can still pay with cash, but it's more convenient to get an Opus card and load tickets onto it.
  

  
For bus-only travel, you can load ""Bus Only Tickets"" on your Opus card, which is a cost-effective option. If your journey includes the metro or train, go for a ZONE AB ticket for seamless transfers during your entire trip.",Montreal
"It will be always funny to me that my bf from Alberta (who is also a dual Swiss citizen)who speaks fluent French pays much more for school vs me, an anglo who is a Québec resident. I think what would have been better is mandatory French classes. It would have spread the French language to more people and would help increase the amount of people who graduate and stay in Québec. Not only mandatory French classes but also history of Québec so that other Canadians can have a more nuanced understanding of why Québec is the way that it is. But nope increase tuition will make things better???",Montreal
"Just say ""call the police then"" and stop entertaining this kind of AH.
Montrealers are well known to be dead scared of anyone who tells them to stfu and the only risk is them start crying when confronted.
You're in your right to take pictures.",Montreal
"C’est tannant à quel point ce sont les quartiers centraux qui sont déjà bien desservis en transport actif et collectif qui continuent à avoir des améliorations de leurs infrastructures, pendant que les quartiers périphériques sont laissés en jachère… C’est rendu que c’est beaucoup plus facile de vivre sans auto à Longueuil ou à Brossard qu’à St-Laurent, CDN-NDG, LaSalle, Montréal-Est, Montréal-Nord, etc.

Je comprends qu’il faut commencer à quelque part, et je ne dis pas que c’est pas correct de procéder ainsi sachant que le service sera sans doute amélioré et agrandi à chaque année, mais c’est frustrant pareil de voir à quel point les choses progressent lentement.",Montreal
"I’m in my mid 40s and grew up around. I played there all my childhood and we always looked in the grass for syringes before sitting/lying/playing there. I witnessed more than my share of weird shits over the years. Then the village happened and it was a great thing for the gay community. It also brought the first wave of gentrification. 

Poor people were pushed est, but there was still room for the descendants of “Le faubourg à m’lasse”, and the safety it gave to the gay community was a necessity, and one of the great thing that happened to the neighborhood.

And then 10-15 years ago started the new French wave. Fed up of the Plateau and rising prices, the settled in droves, putting more pressure on the historically poor people move est. Then 5-8 years ago, anglophones number started going up. Plates from Ontario and New-York. Not just around the village, but in all the neighborhoods. The pressure to move est continued, but even the areas around Frontenac and Hochelaga were being gentrified. At the same time Airbnb, and house flippers continued chasing the population away. 

But there was nowhere else to go when you are dirt poor. So you stay with friends, family and drug friends. Then the pandemic broke those links and people ended up in the streets. 

Now, where do mentally Ill people go? What do you do when you’ve been cast away from your homes? There used to be “crack houses” every few other streets, male and female prostitutes splitting saint-catherine and Ontario. Now those people are still alive, they just don’t have a roof or people from their network around anymore. 

And now the situation has reverted. The balance that somewhat existed in the 2000-2018 era gave way to the current situation that gets worst by the year. Not as bad as the nineties, (Hells angels vs rock machines, skinheads and Co.)but still pretty bad. It’s sad. We need to invest again in the communal kitchens, make sure people can have a roof and accept that addicts will always be there. Better to reduce the harm than fight them. These people have as much right as we do to live in this city. 

If we chase them away from their houses, we should really advocate for serious investments in social housing. Every house flipped should contribute. Every new buyers who move in a historically rental neighbourhood should pay an extra for public/low income housing.

Sorry for the long rant and lest we forget the memory of Le Faubourg and it’s people.",Montreal
"Saskatchewan is already impounds vehicles at 0.04 and has one of the highest DUI rates in the country. 
This won't do anything. 

I've often pondered if there were calibrated breathalyzers in bar districts if you could stop the people who think they're sub 0.04 but are actually much higher.",Montreal
"Le plus gros problême d'acheter local va toujours être le prix. Même les marques plus budget vont quand même te vendre un t-shirt dans les 25-30$. Je travail de la maison, donc j'ai réalistiquement seulement besoin de genre 5 t-shirts dans vie mais c'est beaucoup plus difficle de vendre ça à une famille monoparental avec 2 enfants mettons. 

Pour le style, c'est tous aussi diffcile. Honnêtement, je vois pas le point d'acheter une ceinture fléchée si c'est faite en Chine, mais personne de local va les faires parce que réalistiquement c'est pas temps à la mode. Y'a donc pas de marge à faire dessus. T'es dans un catch 22 pas mal.",Montreal
"Je connais bien cette intersection et elle est à chier.

Premièrement, ils l'ont transformé en sens unique et en virage gauche interdit quand tu viens de Lorimier vers Sherbrooke. Beaucoup de gens prennent de Lorimier pensant que c'est une grande rue et se font fourrés rendus là. Ils ont pas le choix de tourner à droite ce qui transfère tout le traffic vers Papineau/Rachel qui est une autre intersection problématique.
En plus, le virage à droite est hardcore parce que la butée qui sépare la piste cyclable est jusqu'au bout et les gens s'arrêtent jamais avant le quadrillé sur Rachel (pas une critique sur la piste cyclable la butée est là pour une raison et c'est la faute des gens qui arrêtent dans le quadrillé).

Et de plus, quand tu roules sur de Lorimier venant de Sherbrooke, tout le traffic doit se concentrer en une ligne rendu à l'intersection car la ligne de gauche est pour tourner à gauche seulement.

Je sais que ça sonne comme du chialage d'automobiliste dans un quartier résidentiel et vous auriez raison.
Le problème c'est que de Lorimier c'est une rue résidentielle qui est utilisée comme une grande artère. Tous les applications de direction automobile te font passer par de Lorimier.",Montreal
"I have an older heat pump, still going after 22 years, and a high efficiency oil furnace.
 I pay under 100$ per month for electricity (heating and cooling included), and 1/2 tank if oil per year on average. 
The problem will be when heating oil is eventually  too expensive or unavailable,
 if I go all electric, I lose the dual energy savings, so hopefully I can use propane or natural gas. 
In my case, oil and heat are the most cost effective and efficient.
Ultimately, it's cost.  You get back the the cost (and more) in  savings, but you have to be able to pay for the upgrade.
It takes money to make (or save) money, in this case .",Montreal
"Sapa on St Laurent. They have vegan bahn mis (with fake chicken or beef) vegan Pho-type soups, and vegan ice cream!! Oh and they're family owned and don't hand you a card reader with built in tips, they're super nice.",Montreal
Un autre règlement retardé. Écouter de la musique en conduisant? Ok. Avoir les instructions de Google Map dans une oreille pour éviter de regarder son téléphone en vélo et d'être distrait visuellement? Fuck you!,Montreal
"Depends on who.

I have no issue speaking English with tourists asking for directions and such, but someone who's lived their entire life here and insists on not speaking any French is not someone I want to have any kind of relationship with.",Montreal
"Go with Tesla if you want to get a car in this lifetime  - you'll be driving in 2 weeks tops.

All the other manufacturers have 2 year minimum wait times, some 3 years or more.... Like honestly why the hell would I wait 3 years for something that is essentially a necessity for many people - specifically those with kids?",Montreal
