body,subreddit
"From what I have seen in my neighbourhood, too many people would rather take the chance and risk a parking ticket than pay for parking.  Two green P lots within walking distance of my street (one block and two blocks away) and everything day there's cars parked on the wrong side (it's a one way street) or blocking driveways.  If Toronto wants to raise rates, they should also consider increasing their parking enforcement efforts. 


From the article:

> This fall, Toronto will launch consultations on a citywide parking strategy that could lead to changes in how much real estate the city devotes to stationary vehicles, and how much drivers pay for it.

>The exercise is part of a global trend that has urban centres around the world reconsidering decades-old planning orthodoxy that dictates cities need ample and cheap parking in order to thrive. Proponents of the new philosophy argue that reducing the amount of low-cost parking frees up street space for other public uses, reduces traffic and helps meet climate targets. But any proposal to make parking less readily available and more expensive is sure to provoke pushback from drivers already facing higher costs and business owners struggling to recover from the pandemic

...

>Patrick Siegman, a San Francisco-based transportation planner, said there’s a sea change underway in how cities think about parking. “I have never seen anything like it” in 30 years in the field, he said. “Parking reform is really snowballing.”

...

>In 2022, roughly one-quarter of the parking authority’s 250 off-street lots had peak weekday occupancy rates of at least 85 per cent, the level at which a facility is considered overcapacity and a candidate for higher prices. Rates at most off-street lots range from about $1 to $4 per half-hour.

>Jeff Dea, vice-president of business development at the Toronto Parking Authority, said the agency’s approach is to set prices that are reasonable but high enough to discourage long-term stays, as frequent turnover allows more people to use the spot and shop at local businesses.

>The parking authority typically reviews prices annually at off-street lots and every three years at on-street spots, but because of the pandemic, on-street rates haven’t been increased since 2017. Dea acknowledged rates are now “a little bit low” and the agency will recommend “modest” on-street raises to its board in November. But “we’re not looking at dramatic increases,” he said.",Toronto
"Copenhagen broke ground on their new subway lines at the same time as the Eglinton LRT. Both of their new subway lines are running, despite the fact that construction had to halt many times to call in archeologists. How is it a city of one million is able to construct two subway lines, and a city of five can't finish one fucking LRT.

There need to be punishments in these private-public contracts for failure to complete by a certain date. Levy fines. Don't incentivize them taking longer!! Fucking madness.",Toronto
"I work in big 5 headquarters. Lmao good luck blocking it - PATH is huge and they'll have to block both ground level and underground. And the police knows it better, they know how to navigate TTC tunnels and PATH to get around convoys.

And if anything, most big corporations are just gonna work from home that day anyways. Have fun trying to blockade absolutely nothing",Toronto
"If the person that did this is just a psycho, then that's one thing.

But if the dog was targeted because it was out of control, noisy, and the owners didn't care then you take your chances.

For all we know, this could have been a Murder on the Orient Express type of thing where a bunch of fed up neighbours chipped in to get rid of the problem.",Toronto
"re: Police managing traffic - I regularly see these fine Police Officers, sipping their coffees, browsing Instagram, chatting with the construction workers -just hanging out at the intersections.... doing absolutely NOTHING to manage traffic -  TOTALLY useless - and getting paid Time & 1/2 - on our dime ![gif](emote|free_emotes_pack|facepalm)",Toronto
"Shoppers can actually come out to cheaper if you take advantage of Optimum points and make sure to shop on certain days.

About once a week I have a 'bonus points' day where I get 30% back in points for over $75, so I do all my shopping then.

Plus you can use the points for the whole PC/Optimum network, like Zehr's, NoFrills, ValuMart, etc.",Toronto
"*Black Asylum Seekers!

We got here probably because most of the funding is diverted to address the needs of Ukrainian Asylum Seekers of which ~180 k have already arrived and -700k more expected. Hopefully funding can be increased to provide for all the asylum seekers.",Toronto
"The business reporter for what is now CTV Toronto was ""Arthur Vale"" (top right). He was the most boring, monotone, channel change-inducing financial news journalist on television. When I succeeded him at the station, I was determined to be everything he wasn't. I hope I managed to keep the viewers, who were really just waiting for the sports report, informed and entertained during my 15 year tenure.",Toronto
"Be aware that social media is full of trolls and bots as well as thoughtful comments. Fill a thread with racist and hateful comments and it undermines valid concerns shared about our housing shortage exacerbated by a massive surge in non permanent residents. Most comments I see put the blame at the foot of poor governance where it belongs.

It is only by letting politicians know there is a problem that they even begin to take action. We went from a government that was gaslighting Canadians saying the solution to the housing shortage was to increase immigration even more and saying housing is not a federal issue. Then with noise from constituents and a fall in the polls they were having a party retreat focusing on the housing crisis, to finally committing tens of billions on housing subsidies and actually floating the idea of a cap on international students. Now the government can’t actually solve the housing crisis without putting a cap on non permanent residents which is both international students and work permit holders. We will never make up the housing deficit because even with billions in subsidies we can’t double the number of housing starts to meet the current level of demand. Pressure must continue to be put on government until they change course. 

https://www150.statcan.gc.ca/n1/daily-quotidien/230927/dq230927a-eng.htm

https://financialpost.com/real-estate/canada-cant-build-millions-homes-7-years-fix-affordability",Toronto
"This sounds good in theory but the City's current rental demolition protections are under threat by the province.

[https://www.ola.org/en/legislative-business/bills/parliament-43/session-1/bill-23](https://www.ola.org/en/legislative-business/bills/parliament-43/session-1/bill-23)

If the City pushes further, Doug Ford might start taking an axe to this policy. Don't let perfect be the enemy of good when when dealing with this government.",Toronto
"I hope they release the names of the people who ignored the meteorologists and went ahead with the advisory. 

It would tell everyone whether the perpetrators were driven by race or religion. I personally believe the latter.",Toronto
">Given both of the couple's Lexus vehicles were stolen from the exact same parking lot, Levine says he's upset with the TTC for not providing more security.

That's brutal, and another car stolen from them elsewhere this year. Don't park in the TTC lots apparently.",Toronto
"Shoppers is a convenience store with a pharmacy, and the pharmacy isn’t at all convenient. I find it beyond packed and they often don’t even start filling prescriptions until you show up at the allocated time. It’s complete trash. We found a really nice independent that actually cares and wants your business and we buy groceries from butchers and veggie shops instead of Loblaws.",Toronto
"First time getting the free cinema tickets, very easy - you just need to get there literally just before showtime, that being said, the less said about the new exorcist film the better 

As ever, appreciate the tip and the thread.",Toronto
"It's not just for Nuit Blanche? It's still up?

>On Saturday September 23rd, for one night only, celebrated artist Bruno Billio will turn The Lakeview into a futuristic “TRON” environment!! From 7pm to 7am come enjoy a drink or a snack & immerse yourself in a world where EVERYTHING glows in the dark ??


https://www.instagram.com/p/Cxat26ggPMM/",Toronto
"If you want a great example of Loblaws dry-fucking your wallet, compare the price per pound for unpackaged potatoes up against the price per pound of the non-sale price of a 10lb bag.

It's fucking absurd.",Toronto
"It really has a lot of potential but it’s just not good at all. I went last year and thought it was a dud. 

There just seems to be little effort and planning. The installations are so meh and way too conceptual. I really like art and I’m not even a fan of conceptual art so I can only imagine what someone who doesn’t seek out art/isn’t particularly interested in art thinks. 

The event needs more funding and people who are actually involved in the art world to be at the helm. This is not the way to get people excited about contemporary art.

Also, the associated parties and events are always so terrible. I just don’t get what they’re doing.",Toronto
"Ironically, this food is now in perfect condition to be donated to the zoo indirectly. The zoo has a biogas plant on its land ([Zooshare](https://zooshare.ca/)) that was originally designed to process zoo manure, but also takes food waste and turns it into electricity.

At the very least it could still be composted. Whether or not any of this happens is at the discretion of the person cleaning it up, so it's entirely possible it just goes to the dump.",Toronto
"With the feds and the province doing dick squat to either fund transit properly or let Toronto fundraise for this (highway tolls, gas tax - whatever) - my advice is to let transit fail thereby making it their problem.",Toronto
"The Berrios call in hindsight felt wild for sure, but no one else roll their eyes when Vladdy (through his interpreter) seemed to say he was confused by it. Like, guys you scored 0 runs. How you gonna win that game? Zero killer instinct with this team. Just feeding me the same garbage in a different year.",Toronto
The lanes seem so narrow. Especially on the curved portions. Lots of accidents will happen with speeding cyclists or those using battery assisted two wheel transport. If only they made them wide enough to accommodate the actual cycling/Scooter conditions.,Toronto
"> Each of the accused was given a 30-day licence suspension and had their vehicles, two motorcycles and one car, impounded for 14 days, according to the release.

Sorry, but that should be an outright suspension of one year. A 30 day license suspension is a slap on the wrist.",Toronto
"reminds me of when i encountered a creep with a swastika drawn on his hand just staring at me at Yorkdale station about a month or so ago.

I thought he was some disheveled random homeless guy, but when he stood infront of me, i could see it on his hand.

He didnt speak a word, just stood there and was nodding and making gestures.

quite scary since im brown and had a pride pin on my bag i was praying he didnt see and we were pretty close to the tracks.

thankfully the train came and he didnt get on.",Toronto
"Those poor buggers are going to end up getting evicted, the risk you run with predatory landlords buying large properties with eviction planned from the start.  There should be a law against it, but can you see Dougie doing anything that might possibly disadvantage a rich person, and advantage a poor person?  That's not the conservative way!!",Toronto
"Underwhelming, with far too few exhibits or density. The night was mostly made up of walking long distances and queuing (queue for 45-60 mins for 5-10 mins in each exhibit/installation). Our enjoyment was more about hanging out with friends in line.",Toronto
"Surprise surprise. Also worth noting that their VP of Communications was a former staffer in the Ford Government and their Manager for Communications worked for Navigator (which is closely associate with Conservative politics across Canada): https://corruptario.substack.com/p/the-spa-that-was-a-casino

The revolving door from the Conservative party to Therme is pretty clear.",Toronto
"I know a few articles have been posted about this, but this one is the most clear and least click-batey

> “It was a bit of a shock to me,” Lynn Deutscher Kobayashi, president of the National Association of Japanese Canadians (NAJC) Greater Toronto Area chapter, said of how fast the province was moving.

> “We were told the work was going to be completed by the end of October. And on day one, the bell was removed,” she said. “We did ask, that after this, we wanted to be notified when particular pieces were going to be dismantled.”

> An estimated timeline later provided to NAJC from the Ontario’s ministry of infrastructure shows the bell won’t be relocated to a new location at Ontario Place until 2028.

> The timeline states the dismantling and removal of the site that houses the bell was slated to begin Monday and run through October. It would be moved to storage by Oct. 31, with construction expected to begin thereafter.",Toronto
"I'll never understand my fellow Torontonians are so obsessed with keeping Toronto to ourselves and contemplating measures to discourage passage into or through it else subsidize city residents. Everyone wants change, but no one wants property taxes to increase or for TTC to increase their fares to $4.50 to breakeven or to $5/fare to be slightly profitable and actually improve their service and infrastructure.",Toronto
"If killing someone using your car is considered Manslaughter, then the fine for reckless driving that can cause death should be higher than 30day suspension. 

Honestly, I know way too many people who have driven without a license or while their license was suspended, so I’m sure a 30day suspension will seem like a reasonable risk to these idiots.",Toronto
"To me the solution is relatively simple. Its hard as fuck as an international student to find accomodations (you can't shop around before you arrive). Each university should build and provide a student residence building that both local and international students can stay in. Cost it at just below market for rent. Students have a reasonable price place to stay, and your international student numbers are capped. International students also know exactly what they're buying into before moving (very easy to find reviews, pictures and testimonials for people who lived in those residences).

Schools already do this for about 10% of their students. They just need to up the number. If these apartments get unused by students one day, we can open them up as low costs ""starter"" units for people just out of high school.",Toronto
"> The Toronto Police Association actively works to keep Civilian Workers from joining more suitable unions like the Teamsters, effectively isolating them from support networks.

Can't you just sign enough union cards and then hold a certification vote?

I don't think it would need to be 40% of all 2500 employees, just 40% of any specific grouping. From there, if you successfully form a union, other groups may join.",Toronto
"Don't buy baby formula or diapers from Shoppers, unless the diapers are on sale. I have a 6 month old and use Amazon for all formula orders. Diapers from wal-mart, because they're often out of stock on Amazon. Shoppers only for those 11pm ""fuck we're out of ____"" emergencies.",Toronto
"Just another showcase of shortsighted stupidity. Enabling other modes of transportation gets cars off the street. So for people that can’t live without their cars it’s actually beneficial to have as many people as possible not drive so there is less traffic. It’s not hard to understand, really…",Toronto
"WTF.

There are TTC, Go, and soon to come (tee hee) an Ontario Line stop at the Ex. Why would you need a parking lot of that size and cost there?

Oh wait, the customers of this fuckery are not supposed to be the regulars who ride those, but instead the Acton, King City, Orangeville horsey-set who would cruise down for the day in their Range Rovers and BMWs.

They need a state-of-the art, secure palace to park their conveyances after all. Can't have anything happen or any interaction with the locals when they enjoy their spah-day.",Toronto
"I have a toddler who we take out to restaurants all the time and have since he was an infant. He's very well mannered and can sit through a whole dinner.

STILL - I think this is a fantastic idea for some restaurants. It's just not appropriate at some places and a lot of parents have a sense of entitlement or just don't have good enough social awareness about how their presences can impact the enjoyment of those around them.",Toronto
"Cool. This tax should double for every month the property remains vacant. Also, short term leases should not count towards occupancy.  Also ALSO the city should heavily regulate short term leasing to only be for spaces within your property, and limit the number for the short term lease to 2 people.... so no more Airbnbs for a house or similar bullshit.   


ALSO ALSO ALSO implement a vacancy tax  for vacant retail spaces.",Toronto
"I've had this issue with bagged milk at metro. I was at one right before closing and one of their stockers appeared to be fidgeting with the tops of the bags of milk. While I can't say for certain that he was switching the closure tabs with the expiry dates, on the odd occasion, my milk tends to go bad well before the expiry dates. I only buy the cartoned milk from them now.",Toronto
">Off the rescue list were most of the so-called ""video throws"" — fleeting moments where Much VJs introduced music videos as part of the daily ""Videoflow"" programming block.

That's really unfortunate. Honestly, that was *most* days of programming: 6 hours of ""Videoflow"" followed by The Wedge, RSVP, FAX. And that's how you got to know who all the behind the scenes people were (I was starstuck to meet Dennis Saunders). 

I hope we at least get the archives of Mike & Mike, Combat Des Clips, MuchWest (TDM!)...

I was a bit of a VHS pack-rat and saved some things that I have yet to upload, which sounds like was a smart move on Past Me's part.

Edit: I also want every Kumbaya Festival, every Tree Toss, and every Spring Break.",Toronto
"Actually works quite well as another argument the city/province has is getting people to the spa. Yes it's within walking distance, but some mad lad has suggested a new ""people mover"" system to make the connection. It's a monumentally stupid idea as they could reasonably extend the existing streetcar tracks and run it with reduced service for the existing Bathurst and Harbour front cars.",Toronto
"Will this alone solve the housing problem of homes essentially being unaffordable due to demand outpacing supply? Hard to say, but what it does do is give the city a new revenue stream, and no one is going to fight them since no one cares about the feelings of vacant home owners. 

It’s the perfect scenario for the city, these home investors are the perfect target, good luck gathering public support to stop this.

Keep going! Make it 25%!",Toronto
"I went to only a few things in the downtown core... I expected to see something impressive at Nathan Philips Square. Because well it's kinda the big central point of the city. And in the past they've had impressive things there...

This year, I'm not sure WTF that was. Lifted concrete slabs with foot prints put on the bottom between the fallen garbage? Incredibly underwhelming and it set the tone for the rest of what I saw.

The reliance on the ""immersive"" art experience is also just blah. Down by the lake there was a projector showing two people trying to feed birds in a park... Asking you to imagine being in nature... Like WTF? How much lower effort can you get? 

I think I'll enter and see if I can get funding for an art installation I'll call traffic... This is where you'll get to sit by an onramp to the Gardiner and experience the sensation of traffic. Maybe I'll even print out a sign asking people to imagine themselves being stuck in that traffic trying to get home from work.",Toronto
"""While it may be within the authority of Council to reprimand a former Member, it is my view that reprimanding a person who requested I investigate their conduct as they resigned office would serve no purpose."" 

Typical never hold anyone in a position of power responsible in any way. I guess this well connected millionaire has suffered enough. What a joke.",Toronto
"I worked out of their space for a short time a few years ago on a research project, and I agree, they are a wonderful organization, and with very caring staff!  Glad to see them back serving meals on holidays - hope they're able to continue doing that! <3",Toronto
"The more we create alternative ways for people who don't need to be in cars to get around, the more we can reduce traffic so that the ones who really do need cars (ie. seniors, those who need to transport large amounts, etc) have an easier time of it. 

Many people don't bike, even if they would like to, because there is not the infrastructure. Many who do bike anyway frequently feel less than safe. 

Cars are still allowed on the road, they'll be fine. Now people who are biking get some protected space too. (And then there's public transit, yet another option, which goes right along the area you mentioned. You can avoid the traffic at Bloor and Old Mill by going under it.)

The city has a lot of problems. But I strongly disagree with numbering safe cycling infrastructure as one of them.",Toronto
"Pet Shop Boys [aren't pleased](https://twitter.com/petshopboys/status/1710371181998617028) with Drake today.

Surprising to hear 
@Drake
 singing the chorus of “West End girls” in the track “All the Parties” on his new album. No credit given or permission requested.",Toronto
"People have always stolen anything that isn't nailed down -- plants, pots, bikes, porch furniture, garden furniture, gnomes, rocks, you name it. 

The thing that's new is security cameras on every house's front door, and online sites like Next Door to share video.",Toronto
"*The family was still given a violation notice, requiring ""a minimum 50 per cent of their rear yard must be soft landscaping."" It also stated they must correct the violation and ""bring the property into compliance.""*
  

  
*Trivanoic said it cost $20,000 to install the turf, and the family is concerned it could cost that much to remove it.*

&#x200B;

Do we file this one under ""Ignorance of the (By)Law is not a winning Defense"" or ""Government Over-Reach into Personal enjoyment of Personal Space and Personal Property""?",Toronto
I remember reading somewhere that Vincent Price had a small office in the Toronto Sears Warehouse (now the Merchandise Lofts) when he used to [curate artworks](https://jamiebradburnwriting.wordpress.com/2018/06/08/vintage-toronto-ads-the-vincent-price-collection-of-fine-art/) to be sold through the Sears Roebuck catalogue. Really neat piece of local history.,Toronto
"I've worked a bunch in London. It's a shit hole.

Literally see crazy people bathing in front of businesses. Shitting in the streets. Doing drugs everywhere.

There's a section of road that feels like driving through a zombie movie because of all the zombie-like drug addicts just staggering in the street.

The good news is some of my tools that got stolen were found on the street. Of course the guy that found them didn't think to call me until he wanted to throw them out.

Me and my coworkers are from the GTA, including one from Jane and Finch. He also says London is worse.",Toronto
"They shot in my building, in the apartment across from mine. I couldn’t begin to tell you anything about the show, but the couple of crew members I spoke with were very chill and respectful. Davenport and Dupont area.",Toronto
