body,subreddit
"# Upvote/Downvote reminder

Like this image or appreciate it being posted? Upvote it and show it some love! Don't like it? Just downvote and move on. 

*Upvoting or downvoting images it the best way to control what you see on your feed and what gets to the top of the subreddit*


*I am a bot, and this action was performed automatically. Please [contact the moderators of this subreddit](/message/compose/?to=/r/london) if you have any questions or concerns.*",London
"Greenwich! Get the boat there from central, walk the foot tunnel, check out Greenwich Meridian, look at the park, look at the buildings, check out the Cutty Sark, visit the market, boat back to central… that’s 5 hours easy",London
"# Upvote/Downvote reminder

Like this image or appreciate it being posted? Upvote it and show it some love! Don't like it? Just downvote and move on. 

*Upvoting or downvoting images it the best way to control what you see on your feed and what gets to the top of the subreddit*


*I am a bot, and this action was performed automatically. Please [contact the moderators of this subreddit](/message/compose/?to=/r/london) if you have any questions or concerns.*",London
"Me and my girlfriend met at the Battersea Power station opening as we’d both gone to visit it alone. We ended up spending all night together just chatting and drinking. Somehow once the night had finished she wasn’t sure if I was into her and was reluctant to see me for a bit. 

We did meet up again in spring and my god… this girl has my entire heart. We’ve now just been on our third holiday. Some might say we’re moving too fast, but I’m honestly just living.",London
"Cold approaching strangers isn’t that much different to online dating, you’re still strangers to each other and not obliged to chat or meet in person as you’re unlikely to see other again if they ignore you after giving you their number",London
"I’m going to London soon and will be staying near the Tottenham Court Rd tube station. Is there a supermarket or something nearby where I can buy cheap sandwiches for lunches? I’ve had a look at google maps but no familiar names are jumping out at me.

ETA: I’m blind, finally found a Sainsbury’s.",London
"M (38), hear me out on M&S. Underwear and basics like plain coloured T-shirts. They wash really well and fit like a glove. I've got vests from there that I've been wearing everyday for 5+ years and are still looking good. A bit faded from washing but still comfortable and warm. Worth the spend IMO. I hear you on the outerwear though. I feel like a kid playing dress up when I try on some of their clothes.",London
"I haven't been to the Soho one but I've been to the Shoreditch one for a work do and I can't imagine they're too different.

* Drinks pricy but nice. London I guess

* Music - loud, thumping, hard to hear people talk and honestly hard to think. But then again I really dislike loud music.

* Games - you buy tokens, don't remember the cost, each game uses a set number of tokens

* Vibe - again, work do around christmas so who knows what it will be like now but loud, packed, nice vibe I guess but just... busy.",London
"Il y a quelques mois dans le métro.  
J'écoute de la musique en regardant mon portable, quand j'entend des bruit de frappement très fort a travers mon casque à réduction de bruit.  
Je lève les yeux et je vois tout le monde qui regarde dans une direction:  
Y'a un mec qui se frappe la tête contre la porte du métro.
Et pas peu fort.  
Il est descendu a l'arret suivant.",Paris
">on doit attendre 4min en pleine heure de pointe un métro ligne 6 ou 3min un métro ligne 4

C'est vraiment la fin du monde...

Prends un jeu sur ton smartphone et amuse-toi, le temps passera plus vite

>Je pensais qu’avec le TT et les punaises de lit il y aurait moins de monde mais c’est pas du tout le cas !

Le télétravail n'est pas obligatoire, c'est juste à l'initiative de l'employeur

>Suis je le seul à être exaspéré

Pour pas grand chose, oui. Il y a largement pire dans la vie, tu sais.

>A qui dois je en vouloir ?

Mets juste de l'eau dans ton vin, tu ne vas pas faire une syncope pour ça.

Si les services de la RATP ne te satisfont pas, tu peux toujours prendre un vélo",Paris
"I am sorry to tell you that the North pillars of the Eiffel tower is close for maintenance. And the picture was taken at the first floor just close to the North pillars. So you can't acces that spécifique POV. 
Rénovation should end near end november",Paris
"Ça dépend de ton budget. Uniqlo est un bon point de départ. Après tu peux évoluer vers des marques plus tendance mais aussi plus chers comme APC, Balibaris, etc. Si le budget n’est pas un problème je te recommande un magasin qui s’appelle Officine Générale.",Paris
"À un resto j'ai croisé les Américains les plus désagréables qui soit. Ils se parlaient entre eux comme s'ils étaient sur le tarmac et qu'un avion s'apprêtait à décoller à côté d'eux. Absolument détestables aussi, après leur avoir demandé de baisser le ton (gentiment hein) j'ai reçu des insultes en retour. Perplexe, je demande au resto de s'imposer parce que ça gênait non seulement moi mais tout le monde aussi qui se retournait vers eux avec une grimace. Evidemment le restaurant n'a rien pu faire.
Quand j'était partie, j'ai pu entendre un ""Oh finally they're gone"".
My message to Americans: try better.",Paris
"Mon ami, j'ai une proposition également mais à la Courneuve- Aubervilliers près du RER B, quelqu'un aurait un avis à ce sujet ? 

Mais pour en revenir à ton cas , Aubervilliers commence à s'améliorer à ce que je vois , il y a pas mal de projet de construction, de maisons neuves, de propriétaires qui s'installe etc. C'est quatre chemins le soucis effectivement. C'est un peu ghetto, même en essayant de voir le bon côté etc, je ne te recommande pas. Si tu as l'occasion, prends le bus 170 ou 152 à partir de porte de la villette qui va vers cette zone et tu verras par toi-même.",Paris
"C'est tellement subjectif ce genre de trucs.
T'as des gens qui seraient bien à 2 dans un 20m2, d'autres qui étoufferait dans un 35.

Est-ce que vous êtes en TT? Est-ce que vous avez une vie sociale animée ? Est-ce que vous voudriez avoir un animal de compagnie...etc",Paris
"I remember this place. My mom used to take me there to play as a kid ! 
It's located in the champ de mars, in front of the basketball course. It's in the continuation of the street ""Jean Carries"". You can see a white square on Google maps next to this street that's this playground.
However, as other people said, about 10 years ago, they replaced all the structures and kids games of this park, I don't think this structure survived, unfortunately.",Paris
"I bike all year in Paris, 25 km round trip, leather gloves, rainproof jacket and pants, with a layer of something underneath, and normal work shoes, even the one day that it snowed last winter, no problems",Paris
"Bonjour, je suis déjà parti de Paris mais j'avais une question autour des transports -- un billet Paris - CDG est-il aussi valable pour un bus à l'intérieur de Paris?

Je sais qu'il est valable pour le métro, par exemple Strasbourg-St Denis > Gare du Nord en métro ligne 4, puis le RER B à l'aéroport.

Mais je ne savais pas si je pouvais l'utiliser aussi pour un bus à l'intérieur de Paris pour rejoindre une gare RER -- par exemple prendre la ligne 26 en direction de la Gare du Nord, ensuite le RER à l'aéroport. Ou faudrait-il un ticket T+ pour le bus et un autre billet RER?

Le site RATP n'est pas très clair, donc je voulais vous demander.",Paris
Tu as raison de t'en plaindre. Après peut être que c'était le cas auparavant et tu as comme d'habitude des singes qui font de la merde avec et donc ruine la chose pour les autres. Après je me souviens qu'à Basic fit ils avaient une fontaine d'eau aromatisée ou un truc du genre mais fallait s'abonner à un truc en plus pour y accéder. L'eau dans les toilettes était chaude et donc pas agréable à boire quand tu fais du sport,Paris
"je viens de quitter un job parce que j'ai signé c'était sur la 12, et loin donc déjà bien chiant. Puis ils ont déménagés, avant que je ne commence, sur la 13. J'espère que tous le potentiels employeurs lisent ceci, la 13, si tu veux que j'y taffe, tu doubles le salaire.",Paris
Oui sa va faire des grandes tours et on va mettre qui dedans je vous le demande et 10 ans après sa va se plaindre qu’il y a des problèmes dans ses tours de l insécurité etc mais y en a qui se seront mis plein les poches et c’est encore pas moi,Paris
Châtelet was a fort erected in the 9th century to protect the city against Norman (Viking) invasions. It helped to repell on of them during the fierce siege of Paris in 885-887. Later it served as a sinister prison until its demolition by Napoléon.,Paris
"Gneeeu j'adore les chiens c'est pour ça que je trouve que ça devrait être interdit d'en avoir pck ils sont bien plus heureux a courir dans la nature gneeeeuuuu. 

C'est la version canine de ""je suis pas raciste mais""",Paris
"J’ai été plutôt surpris par un trajet en bus, lorsqu’un compagnon de voyage s’est mis à hurler “operation Nightmare go go go” et se jeter sous les sièges. Il avait déjà attiré mon attention avec le miroir rose de princesse en plastique qu’il tenait ostensiblement avec un de ses deux moignons.",Paris
"Je ne sais pas si cela correspond à ce que tu imagines, mais si jamais il y a aussi des péniches à Conflans Sainte-Honorine qui font aussi restaurants/bars/chapelle. 

La péniche chapelle, le *Je Sers*, pourrait correspondre. Tu peux peut-être leur demander l’autorisation d’y tourner ta scène, souvent en semaine il n’y a pas énormément de monde.",Paris
"Le train qui rate la gare et fait marche arrière... le conducteur était légèrement alcoolisé... il s'est fait sortir a la gare par des gens de la SNCF...

M'ai avis qu'il a pas demandé à faire marche arrière...",Paris
"Just to help in your search, was it a flea market which we call 'brocante' or did it look like a regular thing with a mix of food, clothing, etc. Was it indoor or outdoor (they apparently have both there)? 

I'm asking because a flea market/brocante is usually 90% old objects, clothing, furniture, sold by both pros and a few amateurs or neighbors. And this type of marché is only occasional, like 4-5 times a year. At least in my neighborhood, there's an open air market twice a week, but I rarely see the brocante type.

I'm not familiar with Aligre, and the guy may just be a regular there, which would greatly increase your chances...",Paris
"I'm not going to repeat what everyone just said about the courses and the degree but there's something you have to understand is that epita is not located in Paris but in it's suburbs. Since you're a foreigner I'm assuming you won't start with the preparatory courses so you'll be located at ""Kremlin-Bicêtre"" even if the city is pretty safe it's not the same as paris and the metro to go there is one of the worst of Paris. So you should definitely check on Google maps the place if you like it !",Paris
"les francais vous etes des dingues!! T’a pas de bouche ??? Tu peux pas parler?  il a fallu que qlq d’autre le fasse a ta place ? Je comprendrais jamais votre mentalité, enplus pour dire apres tes un héro mdr mais bouge tes fesse l’amis faut pas avoir la tremblote hein",Paris
"I liked the Paris of The Bourne Identity, or MI: Fallout even. Great mood and vistas, obviously not what every Parisian would experience on a daily basis but sufficiently grounded in reality to not break immersion.",Paris
"Dans Paris, là où j'ai vu le plus de crottes sur les trottoirs, c'est dans le 16eme.

Des petits vieux qui ont la flemme de se baisser pour ramasser, j'imagine. Ou alors quand on a de la thune on touche pas aux crottes, je sais pas.",Paris
"Ca me rappelle ce canular où quelqu'un avait mis un panneau ""Chemin de Traverse"" (de Harry Potter) en carton, et suite à la détérioriation de ce dernier par la pluie, la mairie l'avait remplacé par un vrai :D",Paris
"Ça ne change rien pour les trajets en banlieue, c'est juste les T+. Je trouve ça assez ahurissant que les articles sur ce sujet n'expliquent jamais de façon claire ce qui arrive avec les tickets de banlieue - à savoir rien. Les journalistes et les communiquants de la RATP ne prennent jamais le RER ?

Sinon,  je dois dire que je serais très heureux s'ils nous donnaient vraiment une alternative aux tickets carton, mais là pour tous les gens qui vont régulièrement en banlieue (donc la plupart des gens) c'est juste une carte de plus à posséder tout en continuant à se trimbaler des tickets, je vois vraiment pas l'intérêt de ce changement. Faites un truc ambitieux qui change vraiment les choses (genre une carte avec un solde qui calcule le prix automatiquement, comme il y a dans plein de villes) ou ne faites rien.",Paris
"C'était il y'a quelque année maintenant. De passage à Aubervilliers pour visiter un musée et faire quelques amplettes. Bref, ça prit une bonne partie de la journée. Je dois prendre le tram, tram a l'arrêt tout va bien...Sauf si t'as un groupe de jeunes gens bourrés qui décides de s'allonger sur la voie du tram et de se regroupé comme si c'était un petit rassemblement autour un petit feu de camp. Il a fallu 30 minutes pour régler le souci.

La ligne 9 a certaines stations il ne faut plus s'attendre à que la normalité soit logique. Le duo Auber-Chatelêt  entre 2016-2018 était le premier cercle de l'enfer (avant que la ratp vienne prendre sérieusement le problème).",Paris
"2 post-docs I worked with were housed there, in 2018 and 2020. If I remember correctly, they got the answer within a few weeks of application. It may be good to call them and ask the timeline for their reply. The housing in Cité Universitaire is not particularly cheap, but for foreigners who are just starting in France, it's really great, as getting an apartment in the private market without 3 French payslips and with the added complication of being foreign is really difficult.",Paris
"If someone in Paris is looking at you weird, I’d say the person is a tourist. Natives in big cities will look at you doing stuff and honestly just think “they’re enjoying themselves, how nice”, because they know everyone are busy and can’t always hang out in groups. 

Suburbs are small communities and could be seen as a smaller town, with a different mentality than where you are from. Depending on the area I’d say that some people really won’t care if you’re doing stuff alone. 

Paris is an interesting and fun city! (as well as most suburbs) and coming from New York you’ll see many similarities",Paris
"Probablement un avion d'Aero Sotravia qui fait des mesures météorologiques, probablement le vol ASR1103 qui a fait un paquet de tours entre Puteaux et Montreuil.

L'avion est immatriculé F-HFRF si t'as envie de retrouver son itinéraire ;P",Paris
"J'y habite, j'aime beaucoup. 
-> bien connectée
-> on habite dans une tour en bord de dalle avec une très jolie vue sur Paris 
-> grand espace piétons. Nos enfants peuvent aller à l'école à pied sans traverser une seule rue
-> le milieu de la dalle est très minéral, mais autour il y a de plus en plus de petits coins de verdure 

Par contre pour les croissants le dimanche matin la dalle c'est bof il faut aller du côté ville",Paris
C'est un drame cet endroit parcequ'ils ont le budget pour avoir de très bons artistes mais si tu y vas pour ça tu repars toujours déçu. C'est un endroit sympa pour flex et papoter mais un vrai bise-coeur si tu aimes clubber,Paris
"Et il se passe quoi si tu as un physique au mieux normal et que le mec en fasse devient violent ? que personne ne risque de faire quoi que ce soit pour te défendre par la suite ?   
Selon la situation, il vaut mieux laisser couler et vivre un autre jour.",Paris
"Urbansoccer if you like fives, their app is awesome for searching for +1s. You set yourself as looking for a game and you'll get notifications. There's 3 football levels and even an option to get its ticket's paid for if the looking team so desires.",Paris
"Vivre et vivre en ayant la possibilité de devenir un jour propriétaire, avoir une femme, des enfants... ou juste vivre célibataire. Pas la même chose. Je gagne +60k par an mais pas le cas de ma femme et j'ai un gosse. Donc à moins de vouloir acheter dans le 93. Je vais vivre en loyer jusqu'à la fin de ma life :)",Paris
"Vu certains comentaires dans ce thread et dans [celui de l'autre jour](https://old.reddit.com/r/paris/comments/16oaagp/fin_des_tickets_ratp_de_m%C3%A9tro_bus_et_rer_quelles/) sur le même sujet, parce que les gens de la RATP/IDFM se sont convaincus que c'était trop dur...",Paris
"Malade comme un chien tard le soir, heureusement j'habite dans le 20e entre deux pharmacies ouvertes H24 et 7/7.  
Des potes viennent à l'improviste chez moi, un dimanche vers 18h... heureusement, j'ai un Super-U pas loin ouvert jusqu'à 20h !  


  
Pour avoir vécu en Côte d'Or et dans le Nord, j'apprécie ce luxe !",Paris
"J'avais quitté la région parisienne depuis quelques mois, je reviens pour un stage, premier jour de stage et première fois dans le RER depuis des mois. 

Je rentre dans mon RER bondé et je vois qu'il y'a de la place à un endroit, idiot que je suis j'avais oublié ce que cela signifiait. L'odeur d'abord, le mélange d'urine d'alcool de déjections de crasse... du sdf du rer. Il me regarde m'insulte sors son sexe et se masturbe en me regardant. 

Un chouette retour au quotidien du RER qui m'avait tant manqué. Heureusement que la sécurité ferroviaire et ses grands gaillards est là pour s'assurer que personne ne pose un pied sur les fauteuils.",Paris
" C'est pas juste Paris, c'est ça de s'approcher de la trentaine.

  
 Faut faire des trucs réguliers en dehors du taf: Sport, club de lecture ou jeux de société etc. Tu finiras par sympathiser avec des gens, certains d'entre eux t'introduiront à leur groupe d'amis autours d'un verre par exemple. Aussi, si tu es arrivée en France au cours de ton parcours, recherche peut-être les endroits où les gens de ton pays se rencontrent? C'est plus facile de créer des liens de long terme quand vous avez une langue ou une culture en commun.

&#x200B;

 Et quelques mois après ils partiront! Il va falloir refaire le boulot. Au bout d'un moment on ne finit par voir que son ou sa partenaire, qu'on finit par détester à cause du manque de vie sociale et de nouvelles idées, vu qu'on voit les même collègues tous les jours.",Paris
"Originally from London and I regretted moving from Berlin to Amsterdam but didn't regret moving from Amsterdam to Paris. I'm at a point where I'd rather live in Paris than live in Berlin but I imagine the intensity of life in Paris would feel pretty bad if I went directly.

The thing I really liked about Berlin was the ""chill"" vibe I got from it, and was always happy going back years after moving away. But 5+ years after leaving it feels a little more hectic and individual places seem way more over-subscribed than they used to.",Paris
"Je pense pas qu’il faille nécessairement 40K pour vivre confortablement à Paris. C’est sûr qu’il faut plus que le SMIC, vu le prix des loyers. Le problème se pose aussi en ce qu’en gagnant le SMIC, même en CDI, sans garant, t’as aucune chance de trouver un logement décent dans le privé.",Paris
"J'ai travaillé à la défense pendant longtemps et j'avoue que je n'apprécie pas cet endroit.

C'est extrêmement bétonné malgré les récentes tentatives de mettre du vert. Le quartier est construit au-dessus du sol donc il est compliqué de mettre de la verdure, avoir de l'eau, ou faire pousser de grands arbres.
Je trouve que, contrairement à certains quartiers de Paris, la défense n'a aucune âme et aucune culture. C'est vraiment juste un quartier d'affaire, bondé en semaine et vide le weekend. 
Sur le parvis, il y a simplement un centre commercial et des bureaux, aucune vie de quartier.
Je n'ai aucune sensibilité pour l'architecture avec de grandes tours en béton et des immeubles en verre. C'est sûrement photogénique pour certaines personnes mais ça ne me touche pas. 

Bref, c'est pas mon truc...",Paris
Bounjour! I am looking to apply for CAF housing assistance and I was wondering If I can use my Revolut account to receive it. I have found conflicting information whether this is possible - some say that french RIB is needed whereas others see that according to the new IBAN discrimination laws EU IBANs are also accepted. i would really appreciate some advice on this from someone who went through this. Merci :),Paris
If you like animals you can make a bit of cash by taking care of pets whose owners are on vacation (basically go to the house every day to feed the pet and spend some time with them/walk them). There's a website for that called Pawshake. I know some students who did not speak french did it.,Paris
"Bonjour,

Il y a cette association sur Paris: Halte d'Aide aux Femmes Battues.
https://hafb.fr/

Il y a des psychologues, des juristes, des travailleurs sociaux avec possibilité de mise à l'abri en cas de places disponibles. Il accueille également les enfants. A la base, c'était réservé pour les femmes sans abri mais maintenant, il accueille toutes les femmes victimes de violence qu'elles soient sans abri ou non

Par contre, il y a beaucoup de monde et parfois, l'attente peut être longue. 

Voilà les horaires:
Lundi: matin 9h30-12h00, après midi: 13h00-17h30
Mardi et mercredi : 13h00-17h30
Jeudi : sur rendez-vous
Vendredi :13h00-17h30

Il y a aussi le numéro violence femmes info 3919. C'est anonyme et gratuit, 24h sur 24 et 7 jours sur 7.",Paris
"Le système de Navigo n’est pas si dérangeant, surtout depuis le Navigo Easy. En revanche on ne peut toujours pas prendre des tickets origine-destination, et j’espère que c’est prévu avant les JO car 1h de queue à la machine non merci. 

Pour info, en novembre 2020 il était indiqué que ce serait prochainement disponible… (on peut pas mettre de lien sur ce sub, site IDFM)",Paris
"La ligne 13.

Plus sérieusement, ça fait un bout de temps que je ne suis pas allée à Paris, seulement en-dessous. La dernière fois, j’adorais juste le fait que c’était animé. J’habite en village avec moins de 500 habitants dont la plupart sont soit des vieux, soit des familles avec des jeunes enfants. Niveau animation, on fait mieux.

C’est fou comme j’envie les personnes qui habitent à Paris. Certes la campagne, c’est bien, c’est calme, c’est boisé et on a de l’air frais. Mais quand on est ado ou jeune adulte, ennui constant, il n’y a rien à faire si tes amis n’habitent pas dans le même village, on peut pas aller au restaurant ou au magasin facilement si on n’a pas le permis, et en plus, tu seras sûrement loin de ta fac. J’habite à 2h de ma fac et je peux vous dire que devoir partir de chez soi à 8h pour commencer ses cours à 12h, c’est pas ouf.",Paris
"Rer D, 2019, il devait être 21h je crois. 
Je rentrais du ciné des Halles avec ma copine, on allait vers Orry la ville. Un peu avant la station de Villiers le bel, je remarque un type ultra louche qui passe plusieurs fois à travers la rame, l'air déterminé et le regard fou, ciseaux à la main.
D'instinct je cache ma copine sait-on jamais. Le train arrive à Villiers, pas mal de monde descend, dont ce mec. Il continue à marcher sur le quai comme s'il cherchait quelqu'un. Et d'un coup, il commence à pister une femme. Elle passe les portiques pour quitter la station, et juste après je vois ce taré littéralement survolé le même portique. Au même moment le train reprend sa route, mais j'avais l'impression qu'au niveau de la sortie de la gare ça s'agitait pas mal. 
En arrivant à ma destination je signale le truc au staff de nuit, qui a relayé l'info à la gare en question et m'a dit que normalement ceux sur place devraient s'en être occupés. 
En tout cas j'espère que cette femme n'a rien eu, j'avoue n'avoir entendu aucune info le lendemain.",Paris
"Y’a qques années (déja!) dans les couloirs du métro je croise un saxophoniste qui jouait du jazz. Y’a une dame assez âgée qui l’écoutait aussi. Très élégante avec son petit chapeau, ses gants blancs et son grand manteau de fourrure. C’était très beau, on finit toutes les deux par discuter un peu avec lui c’est un américain qui joue aussi dans des clubs dans le 9eme. Le gars passionné, incroyable. La dame âgée était tellement émue qu’elle a sorti de sa poche deux tickets: c’était des tickets pour un opéra à Garnier elle pouvait pas y aller elle a dit au saxophoniste « vous êtes un grand musicien alors je vous les donne je sais que vous apprécierez! »
J’ai eu l’impression d’être figurante dans un film.",Paris
"Je trouve facinant les commentaires qui sous certains postes tpaent sur le secteur de l'immobilier parcequ'il est impossible de se loger (confère l'exemple il y a quelques semaines d'un étudiant qui trouvait rien pour sa rentree) 

Mais par contre, des qu'il s'agit de construire il y a une levée de boucliers sans nom.",Paris
"En vivant comme une cigale, ça peut passer. Dès que tu veux t'assurer un matelas de sécurité niveau finance ou avoir des projets plus ambitieux qu'une vie au jour le jour, ça doit être bien plus compliqué.",Paris
