body,subreddit
parisien quelques annees sans doute ligne longue rame type style sdf jambe moche l'odeur va circule soudain s'arrete pousse cris rale enerves autour s'enfuient clairement jambe terriblement vois couteau main jambe retirait petits,Paris
montreal salaire net d'environ cad loyer pense mettre cote mettre cote clairement appartement,Paris
fais skip uber doordash eat dish trouver restos loin chez pi ensuite cherche resto google partir regarde meme,Montreal
hello alors beaucoup commentaires avis beaucoup trop voit sub rempli parisien n'ont jamais passe periph auber n'est coupe gorge pop mairie fort endroits globalement ok cliche seine denis vie auber villes va profiter grand paris jo grandes transformation renovation jean renovation canal denis piscine olympique fort ligne quartiers npru renovation urbaine l'etat quartier fort gare pantin serum cela dit chemins quartier vraiment agreable fortioti dense marchands sommeil souvent dehors zoner parce chez petit insalubre conseillerai quartiers dessus plutot ligne pantin positif t'es loin eme eme eme avis meilleurs arrondissements paris p vi hoche pantine agreable auber encore niveau pantin,Paris
yeah september shock they've cross convenience,London
immeuble administrateurs mois avon compagnie gestion egalement n'avez compagnie gestion engager administrateurs probablement passer beaucoup gestion qu'ils veulent gros salaire,Montreal
london half half lie various mainly lie start,London
miss lockdown i'll delight wherever upset you… cherry,London
suffer properly actual torontonians flee hometown study several relocate somewhere afford cent,Toronto
poor bugger evict risk eviction dougie possibly disadvantage advantage poor conservative way,Toronto
minimum wage hard easier montreal bilingual bilingual job doable bilingual competition… bedroom rare except temperature extreme variation degree degrees…feel winter montreal decide constant weather…,Montreal
issue # store alot isopropyl dollar store spray bottle kill soothe itch bite,Toronto
sound american military paris american presence paris fun,Paris
idea blind eye appointment specialist h appointment pm pm doctor min they'd medication optometrist min mind prescribe blind mind hurt opto medication likely quebec compare alberta immediately propose expert refuse stupid symptom much,Montreal
neighbour loud tv loud pm tv loud dog bark loud dog,London
quand j'etais vendeur boutique velo montreal scooter reparer crevaison explique c'etait velo electrique voir oui viens d'acheter velo electrique vendeur tse peux reparer velo boutique velo specialisee velo scooter electrique tellement piste cyclables peux souvent battery,Montreal
pet folk pet trouble imagine pet due fair animal,London
solution relatively simple hard international arrive university provide residence international reasonable international international exactly review picture testimonial residence apartment unused starter unit school,Toronto
vu certains thread celui l'autre oldredditcom r paris comment findesticketsratpdem%c%atrobusetrerquelles sujet parce ratp idfm c'etait trop dur,Paris
baby formula diaper shopper diaper sale amazon formula diaper mart stock amazon shopper pm we're emergency,Toronto
charge overnight guest we're ready intimate head present ipad payment optionslol oppose tenant sex life,Toronto
weird liken list preference blank realise lovely little she'd hard middle divorce almust strange drop message we'd happy pass whatsapp profile pic,London
obviously suck however shock travel concert young man music festival mile border nothing overseas buddy party drug selfies automatically deserve piece advice,Montreal
example tech eventually platform extremely appeal customer customer base screw customer attract platform descend pointless time,London
certains parlent fort s'ils n'y qu'eux personne d'autre certaines deguisent parisienne cliche overdress mariniere rayures certains plat d'hiver prevus donner chaud plein ete soupe pendant canicule seuls client touristes plutot,Paris
grow generation london involve happy worse comment concern lately tory gutted fund transport strike shitshow brexit,London
citizen brain ray range russia's range brain system brain ray afternoon peace democracy anxiety evaporate reassure tingle collapse worth,Montreal
bonjour cette association paris femmes battue psychologues juristes travailleurs sociaux possibilite l'abri disponibles accueille egalement enfants base c'etait reserve femmes sans abri maintenant accueille femmes victimes violence qu'elles sans abri contre beaucoup parfois l'attente longue horaires matin h h apres midi h h mardi h h rendez vendredi h h violence femmes anonyme gratuit h jours,Paris
cold citran along grocery item loblaws box packet shopper product shelf grocery store's higher due convenience factor evidently,Toronto
create reduce traffic ie senior transport amount easier bike infrastructure bike anyfeel safe allow road they'll bike protect transit yet option along avoid traffic bloor mill strongly disagree safe cycle infrastructure,Toronto
island everycan't legallyjust allow others die remove anybody subsidize fight tooth nail lifestylewhich except ago,Toronto
london picture special comfortable share picture read discuss,London
fee guarantee appointment loophole waste refresh page glitchy appointment km doctor trouble clinic montreal covid appointment message pre covid clinic bonjour sante impossible appointment tip appointment clinic claim health card appointment online ramq card they'll appointment fee appointment claim ramq card fee governmental oversight bonjour sante provincial federal competition attention unfair clinic bonjour sante clic sante clinic refer dead deem fall,Montreal
however onto partner general travel single sentence reply bore partner tend bore lately term depth conversation avoid whatsapp text communication frequently rather fuel empty online chat trigger frienships,London
terme € seance renforcement corp appartement petite course pied semaine techniquement chaussures course peuvent peu cher fonction parcourues peuvent tenir bonne annee regulierement bonnes promos genre chaussures peux t'en tirer € regarde dealabs exemple souvent %,Paris
ramq three arrival similar situation eligible reason fight argue politely complaint specialist turn decision base assumption send proof later receive wife's card automatically apply,Montreal
l'endroit cool pire techno paris veux vraie vibe va soiree techno collectifs presques inconnus niveau vibe toujours meilleurs t'aimes soiree backroom y'a toujours monarch,Paris
allow ramq drug obligate pharmacy coverage insurance bill system pharmacy receive bill ramq claim past charge afterwards,Montreal
ligne heures pointe souvent bagage oublie connais cette ligne doit,Paris
attack blood everyday gym thing,Montreal
deck parisian landmark wasnt experience,Paris
example loblaws wallet compare pound unpackaged potato pound sale lb bag absurd,Toronto
west connect pickering scarborough mississauga pearson connect markham richmond hill vaughan pearson brampton,Toronto
authority council reprimand former member view reprimand request conduct resign office purpose typical hold position responsible connect millionaire suffer joke,Toronto
study permit license situation behind inside intersection spot turn literally till pm what's behavior behind till spot genuinely wonder i'm,Montreal
cad mobile include mobile g g g mexico argentina brazil dozen cad mobile include unlimited sim card mobile whenever mobile cad internet provider provider insane,Montreal
advance piece solve grand worth fix nick sale care,London
trouble highway rue camille bank petty theft violence drugsso drug avoid tunnel montreal,Montreal
unique plusieurs intersection rev denis sans lumiere velo l'arrive semble trop aveugle entre cercle complet j'en vois jours sans piste cyclable,Montreal
recommend hot club friendly travel idea,Montreal
cinema cinema loud watch original special screen director cut listen voice message whatsapp,London
ete plutot trajet lorsqu'un compagnon voyage s'est mi nightmare jeter sou siege deja attention princesse plastique ostensiblement moignons,Paris
# upvote downvote reminder image appreciate upvote downvote upvoting downvoting image control fee subreddit bot action perform automatically moderator subreddit message compose r london concern,London
toronto screw become unaffordable hole government nothing investor condo developer dont monthly apartment deal loser dont insane gas insurance rate shitty ttc somewhere min quality anymore average joe toronto,Toronto
recommend colonial describe smell taste closely link recommend someplace wine taste beer beer taste recommend l'amere boire quality subtlety aroma flavor,Montreal
remind encounter swastika draw star yorkdale dishevel random homeless stand infront didnt word stand nod gesture im brown pride pin bag pray didnt thankfully didnt get,Toronto
protest armenia armenian demonstrator march september yerevan urge solidarity ethnic armenian breakaway azerbaijani region nagorno karabakh baku launch military offensive karabakh armenian separatist anti government protest armenia demonstrator government stronger action azerbaijan,Toronto
pristine clear lakewater paris overrate american dude complain smell' bitch paris forest smell forest paris smell piss 'everywhere' river restaurantetc,Paris
# upvote downvote reminder image appreciate upvote downvote upvoting downvoting image control fee subreddit bot action perform automatically moderator subreddit message compose r london concern,London
concrete voice ontarioplaceforallcomhttps ontarioplaceforallcom savesciencecentrecomhttps savesciencecentrecom petition volunteer donate e newsletter ontario instagram twitter save ontario's science instagram twitter latest update premier ford's destructive iconic toronto landmark write councillor mpp mp ontario science fall ordinary folk fight save di pasquale david crombie somepowerful 'five issue' elect representative include councillor mpp mp ontario federal government intervene impact assessment act review province's waterfront someworth mp,Toronto
pedestrian wander bike path red menace behaviour driver commute bike bike path infrastructure resistance acceptance cycle montrealers laugh complain mostly complain anyway,Montreal
sound city's current rental demolition protection threat wwwolaorg legislative bill parliament session bill wwwolaorg legislative bill parliament session bill push doug ford axe policy let perfect enemy deal government,Toronto
transport paris gratuit quasiment gratuit francais deja payons majorite budget peu navigo budget pourrait complete n'importe quelle ressource supplementaire region additionnant tax biens personne ceux patrimoine million ici parlent tarif ba n'ont jamais regarde vie representait prix navigo budget,Paris
island impact construction popular island centropolis weekend populous montreal surround benefit transit bike transit system far perfect future fill bike healthier population sou,Montreal
clamor spa mind carpet dead migratory bird perimeter decade lease transparency environmental assessment ontario taxpayer,Toronto
# upvote downvote reminder image appreciate upvote downvote upvoting downvoting image control fee subreddit bot action perform automatically moderator subreddit message compose r london concern,London
inquietez toujours dire francais serum langue parler montreal d'ici generation b va inquietez pa,Montreal
eg crosstown road currently mess heck yonge eg simply forward head west,Toronto
whenever unusual fun london viktor museum curiositieshttps wwwthelasttuesdaysocietyorg museum novelty novelty automationcom gender freaky club pedestalhttps wwwclubpedestalcom mainhtml exceptional,London
quelques mois musique regardant portable quand j'entend bruit fort casque reduction bruit leve yeux vois regarde y'a mec frappe tete contre porte peu fort l'arret suivant,Paris
route specially morning rush express half full regular route cram sardine,Toronto
opinion savent japon bordel vivant qu'est mourrial tokyo genre million ordonne propre mourrial ba minorites veux vivre japon parle japonais agit japonais normalite meme,Montreal
steal anynail pot bike porch furniture garden furniture gnome rock security camera house's door online door share video,Toronto
exactly london victorian tenement communal garden laundry toilet later communal laundry facility indoor toilet peer wash machine laundry facility bigger london victorian access laundry copper garden,London
illegal settlement jew none jerusalem palestinian minuscule jewish today jewish acquaint behind birth israel mind cannot faith blind cruelest story ill total towards palestinian america israel disturb certain become geopolitical super volcano guarantee wreak design oil virtuous crusader human democracy decade aware situation petty nobody lift finger raise eyebrow outmiddle fear reprisal america ever raise eyebrow upon medieval government deal treat palestinian population voice folk laugh accuse support anti anti democracy subject slippery explosive word potentially derail career lead job loss ready fist fight insist they'll bully beat deep human dangerous potentially subject jump murky water shark infest water quebec award earth numerous jewish sadly ongoing tragedy displacement population criticize criminal behaviour respect palestinian vive palestine libre,Montreal
term coverage network recent compare provider orange sometimes crazy higher bouygues cheap network sfr crappy network stupidly poor customer freeorangebouyguessfr,Paris
ride island yell twice south shore summer block window yell bike path bike path nearby civility,Montreal
romantic snowy bord seine utterly magical seize moment river picnic terrace george,Paris
hey london base girl similar position hate apps coffee example along similar recently politely approach scar someone's body luck,London
ass zstick faster full major camera zcopsi idiot road rage incident idiot upset full zlane afterwards dude pass stare realize star would've kick nothing blood idiot speed zinfluence driver safe wish nothing worst,Montreal
typically download self personal trainer six huge preteen teen client body issue self esteem issue act bond lesson healthy mentally stronger physical aspect screen childhood obesity aspect happen,Toronto
underwhelming far exhibit density mostly queue queue min min exhibit installation enjoyment line,Toronto
seul solution ultime l'offre gros probleme zonage facon regler politiciens solution explication logement condo vont baisser prix qualite generale logements l'offre demande debalance montreal construire debut fin d'un projet peux prendre gros changer zonage vieux quartiers ruine politiciens savent depuis d'annees reste belle facon d'avoir faveurs,Montreal
pensais egalement l'impression calme egalement possiblement partie parce prix explose n'arrivent trouver mieux rester moins cher qu'un truc sorte ca,Paris
ah man bore list quality succeed romance woman whinging girlfriend decide glass wine tv sound option woman bitch reject romantic advance,London
infrastructure doctor longer impossible loose war roughly influx insane blame newcomer blame refuse accommodation million condo medical accommodation montreal population answer tax budget construction plateau's population ease wwwmacrotrendsnet montreal wwwmacrotrendsnet montreal population medical facility sufficient demand,Montreal
quebec announce reform class summer francizisation class winter aware class summer teacher jump gun dawson highly recommend teach curriculum faster pace rather fall winter semester program essentially level,Montreal
summer edit joke april available access via invitation register choose package three sport completely relate complete purchase however affordable eye pricepoints € qualifier round sport let cool discipline cool grand palais stade basically july phase individual sport fact available organization resell platform avoid people's shitshow accessible official e shophttps ticketsparisorg,Paris
agree pandemic base charge rarely stand overcharge,London
imagine massacre habitant certains village violent jeunes fille decapitent bebes tuent familles complet mettent leurs maisons suite,Montreal
feed squat fund transit properly let toronto fundraise highway toll gas tax let transit fail thereby problem,Toronto
speed pedestrian oakville suggestion km residential control bend summer total motorcyclist miss bend tree lawn kill gotta km time,Toronto
we're basically toronto ontario resident migrate due lower worry french,Montreal
grow montreal montreal extremely bore downtown rather suburb accessible compare winnipeg mtl eternally trip commit montreal w significant difference compare winnipeg,Montreal
due nature topic brigade evidence previous tag controversial controversial thread participate commentator must significant r toronto prevent brigade violator receive ban rule action r toronto regular punish severity ie ban instead ban controversial unpopular opinion blatant racism push racist agenda careful rule engage dialogue,Toronto
we're english send they'll advantage yr quick english affordable option,Montreal
montreal doctor quickly extra shore montreal average list ourself yet themself list,Montreal
unfortunately worse teenager throw rubbish lady disgust basically f racist,London
partner hinge single term relationship keen serious click engage partner three hinge,London
avon probleme chien partout trottoirs oui tax oui j'en peux animaux j'en peux pissent n'importe avant qu'on m'en parle,Paris
recent political development stir pot visceral hatred hindu nationalist fuel nativist tendency indian comfort toronto neighbourhood include indo sikh hindu religious weather together important offline community,Toronto
halloween corner curious host horror performance someenter room pin hole torch narrow decorate sound root touch jump scare audience artist perform similar jump scare immersive trip merci,Montreal
health screen london doctor clinic load simple lower cover medical health screen gllhfqfngazvjsaerfnfkehkxtucxnhvttxfjrvyxsdhjqvmytgwdwnwulfpnhfnbzrqywfmvhcmwttdvouevszkng,London
rien banlieue juste trouve assez article sujet n'expliquent jamais facon arrive banlieue savoir rien communiquants ratp prennent jamais rer sinon doi dire heureux s'ils donnaient vraiment carton vont regulierement banlieue plupart juste carte continuant trimbaler vois vraiment changement faites truc ambitieux vraiment genre carte solde calcule prix automatiquement plein villes faites rien,Paris
six musical write toby marlow lucy moss director lucy moss jamie armitage actor jaz robinson julia pulo maggie lacasse krystal hernandez elysia cruz lauren mariasoocompany mirvish production venue royal alexandra theatre toronto dec critic's queen brief edmonton's citadel theatre production toby marlow lucy moss's tony award win musical henry viii's ill fat wife arrive toronto luck royal beyond current dec write british duo cambridge university edinburgh fringe six reign supreme wherever play west australia broadway pre broadway include aforementioned citadel elsewhere wonder six's song catchy message female empowerment solidarity inspire design costume choreography eye poppingly fun girl pop concert pretdramatically engage piece theatre six lean stadium concept character joke consort strut onstage hold microphexclaim ya toronto tudor tour conceit six monarch repeat gruesome classroom verse divorce behead die divorce behead survive return graf crown leader band audience vote winner winner malign ill chronological female band rockin' lady queen present gallery julia pulo vivid personality impeccable comic role anne boleyn joan marcus handout winner imperious devout catherine aragon jaz robinson marry henry's older pass apossession anne boleyn julia pulo infamous decapitation england catholic church jane seymour maggie lacasse allegedly wife henry truly song six's crown jewel reason win tony score various cast album download stream marlow moss cleverly write simultaneously character belt act homage past present ruler contemporary pop,Toronto
doit attendre min pleine pointe ligne min ligne vraiment fin prends smartphone amuse vite pensais tt punaises moins n'est juste l'initiative l'employeur seul exaspere grand choose oui largement pire vie sais doi vouloir juste l'eau vin va syncope ratp peux toujours prendre velo,Paris
doctor send request mine later polyclinic rosemont hospital luck,Montreal
argument spa mad lad suggest system connection monumentally stupid idea reasonably streettrack reduce bathurst harbour car,Toronto
certain difference future sue he'd edit downvoted misunderstand civil theory,Paris
advantage fake college lie brighter future await victim currently endure crisis placate politician government political spectrum toothless policy allow success covet generation deny future,Toronto
hub landmark jewish safe unfortunately attack regard bedbug highly exaggerate usual british cheap headline,Paris
ashe add member pickering anti black racism shock upset robinson's remark ashe highlight gravity situation damage impact councillor robinson's suspension direct consequence action decision conclude ashe reflect necessity uphold integrity council maintain ethical strongly urge responsibility action refrain false harmful comparison sincerely apologize black hurt offence caneed guide nimrod,Toronto
massive bed flat twenty value half mil rest cover charge forever bill travel bed comfortably relationship fancy,London
allotment folk surprise warmth gardener horticultural society everywhere pop along chat fail,London
shopper cheaper advantage optimum certain points' pc optimum network zehr's nofrills valumart etc,Toronto
eat young young foreigner feed political f'd government party generation,Toronto
montreal safe downtown neighbourhood friendly easier european style francophone rule regard english obviously constraint welcome,Montreal
canadien vient demenager paris americain surtout jeunes faut porter vetements 'sportifs' style hoodie nike souliers nike voici illustration photosdepopcom b cecffbdebab photosdepopcom b cecffbdebab imagesmilledcom uvmxpmbmhcfag fprhbztugnpnghttps imagesmilledcom uvmxpmbmhcfag staticnikecom image fautocssrgb wclimit e ac ddde comment porter sweat %c%a capuche sweat shirt pr%c%af%c%ar%c%a toute staticnikecom image fautocssrgb wclimit e ac ddde comment porter sweat %c%a capuche sweat shirt pr%c%af%c%ar%c%a toute,Paris
i'll torontonians obsess toronto contemplate measure discourage subsidize resident everychange tax ttc fare breakeven fare slightly profitable infrastructure,Toronto
consulat instruction l'inscription demande d'une carte d'identite faut apporter apres pris rdv serum jour ligne diront,Montreal
va voir etant quartiers genre tant femme viens d'un coin calme sans beaucoup risques d'etre surbeaucoup dehors heures abord grand ax veut dire va agresser chaque coin rue projet d'achat terme nord parisien va subir beneficier gentrification va prendre beaucoup valeur style clichy saint ouen pantin montreuil vient aubervilliers ausdoucement va venir,Paris
butt properly tray drink bin fire smoke choose mindful others,London
claim witness utterly useless montreal avoid actual luck film construction worker sham tag useless well,Montreal
assume beginner believe demand lower higher higher course assign immediately beginner desperate course start,Montreal
tough position metrolinx ct responsible construction schedule metrolinxmetrolinx protect enforce contract secret major claim compensation ct metrolinx tough legal position defend claim unfortunate rip metrolinx hire contractor renovate double promise blame construction contractor,Toronto
quand j'emmene fils l'ecole vers champ tour eiffel rer passe seine tour eiffel ciel ponts dores,Paris
west tecumseth upset city's respite respite bed capaexpand bed felix profit organization support shelter turn coun ausma malik represent spadina fort obligation unhoused toronto fundamental duty resident safely must act winter approach stability statement concern locate metre mary catholic elementary neighbourhood block concern potential impact safety surround nick andrew across neighbourhood decide unfair present little little vulnerable society expose preage we've hard safe safe afraid peaceful beautiful boulevard tree pollinator garden dog overandrew add he's resident malik forum resident distribute flyer include digital soon hire engagement facilitator barnes management manage engagement hold virtual information session establish liaison committee concern,Toronto
hem burberry trench coat unpick tuck hem possibly trim mitre redo design simple fold hem agree £ sound cheap worry cut corner twice job,London
prix affiche seule choose qu'ils peuvent frais supplementaire doit clairement indique peuvent surtout autre item,Montreal
patient roster allow schedule patient appointment regular four four reserve emergency appointment monvacation overseas doctor border typical doctor patient roster patient eye patient,Montreal
j'avais region parisienne depuis quelques mois reviens stage premier jour stage premiere fois rer depuis mois rentre rer vois y'a endroit idiot j'avais oublie cela signifiait l'odeur d'abord d'urine dejection sdf rer regarde sors masturbe regardant retour rer tant manque heureusement securite grand s'assurer personne pose pied,Paris
entertain ah montrealers dead scar risk cry picture,Montreal
issue let prohibit certain prohibit certain reason race shape,Toronto
ravioli chinois recommande ravioli nord rue saint denis maison bon rapport qualite prix sinon man'ouche rue rambuteau bon enfin classique rhinoceros rue etienne,Paris
traffic presentation road footpath safest option opposite vehicle towards rather vehicle behind probability safe reaction require vehicle well,London
imagery completely ban artistic educational faith argument speech slippery slope,Toronto
