body,subreddit
j'y habite j'aime beaucoup habite tour bord dalle jolie vue paris grand espace pietons enfants peuvent aller l'ecole pied sans traverser seule rue milieu dalle mineral autour petits coin verdure contre croissant dimanche matin dalle bof faut aller cote ville,Paris
immeuble m'a demande mois loyer l'ai montre releve compte bancaire solde restant moyenne mois loyer pense besoin d'avoir bon pointage credit,Montreal
crazy lately cool sense literally fwb matter woman package supersede hot late early connection others matter interracial woman darker skin tone attractive white woman herritage exclusively older connection east london london previously,London
control apartment currenter empty unit value tenant unit blank envelope receipt previous door increase,Toronto
favorite london st church religious beautiful quiet peaceful surround history anytime london,London
serve metro's orange cheapest option directly downtown transfer flat rate zone taxi surge uber slightly value uberxl luggage likely expensive taxi,Montreal
beaucoup commentaires parlent perso quelques connaissances derniers mois vois beaucoup beaucoup matelas sommiers affaire abandonnes rue « punaises » qu'il,Paris
funny alberta dual swiss citizenwho fluent v anglo quebec resident mandatory class spread amount graduate quebec mandatory class history quebec nuanced quebec nope tuition better,Montreal
course english respectful effort province,Montreal
photograph england strict privacy photo monetise possibly interest,London
unfortunately opinion complicate history various detail superficial version breed polarise view,London
pareil aucommentaires n'y va bon techno d'un dj adore decu qualite sonore ba contre e tant attache dj veux passer bon moment l'endroit sympa,Paris
accuse threaten identifiable warrant charge arrest cp accuse suggest minor target identifiable statement harm jew vagueness article suggest indeed weird report utm jewish otherwise deserve small threat jewish fundamentalist threaten harm muslim bigotted fundamentalist article seldom restrict bigotry group,Toronto
read councillor pedestrianize majority resident vote pedestrianize ignore favour loud nimby louder help,Toronto
hell jean sartre accept liberate rock river let flow perfect rule agree exist,Montreal
z verb definition unbelievably badly condemn erasure globe similar 'barbarossa' 'hasdrubal' 'nicholas ii' usage wow adolf gaza'd eastern front,Montreal
toyota lexus fix product majority theft victim exact rx toyota lexus profit,Toronto
# upvote downvote reminder image appreciate upvote downvote upvoting downvoting image control fee subreddit bot action perform automatically moderator subreddit message compose r london concern,London
parisian sweatpants legging rip jean loud conversation disunless pub loud eat loudly stare certain societal rule litter warn norm outfit nobody care,Paris
multiple cross cross south cross south week,London
mauvaise idee trouve etonnant vont passer leurs vie prison faut montrer qu'on confiance contre gu echappes sais s'ils bon choix j'imagine vont retrouve rapidement j'ose esperer retour prison serum auscool,Paris
recommend rather agent manager blanket pet policy fairly fast success happy cat lucky,London
release ignore ahead advisory whether perpetrator race religion personally believe latter,Toronto
infant he's mannered dinner fantastic idea appropriate parent sense entitlement awareness presence impact enjoyment around,Toronto
buddhist gta buddhism stretch century accord panaioti expert buddhist philosophy toronto metropolitan university trace construction railroad worker railroad buddhism chinese immigrant arrive railroad lorna fandrich nearly later member buddhist toronto cent city's population accord statistic data wide variety buddhist worship practice slightly version religion however panaioti rely cash donation target,Toronto
room horoof constantly picture tbh annoy vigilant pull curtain room peace aware somemight inside photo constantly observe peace annoy bedroom window wake picture step picture hide asshole definitely defend picture build,Montreal
story asign lease permission spweek load preliminary organize book shelf clothe closet lock bin refill load relevant sleep lie yet teem bed bug infestation final lock midsettle sleep brand bed pre furnish previous tenant turn crux bed turn sleep charge pillow beside eye notification catch little dot scurry across screen spider somequickly turn literally dozen upon dozen tiny dot scatter across headboard pillow swarm word describe immediately leap bed abject horror tear pajama fresh clothe grab recent bag grab wallet key book several block shock finally flag taxi forever none little bugger hitch ride cab flee straight partner's soon door strip fully naked clothe wear directly double seal garage bag shower manage lease thank goodness swear idea let begarage sort fumigator apartment salvage tenant spconcrete floor garage sort everylaundry quarantine trash category officially partner store everyoutside balcony double seal bin wrap garbage bag fully treat funny fully inttogether anyway suddenly original w,Toronto
correctly answer application timeline reply cite universitaire particularly cheap foreigner apartment payslip add complication foreign difficult,Paris
insta page flag gonna edit twitter page assume @thisfunnygirl assume ok handle video insta page link x page describe quirky sense humor entertain welp edit delete twitter account,Montreal
montreal vegan montreal favorite vegan leaf location vegan coffee delicious vegan pasrecommdanoise bleuets blueberry danish amaze montreal burger fiance vegan burger fast style homemade burger contain walnut allergic fry vegan chicken sandwich amaze swap impossible burger double awesome highlight kimchi fry twice trip bloom sushi vegan sushi regret sooner return fantastic across board sushi roll happy highly recommadditionally copper branch umami ramen conceria delicious vegan italian burger fiance folk upstairs jazz vegan eggplant parm menu decent music worry food,Montreal
ah metre carres rue bretagne eme € salaire € vivais relativement truc complique k€ trouver metre carres sinon vivre largement faisable,Paris
folk albam legacy margaret howell oliver spencer uniqlo ymc decent goodhood carhartt wip norse project worth brand gramicci patagonia mont bell arcteryx outdoor wear layer multi functional style function,London
caf hoassistance wonder revolut account receive conflict information whether possible rib whereas others accord iban discrimination ibans accept appreciate merci,Paris
reddit passport office yet reach passport reddit username passport,Montreal
svp l'effet statique lumieres l'effet stroboscopique flash rapide aveugle rend difficile perception autant pietons automobilistes autres cyclistes merci,Montreal
attract woman rub chin glance counter da secret weapon dab eh riot hai karatehttps wwwyoutubecom watchvvqcxecw,London
recently photo thief approach bicycle snatch throw behind pixel others thief prefer iphones,London
internet camany become comfortable online real sadly pandemic accelerate everywhere age device five sometimes hold front fro reduce attention span speakercomplete avoid real real skill,London
issue bag milk appear fidget bag milk certain switch closure tab expiry odd occasion milk tend expiry cartoned milk,Toronto
hi press season paris bedbug population pick bedbug july airbnb th fly bag infest likelihood catch hell rid,Paris
state judge scene base half dozen interracially specifically black woman black woman simply approach black woman scold fetishising blue clear usual opener hey chocolate momma somedaft black woman simply rather approach someelse concern however delight approach,London
cannot internet consent privacy regard land although allow picture intention inside internet consent cop renounce uniform man picture complain cu b,Montreal
quebec reasonable privacy picture permission photograph photograph picture shoot portrait permission,Montreal
garage downtown toronto head islands' residents' committee downtown toronto k bungalow somewhere,Toronto
sais bon saclay orsay master math sorbonne science upmc jussieu l'ancienne apres crois mal faut croiser psl dauphine t'as surement prepas j'y connais rien dessus desole,Paris
document inform garage prior province's announcement firm secure contract ontario revitalization fact clear doc obligation assume responsibility situation contradict original development state taxpayer financial contribution design construction propose facility ontario place,Toronto
convenient opus card load onto travel load opus card effective option journey include zone ab seamless transfer entire trip,Montreal
personal evict condo later fight count pray weak fight back,Toronto
forget history remind rob ford november keelesdale mayor rob ford premier dalton mcguinty officially grind project ttc staff release report completion eglinton crosstown unlikely realistic main reason project management transfer ttc infrastructure ontario us alternative finance procurement strategy strategy contractor complete project effectively require contractor redo design complete ttc ttc warn metrolinx's aggressive timeline lead severe construction relate disruption traffic stretch eglinton avenue tear concurrently deadline enwikipediaorg wiki lineeglintonhttps enwikipediaorg wiki lineeglinton damn ttc right,Toronto
gta completely transit abysmal mississauga oakville match vast gta exacerbate touch jurisdiction europe city,Toronto
pilot waste anymore let drink disorderly conduct deal allow toronto baby citizen btw drink laughable drink condo hot summer turn cool drink inside basement apartment lol toronto grip,Toronto
# upvote downvote reminder image appreciate upvote downvote upvoting downvoting image control fee subreddit bot action perform automatically moderator subreddit message compose r london concern,London
favour join climb wall brixton full weight climb bonus climb fantastic full body exercise improve core strength joint stability incredibly muscle control movement fun satisfy trust look,London
binge watch unbreakable kimmy schmidt three anyways scene mum lisa kudrow roller coaster junkie play joke episode basically let scream soul bat eyelid entire fever ramble roller coaster,London
suck insidious bug suck bug travel anybody jump onto judge unfortunate advise stand ttc thank tip,Toronto
shelter worker mental health condition impossible medical province's solution ttc worker ttc rider somehow manage issue suppose ttc bandaid solution insult bandaids bloc torontois,Toronto
semaine quand rentre bureau banlieue proche passe bande cyclable jaune personne respecte plein voitures garees droite belle piste cyclable protegee demarre panneau paris,Paris
potential little effort installation meh conceptual art fan conceptual art imagine seek art particularly art fund involve art helm excite contemporary art associate party terrible they're,Toronto
bullhead toronto supercars across lane slow crawl piss elicit honkening clearly attempt create highway stupid drag race funniest beater jeep shoulder lmao,Toronto
chaque fois vois enthousiasme maudits dis faisiez poignarder empresseriez surement d'indiquer dude meilleurs endroits cacher corp apres meurtre pi genre semble couteau rentre veux j'te l'aiguise vite fait,Montreal
ontario worst brunt multiple issue scammy college lure international false pretense fake promise employment ghost hotel unoccupied worst doctor shortage bc fix issue latest reform poor infrastructure development alright alberta worse mile behind bc quebec,Toronto
five app awesome search game notification football option ticket's team desire,Paris
typical tag specialist appointment amount correctly clinique dermatologie privee montreal quick opinion treatment pricey clinic term clinic example refer system,Montreal
force single francophone daily faq pin sub bet reverse nearly toronto vancouver calgary edmonton winnipeg sub wonder,Montreal
sorry pillar eiffel maintenance picture floor pillar acces specifique pov renovation november,Paris
yeah weird alright okay greet tintonate higher we're yeah we're genuinely concern tintonate yeah trick answer answer eg alright immediately brit general ya how's greet interpret exactly alright provide mouth speak,London
bike paris km round trip glove rainproof jacket pant layer underneath shoe snow winter problem,Paris
champagne taste republique passerelle douanes amelie's bridge cafe mini tour paris,Paris
systeme navigo n'est surtout depuis navigo easy revanche toujours prendre origine destination j'espere prevu avant jo h queue machine merci novembre etait indique prochainement disponible… mettre lien sub idfm,Paris
capitalism capitalism raise poverty western policy refuse inflation slow economy elsewhere instead resource citizen capitalism supply chain issue grow imo thank,Toronto
control apartment nearly amount evict reason apartment literally door layout currently court situation unique sustainable we're past sleep evict,Toronto
romantic match romantically blast decide instead current partner hinge success story happen,London
quite maurilca maurilca cbc radio improve listen skill english tv radio content luck welcome montreal,Montreal
alsolve essentially unaffordable due demand supply hard revenue stream fight vacant owner perfect scenario investor perfect target luck gather support %,Toronto
y'a quelques annees avenue charles j'avais mec super agite menace frapper compagne deja detruit scooter personne reagit rue j'appelle seulement mal convaincre venir arrive tard cru mec allait tabasser pendant s'est contente partir apres menace j'avais pris photo montre flics note description tout,Paris
apartment officer gilot it'll frequency smell urine unknown source random corner dog poop skip sidewalk lucky ankle trotinettes apparently rid boulangerie client road hazard block traffic spit frequently muslim mine illegal muslim laugh common ramadan fast period british standard courteously front regardless racism echo chamber disguise initially immigration reform idea discussion transform outright racism demographic %'s touchy subject easily sweep rug mainly witness full member ethnic lambast table peak election cup season,Paris
article highlight accord ontario rental registry design profit vivre launch transpareliable information renter policy maker tenant opportunity basically comparison mike moffatt found director smart prosperity institute partner launch vivre university toronto deal rip vary widely longtime tenant control apartment hold relatively affordable ontario control occupy tenant charge whatever renter black hole information neighbour voluntary transparency otherwise operate dark matter worst behavior relation tenant reference link article relevant rentalregistryca registry,Toronto
comprends tellement probleme quand quelqu'un imite qu'on toujours demander s'il fout gueule arretez inconnus gen,Paris
c'etait y'a quelque annee maintenant passage aubervilliers visiter musee quelques bref prit bonne partie journee doi prendre tram tram l'arret va biensauf t'as groupe jeunes bourres decide s'allonger voie tram regroupe c'etait petit rassemblement autour petit feu camp fallu regler souci ligne certaines faut s'attendre normalite logique duo auber chatelet entre etait premier cercle l'enfer avant ratp vienne prendre serieusement probleme,Paris
various famine pestilence terror heaven sausage roll £ peter,London
delay report claim tag policy brand owner's identify vehicle receive notification location base deny,Montreal
currently energy tosound rarely meter overclock somemention prmess hundred reason errant appliance neighbour shenanigan unplug everyexcept appliance meter read min apart repeat appliance discover anydrain power test energy action anyway,London
mid grow play grass syrinx lie play witness share weird village gay wave gentrification poor push room descendant faubourg m'lasse safety gay necessity neighborhood afrench wave feed plateau rise settle preshistorically poor aanglophones plate ontario york village neighborhood prescontinue frontenac hochelaga gentrified airbnb hoflipper continue chase population anowhere dirt poor frifamily drug fripandemic link mentally ill cast ahome crack homale female prostitute split saint catherine ontario aroof network anymore situation revert balance somewhat era current situation worst ninety hell angel v rock machine skinhead cobut sad invest communal kitchen roof accept addict reduce harm fight chase ahoadvocate serious investment hohoflip contribute buyer historically rental neighbourhood extra income hosorry rant lest formemory faubourg people,Montreal
aftermarket tracker properly instal havoc vehicle communication system control unit awake send wrong signal improper wire tap cover manufacturer warranty factory instal lexus toyota steal easily news steal easily,Toronto
j'habite justement e quartier dont quand venais paris ado mi loyer tellement cher qu'ailleurs paris l'appourri j'occupe l'impression d'en peu tour beaucoup beaucoup touristes toute l'economie tournee vers cafe boulevard saint germain d'etre ridiculement chers remplis touristes jet setter autres mondains venus exhiber statut difficile circuler certaines rue pietonnes rue buci… tant autochtones appartiennent principalement grande bourgeoisie specialement milieu prefererais cotoyer moyens permettaient quartier autrefois populaire artistique vit image alors devenu l'oppose etait l'epoque l'a rendu celebre artiste laisse marchands d'art petits commerce salles spectacle boutique luxe con rue belle send toujours paris historique enfin celui xxe siecle l'emplacement ideal deplacer n'est quartier lequel reve passer libre,Paris
animal pet whose owner vacation basically fee pet pawshake french,Paris
# upvote downvote reminder image appreciate upvote downvote upvoting downvoting image control fee subreddit bot action perform automatically moderator subreddit message compose r london concern,London
lexus vehicle steal exact levine he's upset ttc provide security brutal steal elsewhere ttc apparently,Toronto
read somewhere vincent small office toronto sear merchandise loft curate artworkshttps jamiebradburnwritingwordpresscom vintage toronto ad vincent collection art sell sear roebuck catalogue neat piece history,Toronto
toronto association civilian worker join suitable union teamster effectively isolate support netcan't union card hold certification vote employee specific successfully form union join,Toronto
patrick covid hand return younger brother wife mid busy stage hall various performance half hall display sale sale litter room otherwise remind everywhatca dad sp£xx inherently pointless book early tee shirt lanyard patrick tee shirt lanyard everyjealous awesome daughter boyfriolder wiser research decide mystery box con anyway mystery box confirm indeed con mystery box wife chat indiana jones someco play patrick recognise chat peter cullen voice optimus prime stand afterwards shock he'd yet fantastic thexway conversation indiana jones boyfrilean forward quietly woody toy story laugh truly worth go,London
europe phd program sense anglo recent phd specific project specific supervisor phd exact institution affiliate administrative detail research unit supervisor landscape academic institution horribly complicate structure include overlap complex relationship hand institution affiliate hand murky anyclear stage specific unit researcher fund opportunity phd polytechnique wrong university reason limit particular institution specific research unit supervisor academic field pointer,Paris
let reflect fact original deadline announcement metrolinx totally imagine organization via vester horrible manager via political interference totally bust,Toronto
st laurent vegan bahn mi fake chicken beef vegan pho type soup vegan ice cream oh hand card reader tip super nice,Montreal
believe wfh agree wfh society article interviewee's completely tone deaf sense beaverton spin,Toronto
greenhouse specifically allow photoshoots several aware request special permission botanical garden several greenhouse well,Montreal
commentaires certains franco canadiens sujet accent francais suppose origines depuis trente surtout travail alors famille installee continent depuis e siecle compatis,Paris
suggest success drink pilot easily fentanyl meth pilot project allen garden,Toronto
soy protein baby formulai imagine isoflavones read ithttps wwwhealthlinecom nutrition soy formula#benefits funny sad quickly mind study galactosemia hereditary lactase deficiency medical condition prevent baby natural sugar milk soy formula harm isoflavones heavy effect hormone treatment menopause promensilcouk product original,Toronto
possible branche voici mode operatoire travail rapidement envoy cv boites d'interim t'interessent appelles chaque interim h apres envoye cv ss'il ete recu ss'ils mission vont dire vont dire qu'ils regarderont rappeler cest partie importante rappelles touslesmatins h demandant s'ils mission chier n'est cringe montre justement veux travail sais communiquer facon professionnelle leves matin applique lettre recommandations pense d'ici semaines max travail,Paris
research project agree organization staff glad serve meal holiday continue,Toronto
german travel okay realise greet genuinely concern emotional state everyday nah sorry polite,London
sais cela imago jamais auspeniches conflans sainte honorine font ausbar chapelle peniche chapelle sers pourrait correspondre peux demander l'autorisation d'y tourner scene souvent semaine n'y enormement monde,Paris
tour abandon proper secret tunnel tour round secret tunnel whatever cool tunnel,London
winner dinner jules verne atop eiffel breath view paris observation deck iconic landmark sacre cur tour montparnasse grand arch l'arc triomphe cigarette stack nothing dinner l'avenue ciel atop tour montparnasse vespa scoot cafe luna clichy caulaincourt late adult beverage prior hit eclectic quai grenelle pont grenelle finally amazingly fountain porte st cloud traffic circle bolougne billancourt dark pipos latin quarter,Paris
windmill arkley 'just' london barnet convenient wife's son's football it'd perfect actual windmill indoor pool dibs example wwwrightmovecouk # channelresbuyhttps wwwrightmovecouk # channelresbuy,London
general y'a moyens d'avoir gratuitement pris charge mpr visiblement serum s'adresser ecoles forment futurs podologues ecole danhier exemple amene petit pourboir etudiants quand va sympa,Paris
pense necessairement k vivre confortablement paris faut smic vu prix loyers probleme pose qu'en gagnant smic cdi sans garant t'as aucune trouver logement decent prive,Paris
personally quite random conversation route respectful medium force reciprocation ball court let reach,London
flat £m contribute supply endorse development everywhere exception,London
toronto alot queer friendly bar drink saw white supremacist recruit black girlmid they've embolden figure recruit,Toronto
lifedrive manufacturer minimum hell essentially necessity specifically kid,Montreal
information steal newborn baby childcare information imply receive childcare mainly baby newborn pregnant woman clarification nimmediate baby period minor affect,Toronto
incredibly specific wild assume wear kippa anythough somewithin year,Montreal
semaine passee j'y passee velo dame avant velo tenter dedans voiture alors qu'elle traversait l'intersection c'etait vert velo voiture voulait tourner droite reste priorite pietons vont droit s'arreter laisser voiture passer j'arrive l'intersection feu etait passer rouge attendre tour m'a laisse loisir voir autre belle infraction rachel bloquee voie tourner gauche provenant lorimier bouge n'a plu dame file sortie voie depassement droite tourne gauche devant file sauf rachel etant toujours bloquee arreter bagnole passage pieton video,Montreal
older heat pump oil furnace electricity heat cool include tank oil average heat oil eventually expensive unavailelectric dual energy save hopefully propane natural gas oil heat effective efficient ultimately save upgrade save case,Montreal
real launch development ellington crosstown disaster road disaster chow must sleep fund,Toronto
recently analysis basically footfall pre pret raise inflation maintain turnover swear boot meal deal lunch e challenge whopper pop article hat partly correct pre covid transaction september transaction london worker ouch london london west london suburb london airport,London
y'a annees deja couloirs croise saxophoniste jouait jazz y'a dame assez agee l'ecoutait elegante petit chapeau gants blanc grand manteau fourrure c'etait beau finit discuter peu americain joue club eme gar passionne incroyable dame agee etait tellement emue qu'elle sorti poche c'etait opera garnier pouvait aller dit saxophoniste « etes grand musicien alors donne sais apprecierez » l'impression d'etre figurante film,Paris
hi quick ive purchase london cant figure londonnewyearseveseeticketscom wwwlondonnyefireworkscouk terrible sell slightly illegitimate anyexperience method,London
violation notice require minimum cent yard must soft landscape state must correct violation compliance trivanoic install turf concern remove file ignorance bylaw win defense government reach personal enjoyment personal personal property,Toronto
sorry london capital western easier population wise spare sample size encounter exactly robust lamentation reddit cruel,London
avoid program gang drug possibly drink idiot catch camera extreme organize neighborhood watch sound resort almost,Montreal
trip single foreign london awful worth trust,London
earn decent salary stable job toronto spouse infrastructure age woefully insufficient grow population toronto toronto list medical educational scarcity density lead tension along socioeconomic racial cultural negatively impact mental health teenager today trade cottage country…,Toronto
