body,subreddit
francais etes bouche peux parler fallu qlq d'autre fasse comprendrais jamais enplus dire apres hero mdr bouge fesse faut hein,Paris
fit together weird pre pandemic let's grow conversation exist,London
hopefully global launderers organize crime link 'families' lead connection contractor link italian organize crime union debacle,Toronto
ah cafe hookah quartier latin comedie venez voir six standup incluant favorite gong membre d'un ancien adore quebec ainsi qu'un gagnant olivier podcast,Montreal
common add table size tip add customer odds tip remove manager involve argument slow cold main arrive twenty others nobody complain special,London
issue english who's entire insist relationship,Montreal
announcement version extremely laugh cuidado anden,Paris
personne d'un bout l'autre trajet debut croyais qu'elle etait telephone parlant vachement fort quand continuait parler langue sans telephone juste main levee sais etait n'osait rien dire,Paris
copper branch bowl swap rice salad general tao bowl avocado red vegan general tao tao treat kid,Montreal
entre cafe arrive juste derriere derriere d'autre immediatement apres passe porte porte derriere s'arrete pognes porte pardon passer porte manque patience generation entre derriere rit membre r quebeclibre sans aucun doute,Montreal
downtown exotic candy store eaton surround south shore crazy grocery reserve luck,Montreal
vu mec gros gueule essayaient ligne parce rame etait trop pleine allait mourir pouvoir respirer vrai rame etait quand bout commence rame autre mec pousse dehors rame parce etait femme critiquait facon agir,Paris
affordable likely reduce current homeowner equity current homeowner likely ie older boomer impact millenials manage affordable £ boomer equitybut millenials beat odds ladder rate climb recent rate millenials ladder double whammy negative equity rate unable sell unable afford ive manage ladder affordable,London
cet ete copain super difficile niveau bouffe produits laitiers trouver resto fasse plat tente ete galere paris entre quartier eme autres resto peu cuisine asiatique beaucoup moins mal trouver endroit sympa manger,Paris
wwwrecycleyourelectricalsorguk electricals campaign electricals item functional charity pat test believe waste product tax product,London
homeowner believe majority neither upset vote bloc via policy threaten value investment add fuel fire issue address matter national option effective stance toward global fund tax nation flurry resource consume revenue collect corner operate concern elsewhere fall behind homeownership bubble risk pop,London
paris identity mi mood obviously parisian daily basis ground reality immersion,Paris
ligne vers h femme visiblement probablement sdf abraham animaux compagnie pot pourris puis clou spectacle castagnettes poche entame interpretation assez heureux etait metre sortir avant rire ligne entre fabien pigalle mecs clairement sobres rentrent parlant fort ouvertes main bousculent bousculent ceux cote occasion bref clairement genre dont envie vite sais ete declencheur exactement soudainement autre mec leve balance gar genre patates dont tete strapontin reagir wagon,Paris
tenant involve proper save withhold separate ltb ltb owe withhold sideways tenant arrears lead eviction credit rat impossible fresh payment eviction,Toronto
uk crime thread uk london simply society function daily specific yet present action address shed society simply let crime much,London
fleuve risques sinon va jamais pouvoir profiter manque riviere prairie ausmeilleure gestion matieres residuelles arreter chaque logement mette sac vidange bouffe rue ecureuils autres animaux mettent parcloche endroits strategiques vraiment super plusieurs bacs papier verre autre recyclage composte provincial toilette publiques vieux montreal auto nettoyante devoir payer utiliser elles papier toilette masse plusieurs belle fontaines d'eau potable juste petite fontaines parcs belle reviens suisse y'en systeme transport commun application mobile lequel acheter billet qu'on montre voir reel rendus rem capable adresse depart adresse donne plusieurs option duree trajet transfer necessaires qu'on obliger montrer titre transport suisse probleme autorites font confiance population controleur prend salees vrai reve transport commun nationalise qu'on systeme incroyable quebec rem fassent d'une seule compagnie qu'on seule application mobile capable ecrit haut oui passe semaines suisse systeme transport commun incroyable,Montreal
giant tiger lad lowlaws repack expire meat till turn colour pre marinate meat worst offender oldest expire dunk sauce shelf extra week,Toronto
longueuil terrebonne vaudreuil charge montreal driver fee cross montrealers toll island,Montreal
tellement genre trucs t'as d'autres etoufferait etes tt vie sociale animee animal,Paris
cet endroit budget bons artiste va toujours decu endroit sympa vrai aim,Paris
heavy people's resource idk restriction single must facility hotel must convert value square meter gutting middle men value regardless value view unoccupied tax future government project choose reliquish unable sell future project renovate sell add fund base maintenance occupy worthless tax otherwise exploit independant body remain protect repeat offender involve future project must sell agreement edge detail fill solution complain problem,London
throw future preach view conflict byproduct ongoing mental health crisis,Toronto
wwwrecycleyourelectricalsorguk appliance functional stick trash nothinghttps browse completely others,London
mostly english link page osler idea calendar calendar luck,Montreal
paris weird native busy suburb smaller paris fun suburb,Paris
what's available mid november likely appointment mid november tire summer season tire shape,Montreal
payer titre transport simple suffit feu paris faut envoyer sm montrer conducteur trouve paiement carte tellement mieux simple edit encore sm recent avant d'espece l'appoint comprends pourquoi paris n'a encore mi place,Paris
currently paris initiative travel study multiple counmeet american elsewhere situation discuss behavior online usual stereotype associate american behavioral issue anymain obnoxious loudly attention behavior discretion philosophy elegant chic behavior historical relevance hotel subway act untitled self behavior adapt culture rome education culture culture counfluently cannot google watch youtube mindespecially culture thousand tradition remain curious ignorance fully culture act everybody english word english slowly articulately american pace native pleasantly surprise fluently rather everybody adapt sound body customer king study rather customer king consecutive shitty customer customer,Paris
million london literally london busy suggest paulo let tokyo seoul shanghai… hopefully teach literally million settlement special earth literally thing,London
sorry comment faites pitie entendre plaindre vecu derniers campagne ici s'appelle ginette bill covid vacciner g reste mot vocabulaire j'envisage justement demenager paris vivant amis ba facile j'en fais rue,Paris
marque peu auchan vend sou marque fabrique carrefour fabrique possiblement fabrique israel l'usine ferme deja quelque proximite moins d'en trouver fabrique russie feather dur trouver,Paris
asia's major blow western europe behind compare tube tokyo hong kong seoul,London
wimbledon host monday monday wwwfacebookcom meetupmondays wwwfacebookcom meetupmondays cafe pub host reduce loneliness pub repeat customer exchange coffee,London
answer chain across england crap arse support independent amaze independent london practically refuse chain insist,London
opinion million rely rate 's longer,Montreal
petite vi moules mal nuit notamment cote entreprises balard celton permettent rentrer paname,Paris
commemorative laquelle cone s'y trouvait legende dit cone quitte commerce lors conquete coupe stanley canadiens montreal repose,Montreal
j'en transport m'a vraiment traumatisee laquelle encore souvent alors s'est passe l'histoire va suivre nsfw plein ete mec l'epoque copine prevu s'envoler l'espagne prend lille rendre l'aeroport joie bonne humeur fils entrent commencent raler parce valise bloquent ni ni passer cela calme monsieur commence insulter savez genre d'insultes sexistes degradantes qu'on souvent quand femme robe trop content partir espagne alors gaffe gar insulter fils d'une douzaine d'annees laisse couler tourne passe autre choose discute d'un coup pote regarde dessus decompose retourne voir trouble vois mec masturber quelques etait l'air regardant droit yeux haine etait regarder etait choque sou m'a penser souvent vu pere devant pire cette scene tellement choque qu'on rien su dire rame petit seul cingle pere m'en veux beaucoup n'avoir j'aurais pu changer vie gosse j'avais crois j'etais trop sideree reagir correctement,Paris
quiet hill triangle peace quiet ideal detach wwwrightmovecouk £m invest stamp duty fee furnish across south london perfect station's real afford bed flat i'll settle,London
thank reply office sell travel card uk resident hard prepay credit card welp lesson travel back,London
grow thames air raid flood occur trigger occasionally neighbour war listen gracie must go,London
rate gare marche arriere conducteur etait s'est sortir gare m'ai avis demande marche arriere,Paris
cancel random item miss ubereats refund delivery mandatory fee delivery delivery minute,London
currently available suspect threat locate sheppard avenue west dufferin officer search locate suspect arrest,Toronto
dog tarcontrol noisy owner murder orient express type bunch feed neighbour chip rid problem,Toronto
royal festival hall ideal busy monday tuesday spot,London
doctor list oh impossible appointment gonna luck,Montreal
grocery cook meal flyer advantage discount inflation product altogether discount pre meal mind product,Montreal
probablement d'aero meteorologiques probablement vol paquet tour entre puteaux montreuil f t'as envie itineraire p,Paris
supposedly yoghurt pret manger vegan wrap tear inquest death woman severe allergy newsskycom story yogurt firm tear inquest death woman severe allergy,London
t'en plaindre apres c'etait auparavant d'habitude font ruine choose autres apres souviens fit d'eau truc genre fallait s'abonner truc acceder l'eau toilette etait agreable boire quand fais sport,Paris
thanksgiving send message holicollapse earth,Montreal
river thames double waterloo across ben cold air royal festival hall oh across nk thank heaven bless london american stick finger electrical socket love,London
quai surtout quand pouvait voir dame moins rue dieulafoy e quartier croirait partout sauf paris maisons fleurs arbres,Paris
growth slowly separate unfortunately include extremely lonely deal tok mental health emotional moment relate type adhd wild mood characteristic borderline personality fun trigger tough moment extremely acurrent childhood wind allow become boundary relationship forward emotion trigger tornado inhead deal teach important lesson late gym confidence boost emotion love,London
chatelet fort th protect invasion repell fierce siege paris later sinister prison demolition napoleon,Paris
future sadly complain strategy employ together complain effective subreddit deal issue r,London
generation serious emotional issue longer decide woman realise idiot criterion strict complicate black black woman technically race largely black woman black woman london personality wise black dialect london melodeath fan play video game rugby american football black idk goth grungers roadman fit black woman,London
corner ever extra truck they'll bike vehicle,Montreal
multiple shelter nearby feed regularly donut meal various charity organization shortage,Toronto
simple instal system activity neighbour film inside audio active video evidence chillaxing quiet crazy woman bang door video solve issue,London
theater similar recent negative review online lessen suggestion smaller,Paris
suggestion sole together umbrella watch romantic movie cinema quarter latin sex choose excite paris secret tattoo paris tattoo roleplay bar pretend tour vintage beautiful citroen cv version weather allow picnic shoot photographer box shoot ie eiffel help,Paris
l'epoque grand pere annees certaines personnes depuis chine sans ni francais ni aller d'une autre l'epoque cure qu'ils c'etait petite historique,Paris
brand product colacao bean rice meat cash man meat expensive quality bakery bakery,London
fan coffee commute notice coffee p term £ capucino,London
man strike conversation join cigarette ruin personally tend issue,London
option generally state proper personally avoid viagogo royal hall sometimes feed lead well,London
anti safety tenant uo return deadline advise behind likely scare uo reduce offense camera asap,Montreal
job concise elicit response avoid rapport passenger potentially mislead officer false answer false pretense,Montreal
edit probleme semble spot malheureusement risque eviter paris sauf suivre collectifs « cool » toujours techno voir ba regles malheureusement scene techno s'est mal deportee vers dehors paris qualite aleatoire y'a virage kilomsemblent correspondre l'aspect peu hard sinon plutot tendance rester valeurs petite salles gare mine rex machine fonction encore assez peu regles generalement passe h ra dimanche voir truc plait envie decouvrir suivant seule constante paris plutot collectifs quelques collectifs newtrack hors sol alter paname cracki organisent soiree regulierement gerant spot artiste bonne ambiance ambiance toujours techno permet peu musicalement gen,Paris
hi ivry connect paris paris far roquette bagneux paris paris deptwo subway rer huge boost ivry seine bagneux,Paris
ct super slim fit slim extra slim super slim similar taperedmenswearcom blog taper blog charles tyrwhitt super slim fit alternativehttps taperedmenswearcom blog taper blog charles tyrwhitt super slim fit fit clothe men design wide shoulder narrow waist,London
london random stranger conversation rob sex random stranger,London
doi l'entreposage dechets jour collecte partout quebec immeuble n'a poubelle commune t'en procurer jour collecte prends sac depose devant immeuble laisses poubelle chez,Montreal
multiple say,London
alright appreciate lead surprise immersion accent hate accent,Montreal
sound trust instinct shoulder colleague situation safe late sorry thank share hopefully return,London
piste cyclables hidalgo j'imagine aucun autre candidat qu'elle mettre mairie coalition entre mairies peu voit vieux con refractaires permettent d'emmerder majorite vraiment cycliste selle paris suffit voir nombre grandes piste j'espere juste voteront consequence perenniser annees,Paris
wild report interrupt jump onto colder desperate way,Montreal
mandatory bar bathroom mandatory glass water,Paris
gang south mostly brixton significant gang numerous estate kennington estate literally spill nothing poverty everywhere sub pathetic postcode war thin music obviously area,London
dish quality generally generally dish budget stun worth,Paris
surprise london nothing due culture job teacher parent contribute factor,London
forever fact average ncr murderer wwwjusticegcca eng rp pr csj sjc jsp sjp rr phtml rid subway,Toronto
someryerson recent study engineer late aught amc personally concert fact desire decrease dramatically retail amazon sam yonge gould hmv sunrise nearly decade longer flagship store selection elsewhere entire state yonge immediately dundas gerrard awfully depress pandemic widely responsible recover somewhat ironic ryerson slc arguably stretch hard rock cafe establishment yet shopper,Toronto
government hold white attend participate elder grandmother scoopers eye execute attend event,Toronto
rule must english parent eligible english subsidise english quebec qualify english partner australian presumably attend english primary qualify rare narrow exception lbpsb fill basically instruction exactly sole exception separate purpose relatively historic minority anglophones generation recently residence category reside warrant school,Montreal
shoot apartment across mine begin member chill davenport dupont area,Toronto
green tube aka evacuate cop terrorist instead scar annoy pret full joy wonder 'i commute london beautiful river' celebrate heatwave pub stand pub football fan crazy pack tube fan let smoke evacuate celebrate fan block road somehow become common shrug shoulder forward bother cab transport foot hurt amount fortnums load nonsense,London
toronto star timeline greenbelt scandal agree conclusion likely member ford caucus fall sword provide ford plausible deniability defense cut chase star editorial rcmp's sensitive international unit announce investigation ford's office government fully co operate tolerance wrongdoing involve decision greenbelt land letter statement sentence demonstrate investigation denial deflection defence indefensible refusal consequence premier fact demonstrate tolerance dodgy dubious accountability scandal government cabinet minister clark rasheed senior aide dive opinion poll ford's investigation outcome relieve political future,Toronto
prends rendez sociale mairie arrondissement pourra guider trouver d'hebergement aide toute marche suivre changer vie moins traumatisme bonne n'est jamais trop tard changer destinee,Paris
shoot bullet wave magical white flag spark international incident prompt invasion spark international incident oh delightful,Toronto
random loudly whether etiquette bonjour enter eat foreigner convention certainly paris laugh ridicule certainly whereas happy flatter attempt eastern europe latin america hospitality eat urge guest eat encounter shame eat highly sensitive type receive downvotes,Paris
heavy metal variety montreal metal scene fantastic saw corpse birthday dozen beer pat wish happy birthday crowd course montreal heavy metal heavy mtl die covid death,Montreal
honnetement internet n'a besoin d'etre refrigere garde longtemps fais min avant t'en servir garde facilement mois peux trouver petits pot general fois vendre va acheter gros seau,Paris
bonjour deja paris j'avais autour transport billet paris cdg ausvalable l'interieur paris sais valable exemple strasbourg denis gare nord ligne puis rer b l'aeroport savais l'utiliser paris gare rer exemple prendre ligne gare nord ensuite rer l'aeroport autre billet rer ratp n'est clair demander,Paris
autres probleme apres chiens ramasser crote franchement fois demande crottes chiens vu taille pire pire petite rue,Paris
chef instead cut kitchen chef desperate cook,Montreal
asian compare lockdown quality dramatically trust medon't ask,London
kill reckless cadeath higher suspension license license suspend suspension reasonable risk idiot,Toronto
actual southbound ramp mccowan sadly wonder attempt cross ebike egregious though,Toronto
honnetement vais sans physiquement impossible oublie suite personne moins moyens mirobolants deja etant galere sans nom alors,Paris
vivre vivre possibilite jour proprietaire femme enfants juste vivre choose gagne femme gosse moins vouloir acheter vais vivre loyer jusqu'a fin life,Paris
maire vient d'etre placee garde vue e illegale d'interet projets construction mondehttps wwwlemondefr decodeurs article marsigny maire noisy grand placee garde vue affaire financierehtml#xtoral,Paris
drapeau palestine cette semaine envoie message vois etes contente israeliens ete shani cafavre paradee rue,Montreal
what's ban pet renter encounter scenario permit dog dog owner clause unreasonable longer dog allikely engage behaviour attentive dog owner claim clause hard dog several someelse lodge however however,London
man half meal deal fancy decline dont common older men flirt uk rather shut soon sorry experience,London
vivant passer veux t'assurer matelas securite niveau finance projets ambitieux vie jour jour doit complique,Paris
article clear batey shock lynn deutscher kobayashi president national association japanese najc greater toronto chapter complete october bell rewant notify particular piece dismantle estimate timeline later provide najc ontario's ministry infrastructure bell relocate ontario timeline state dismantle removal bell slat begin monrun october storage oct construction begin thereafter,Toronto
moyens peux gros suivant chargent trouver apparte visiter attention contre quand renseigne c'etait €,Paris
popular opinion race instead class lower class disproportionally minority commit crime white lower class exempt commit crime higher systematically discriminate poor class require major nearly measure affirmative action class base race base,Toronto
shortsighted stupidity enable transportation beneficial traffic hard really…,Toronto
risk whenever bonus fire hydrant gonna assume ticket's windshield what's legal clearer,Montreal
entre prix quartier touristes bonne partie cafe procope touristes tels font pression l'edition gagne,Paris
package nearby office verify otherwise amazon specifically amazon drop package door steal trash package theft neighborhood,Montreal
store paris beautiful sell bust napoleon cheap € unique definitely store beautiful,Paris
attract suburb font transport commun faut pire vouloir traverser auto visiter montreal suburb adequate functional transit system ny tokyo pa,Montreal
defense pendant longtemps j'avoue cet endroit mettre vert quartier construit dessus sol complique mettre verdure l'eau pousser grand arbres trouve contrairement certains quartiers paris defense n'a aucune aucune culture vraiment juste quartier d'afbonde semaine weekend simplement commercial bureau aucune vie quartier n'ai aucune sensibilite l'architecture grandes tour beton immeubles verre surement certaines personnes touche bref truc,Paris
weird older upstairs young cry ever they'd baby fact disturb noise flat louder others complete v sound inconsistent definitely three board creak assume fee creak bedroom weirdest suddenly significant noise realise unneighbor shrug imagine beyond cease human activity unreasonable,London
i'll hate truth moral ethical obligation frenchor english montreal english 'getting communicate suck write advertise suck constant reminder insult waste x stupid communicate fraction lower lower island recommend whether duolinclass fluent suffer tgenerally acclimate personally english difference,Montreal
hello femme ici pris plein fois rer b tard souvent dernier d'ailleurs aller antony massy jamais trouve notamment antony encore beaucoup pire vu mec wagon l'odeur c'etait horrible bon c'etait craignos vrai rer globalement plutot rempli trouve craint trop cote jamais allee loin massy moins fan prendre rer gare nord contre beaucoup craignos chatelet soir trouve tant fille plusieurs fois noctilien denfert antony peux reserve certaines globalement va peu,Paris
monday release representative customer major wireless connect g text stream ttc subway system,Toronto
ctv toronto arthur vale bore monotone channel induce financial news journalist television succeed determine manage viewer sport report inform entertain tenure,Toronto
underwear plain colour shirt wash fit vest everyday wash comfortable worth imo play dress clothe,London
beau tellement beau chef connerie grand genie pense tiens pourquoi prisonniers bois grand region,Paris
full brit fly daily crap hotel tend bed bug fake far,London
bank draft fake clear bank anymore bank draft daily bank wire expensive safest option seller buyer trust seller transfer ownership wire complete,Montreal
notice bag block others become amount bag,London
asylum seeker real immigration minister international quiet loud lucrative asset,Toronto
ok dog behaviour recommend dog advantage free,London
who's girl earl's court huge display affection,London
va mayfair club mayfair club upgrade gym busy london gym,London
stranger others desperate comment suggest message type woman girlfriend fun calm interracially girlfriend asian,London
exhibit except accessible culminate deafen driver honk nearly dozen driver block box,Toronto
london value £k main residence council tax council tax value £ million london £k council £k ownership,London
downtown someimpressive nathan philip square kinda past they've impressive wtf lift concrete slab foot print fall garbage underwhelming tone rest saw reliance immersive art blah lake projector fee bird imagine nature wtf lower i'll enter fund art installation i'll traffic onramp gardiner sensation traffic i'll print imagine stick traffic,Toronto
inform write mine extra nothing google rental agreement tenant sign,Montreal
others system quality treatment example dad cancer girlfriend neurological illness access doctor access expensive medication parent financially ruin dad simply dead opposite doctor random doctor assume,Montreal
agree suggestion thread reality reduce overnight economic solve issue approach focus three stability worth save supply attractive empty restrict activity rental inflation policy eviction purchase cheaper young buyer eg suggest stamp duty sale rather purchase guarantee stamp duty buyer benefit inflation fair share introduce rental tax higher subsidise conveyancing ftb cost,London
chez femmes tire quatre probablement veulent absolument touristes genre petite robe fleur recemment portant genre chapeafeutre l'automne portant panoplie apprete semble copie d'ailleurs sinon stereotype panoplie touriste moins moins quand beaucoup curiosite tendances pareil reste groupe,Paris
ontario onto gear inlow inlow asset arbitrary poverty remove list pretend list shorter incan't afford list,Toronto
theatre box office sell programme theatre pop programme definitely fix let ruin trip,London
merci gar malheureusement paris connais personne pense vais rechercher pendant deja paris j'etais conscient c'etait probablement impossible sans risque d'arnaques italie difficile quand faisable s'agit marche immobilier parisien haha merci,Paris
