body,subreddit
bite buddhist gta buddhism canada stretch accord antoine panaioti expert buddhist philosophy toronto metropolitan university trace construction railroad worker railroad buddhism canada chinese immigrant railroad $ lorna fandrich nearly member buddhist toronto cent accord statistic canada data wide variety buddhist worship slightly version religion however panaioti rely donation target,Toronto
read councillor pedestrianize kensington majority resident vote pedestrianize ignore favour loud nimby louder,Toronto
believe wfh sensible agree wfh society article interviewee completely tone deaf beaverton spin,Toronto
suggest success drink pilot able harder fentanyl meth pilot project allen garden,Toronto
untrustworthy hack sd cheat disable mcp sex addict oy vay,Toronto
state scene half dozen interracially specifically black woman black woman simply approach black woman clear usual hey chocolate black woman simply approach concern however delight approach,London
manufacturer minimum essentially necessity specifically,Montreal
cet ete difficile niveau bouffe tout trouver resto fasse plat ete galere paris entre quartier opera eme tous autres resto peu partout servent beaucoup moins mal trouver endroit sympa manger,Paris
tour abandon love proper secret tunnel tour round secret mail tunnel tunnel,London
apartment officer frequency smell urine corner dog skip sidewalk rid boulangerie client traffic muslim mine illegal muslim laugh common period british regardless racism initially immigration reform idea outright racism subject mainly witness member ethnic table season,Paris
weird list preference blank realise lovely little hard middle divorce although must strange drop message happy pass whatsapp profile pic,London
vraiment laquelle encore souvent alors ca passe histoire va suivre donc plein ete mec epoque copine prevu espagne prend donc rendre aeroport bonne homme fils parce valise ni ni deux passer cela calme pa commence insulter genre entend souvent quand femme robe ete trop content partir espagne alors fait pa gar insulter fils annees laisse tourne passe autre tout coup pote regarde dessus epaule voir trouble vois mec quelques etait air regardant droit yeux etait regarder comme si tout etait bien pa choque sou fait souvent vu pere faire ca devant pire cette scene tellement choque rien dire rame petit tout seul pere veux beaucoup avoir pa pu changer vie gosse si crois etais trop reagir,Paris
term interact london peer,London
downtown exotic surround south shore crazy grocery reserve luck,Montreal
toyota lexus fix product majority theft victim highlander rx toyota lexus profit,Toronto
everytime canada visa example state,Montreal
sit explore fit together weird pre pandemic grow conversation,London
insurance patient protection plan damage claim stain wine claim process complex detail mail send packet send technician technician fix serious older story grow montreal insist stain serious claim match insurance edit assume similar,Montreal
quel quartiers deja bien avoir leurs infrastructure pendant quartiers laisses rendu beaucoup facile sans auto longueuil brossard laurent montreal montreal nord comprends faut commencer quelque dis pa pa ainsi sachant serum sans doute chaque annee pareil voir quel choses,Montreal
bug prepare journey specifically burger king chicken sit bag settle major meal nobody brit next smell believe,London
montreal salaire net environ cad loyer pense mettre cote mettre cote france clairement appartement emplacement boulot,Paris
system quality treatment example dad girlfriend access doctor access expensive medication parent ruin dad simply dead opposite doctor doctor assume immigrant,Montreal
violation notice require minimum cent rear yard must soft landscape state must violation bring property compliance trivanoic $ install turf concern remove file ignorance bylaw defense government personal enjoyment personal space personal property,Toronto
must uniform route trace fact tube,London
trust shoulder colleague situation late sorry thank share hopefully return bite,London
fortunate earn salary stable toronto spouse infrastructure woefully insufficient grow toronto hour toronto list medical educational scarcity density lead tension along socioeconomic racial negatively impact mental health teenager today trade cottage country…,Toronto
yeah september shock subscription cross able convenience,London
bonjour cette association paris aide femmes sociaux possibilite abri ca accueille egalement enfants etait reserve femmes sans abri maintenant accueille tout femmes violence elles sans abri contre beaucoup monde peut etre longue matin h h apres h h h h jeudi rendez h h aussi violence femmes gratuit h jours,Paris
south africa south african anthem official canada lesson teach anthem anthem hadwe completely butthurt add,Toronto
man half meal deal fancy common older men uk soon sorry,London
agree sensible suggestion thread reality reduce overnight solve approach focus three bring stability save plan supply attractive empty property restrict predatory activity landlord rental inflation policy repair eviction purchase young buyer eg suggest stamp duty sale purchase guarantee stamp duty buyer benefit inflation fair share introduce rental property higher property subsidise,London
ligne pa heures pointe souvent oublie connais pa cette ligne ca doit pa etre,Paris
# upvote downvote reminder image appreciate upvote love downvote upvoting downvoting image control subreddit bot action perform automatically moderator subreddit message compose r london concern,London
quebec reasonable privacy picture permission photograph focus photograph picture shoot permission,Montreal
property london value £k january main residence council property council value property £ million london £k council £k ownership,London
male attract woman secret,London
shopper convenience pharmacy pharmacy convenient beyond pack often fill prescription allocate trash independent business grocery butcher veggie instead loblaws,Toronto
winner dinner atop eiffel view paris deck iconic landmark tour montparnasse grand cigarette dinner avenue ciel atop tour montparnasse cafe clichy late prior quai grenelle pont grenelle finally porte traffic circle latin quarter,Paris
parentcostco diaper walmart shopperswalmart formula sometimes stock poor amazon subscription bestetc real another capitalism,Toronto
comme dit plusieurs entre temp peux acheter appoint comme exemple ca peu ca comme portable sais pa trop ca appelle,Montreal
quai surtout quand pouvait voir arriere dame moins rue e quartier partout sauf paris maisons arbres,Paris
bank draft fake business clear bank anymore bank draft bank wire expensive safest seller buyer trust seller transfer ownership wire,Montreal
pa avon probleme chien partout trottoirs oui oui peux animaux peux gen pissent importe avant parle,Paris
autre ecouter musique ok avoir instruction google eviter regarder telephone velo etre,Montreal
trouble highway rue bank petty theft violence drug avoid tunnel montreal,Montreal
hour finger driver pedestrian pedestrian finger cyclist driver driver finger cyclist pedestrian insane middle star cyclist bike lane signal driver red turn middle intersection cross pedestrian cross range rover fair intersection cross literally middle cross star windshield rid scooter scooter sidewalk pedestrian,Montreal
cannot internet consent whole canada privacy regard land although allow picture inside internet consent cop uniform man picture name complain b,Montreal
single bedroom apartment couple roommate turn completely insane room share common term hotel often sometimes lease apartment key condo situation desirable mid town easy verify recommendation safer kijiji craigslist profit example couple summer $ apartment room,Toronto
another disappointment guess jay playoff series texas ranger series mistake ranger allow jay tie game crucial game series season jose bautista dramatic homer series,Toronto
obviously suck however shock travel concert young man music festival mile gaza border overseas hang couple party drug selfies automatically deserve piece,Montreal
amount far complaint petition reality,London
hopefully crack global launderers organize crime link lead connection contractor link italian organize crime union debacle,Toronto
pass woman men apps recent research,London
unfortunately opinion complicate various detail version view,London
definitely appeal clearly space legal hydrant court measure argue information,Montreal
peut attendre avant avoir enfants svp pa temp vie ado faire decision concrete meilleure personne guide sante pa tous dit,Montreal
laurent vegan mi fake chicken beef vegan type vegan ice oh card tip,Montreal
sick watch three love scene mum roller coaster play joke entire roller coaster,London
affordable likely reduce current homeowner equity current homeowner likely voter ie older boomer impact millenials manage affordable £ boomer millenials beat odds ladder climb recent millenials ladder double negative equity unable sell unable afford ive finally manage ladder affordable,London
ct slim fit slim extra slim slim similar taperedmenswearcom blog taper blog charles tyrwhitt slim fit taperedmenswearcom blog taper blog charles tyrwhitt slim fit fit men design wide shoulder narrow,London
gloss municipality responsibility province constitution sick blame feed share ford responsible instead hoard fund misspend wealthy donor fool project article admit feed $m mere refugee $ apiece result,Toronto
sit space crowd montreal crazy homeless loose asylum absolutely mental health access support,Montreal
american military paris american presence paris fun,Paris
heat pump room upper insist install current electrical $,Montreal
study permit license able situation behind inside intersection turn literally till pm rush hour behavior behind till genuinely,Montreal
parisian rip jean loud conversation dislike pub loud loudly stare certain rule litter nobody,Paris
girlfriend power together chat drink somehow bite girl entire third,London
reduce demand investment primary residence example multiple council,London
circle regent amaze regent canal camden little venice across canal pristine garden grand edit wwwgooglecom,London
reddit passport office yet passport reddit passport,Montreal
health screen london doctor clinic load lower cover medical health screen,London
wwwrecycleyourelectricalsorguk appliance functional stick trash browse completely,London
snippet currently available suspect threat locate sheppard avenue west dufferin property officer search locate suspect arrest,Toronto
sake tenant involve proper save withhold separate ltb landlord ltb owe withhold sideways tenant arrears lead eviction credit rat another landlord fresh payment eviction,Toronto
stranger desperate suggest message type woman girlfriend easy bring fun love calm interracially girlfriend asian,London
bouillon french dish quality ratio generally generally classic french dish budget,Paris
routinely giant tiger lad lowlaws repack expire meat till turn colour pre marinate meat worst offender oldest expire dunk sauce shelf extra,Toronto
gaza similar wow gaza shit eastern,Montreal
positive fulltime class definitely initiative fulltime class variety class separate schedule frequency period unclear absolutely luck,Montreal
originally london regret berlin amsterdam regret amsterdam paris paris berlin paris berlin chill vibe happy little individual,Paris
loop fell asleep waterloo heavy nye nye putney fell asleep pull waterloo felt realise pull waterloo must putney richmond wimbledon whole loop,London
throw reputation future preach view byproduct ongoing mental health crisis,Toronto
chez femmes sou type tire quatre probablement veulent absolument pa touristes semblent genre petite robe ete recemment portant genre chapeau portant panoplie ensemble tres semble etre ailleurs sinon stereotype panoplie touriste fait moins moins quand meme beaucoup pareil reste groupe,Paris
$ $ sale beef asian grocery meat tofu bean cook tofu meat fry rice recently popular asian grocery,Montreal
vu mec gros gueule gen ligne parce rame etait bien trop pleine allait pa pouvoir vrai rame etait bondee quand meme bout ca commence rame autre mec pousse dehors rame parce etait femme facon,Paris
seine palais justice pont saint michel depuis quai saint michel paris seine palais justice saint michel quai saint michel paris th,Paris
ca rien banlieue juste trouve ca assez article sujet jamais facon banlieue savoir rien ratp prennent jamais rer sinon doi dire tres heureux vraiment carton tous gen vont regulierement banlieue donc plupart gen juste carte tout vois vraiment pa interet changement faites truc ambitieux vraiment choses genre carte solde prix automatiquement comme plein villes faites rien,Paris
vraiment pa besoin ligne vers deja construit ligne personnes province fassent h jour aller travailler paris pa construire ligne cite deplacer banlieue autres banlieues ca peut etre entreprises aller installer banlieue prix moins,Paris
commit bite tend essentially london shit wish commit term sex party create,London
copper branch bowl swap rice general tao bowl red vegan general tao tao sweet treat,Montreal
spanish brand product bean rice meat man bite meat expensive quality bakery bakery,London
hub construction amount development however explain hub bite visualize wwwtorontoca payment transportation safety construction hub,Toronto
raison plaindre apres peut etre etait ca comme habitude font donc ruine autres apres fit eau truc genre truc eau toilette etait donc pa agreable boire quand fais sport,Paris
complain r london agree conversation gear men behave apps everything reverse mostly certain approach engage completely frustrate,London
illegal settlement jew none palestinian jewish today jewish behind birth israel mind cannot faith blind story ill total palestinian america israel disturb certain become guarantee design oil human democracy decade whole aware situation petty nobody lift finger raise eyebrow outside middle america ever raise eyebrow upon government deal treat palestinian voice folk laugh accuse support anti anti democracy subject slippery word potentially lead loss ready fight insist beat human potentially subject jump murky water infest water quebec belief award earth love numerous jewish sadly ongoing whole israel behaviour love palestinian brother palestine libre,Montreal
beaucoup commentaires parlent quelques derniers mois vois beaucoup beaucoup matelas affaire rue « punaises » bien,Paris
recommend describe smell taste closely link recommend wine taste beer beer taste recommend boire quality able,Montreal
deck parisian landmark wasnt,Paris
paris vu crottes trottoirs eme petits vieux baisser ramasser alors quand touche pa crottes sais pa,Paris
sorry pillar eiffel maintenance picture pillar acces renovation november,Paris
however onto partner general travel single sentence reply bore partner tend absolutely bore lately term conversation guess avoid whatsapp text communication guess fuel empty chat trigger,London
pa si trouve pa ca vont pa passer leurs vie prison faut bien montrer fait confiance contre sais pa fait bon vont etre rapidement esperer retour prison serum pa aussi,Paris
psycho dog target control noisy murder orient express type feed neighbour chip rid,Toronto
france europe phd program anglo recent phd specific project specific supervisor phd institution affiliate detail research supervisor landscape french academic institution complicate complex relationship institution affiliate murky clear stage specific fund opportunity phd french university reason particular institution specific research supervisor academic,Paris
greenhouse specifically allow several aware request special permission garden several greenhouse,Montreal
oui va faire grandes tour va mettre dedans demande apres va plaindre problemes tour mi plein encore pa,Paris
ah man bore list quality succeed woman girlfriend decide glass wine tv woman bitch romantic advance,London
multiple name,London
government hold white attend participate smudge elder grandmother scoopers execute attend,Toronto
assume beginner believe demand lower higher higher french immediately beginner desperate,Montreal
future sadly complain strategy together complain effective subreddit deal r,London
seule bonne ratp tous monde nouveaux comme comme ca ratp expliquer juste franchement deja quand trouve ratp sans donc imaginer ca reseau comme imaginer mettre,Paris
uk crime thread uk london simply society function specific yet present action address society simply crime slide,London
trend medias guarantee elsewhere europe deal bed bug,Paris
entertain ah montrealers dead scar risk cry picture,Montreal
chef instead cut kitchen emphasis chef desperate cook,Montreal
cover scaffold associate hoard resident window presume repair read article hoard scaffold possibly dodgy deal exploit loophole essentially massive plan otherwise,London
merci gar aide malheureusement paris connais personne effet pense vais pendant deja paris etais conscient etait probablement sans risque arnaques difficile quand meme faisable agit pa marche parisien merci,Paris
theater similar recent negative review suggestion french smaller,Paris
suggestion sole together umbrella watch romantic cinema quarter latin sex excite paris secret tattoo paris tattoo bar pretend tour vintage beautiful cv french version weather allow picnic shoot box shoot ie eiffel,Paris
france pa avoir differents trajet automatiquement ca serum probablement jamais determiner combien doit payer faut signale debut fin trajet sinon pa moyen determiner quelle donc moins faire declaratif esperer parisien moyen faut bear sortie installer bear sortie tous projet securite flux parle gen problemes flux donc ca veut dire installer etude chaque sortie travaux faire sortie pa donc pense rendre reseau seule sortie refaire seul flux gerer travaux cet unique flux tout ca pa acheter bon sachant majorite particulier carte personne tel argent,Paris
drink london guess music loud hard hard dislike loud music game token game us token vibe christmas loud pack vibe guess busy,London
payer titre suffit feu paris faut sm montrer conducteur trouve carte tellement mieux edit encore sm recent avant pa appoint faire comprends pa pourquoi comme paris pa encore mi ca,Paris
delivery deliver far apps convenient range hurt delivery chicken restos delivery,Montreal
petite vi pa mal nuit notamment cote entreprises permettent rentrer paname,Paris
sorry london arguably western easier wise spare size encounter exactly reddit,London
grow brantford college university windsor stcatharine london london far favourite reason traffic recreation name,Toronto
forever jail fact average ncr murderer wwwjusticegcca eng rp pr csj sjc jsp sjp rr phtml rid subway,Toronto
ryerson tmu recent study engineer often late aught amc personally concert fact desire decrease dramatically retail amazon sam yonge gould hmv sunrise nearly decade longer flagship selection elsewhere entire state yonge immediately dundas gerrard awfully depress pandemic widely responsible recover somewhat ironic ryerson slc arguably stretch hard rock cafe establishment yet another shopper,Toronto
shoot apartment across mine begin couple crew member chill davenport dupont,Toronto
traffic safest opposite vehicle vehicle behind require vehicle,London
doc correctly answer application timeline reply cite cheap foreigner france apartment french add,Paris
$ typical tag consultation specialist appointment amount correctly montreal quick opinion treatment clinic term clinic example refer system,Montreal
shoot rubber bullet wave magical white flag spark international incident prompt invasion canada spark international incident oh delightful,Toronto
ramq three province similar situation eligible reason fight argue politely complaint specialist turn decision send proof wife card automatically,Montreal
attract suburb font comme tout monde prennent commun faut etre pa pire temp vouloir traverser auto visiter montreal suburb functional transit system france tokyo pa,Montreal
cinema cinema loud watch original exorcist special screen director cut listen voice message whatsapp,London
kill manslaughter reckless higher suspension license license suspend suspension reasonable risk idiot,Toronto
actual crosswalk southbound ramp mccowan sadly attempt cross ebike egregious,Toronto
regarde flight avant savoir bout quelle piste placer sympa pa forcement ceux dessus voir zone sympa aussi peu fun,Paris
fais sers skip uber dish monde trouver restos pa loin chez pi ensuite cherche resto google partir regarde si meme,Montreal
inquietez pa toujours tous dire francais serum langue parler montreal ici deux generation plan b va bien inquietez pa,Montreal
patrick covid absolutely love return brother wife mid busy stage hall various performance half hall display sale sale litter room otherwise remind dad pointless tee shirt lanyard patrick tee shirt lanyard boyfriend older research decide mystery box con mystery box confirm indeed con mystery box wife chat indiana jones co play patrick chat peter voice stand afterwards shock yet another fantastic conversation indiana jones boyfriend lean forward story laugh truly,London
multiple cross hour cross south cross south,London
pa juste paris ca faut faire trucs dehors sport club gen certains entre groupe amis verre exemple aussi si e arrivee france cours peut etre endroits gen facile creer lien terme quand langue culture commun quelques mois apres va refaire boulot bout moment finit voir finit manque vie sociale vu voit meme collegues tous jours,Paris
hate noisy neighbour noisy neighbour specifically wall regularly drink blast music multiple inside outside personally love swap neighbour real afraid proof sometimes noise wall project louder noise stick rule noise reduce pm birthday advance pm saturday bite luck,London
notice bag next sit become amount bag,London
mostly english music france belgium rap hang middle eastern listen french rap quebecois music occasionally song french radio quebecois music,Montreal
royal festival hall ideal busy monday tuesday,London
article clear click batey bite shock lynn deutscher kobayashi president national association japanese canadian najc greater toronto chapter province october bell remove notify particular piece dismantle estimate timeline provide najc ontario ministry infrastructure bell relocate ontario timeline state dismantle removal bell slat begin monday october storage oct construction begin thereafter,Toronto
systeme navigo pa si surtout depuis navigo easy peut toujours pa prendre destination espere prevu avant jo h queue machine merci etait indique peut pa mettre lien sub idfm,Paris
paris beautiful sell bust napoleon cheap € unique definitely beautiful,Paris
popular opinion classify race instead class lower class disproportionally minority commit crime white lower class exempt commit crime higher systematically discriminate poor class require major nearly measure affirmative action class race,Toronto
another showcase shortsighted stupidity enable transportation beneficial traffic hard really…,Toronto
nope pristine clear paris dirty american dude complain piss smell bitch paris forest smell dirty forest paris smell piss everywhere river,Paris
immeuble administrateurs $ mois avon compagnie gestion egalement si pa compagnie gestion administrateurs probablement passer beaucoup temp gestion ca veulent gros salaire,Montreal
mid grow play sit lie play witness share weird shit village gay bring wave gentrification poor push room faubourg safety gay necessity neighborhood french wave feed plateau settle pressure historically poor anglophones ontario village neighborhood pressure chase nowhere poor drug pandemic link mentally ill cast crack male female split saint catherine ontario roof network anymore situation balance somewhat era current situation worst angel v rock machine sad invest communal kitchen roof addict reduce harm fight chase serious investment contribute buyer historically rental neighbourhood extra income sorry forget faubourg,Montreal
defense pendant longtemps avoue pa cet endroit extremement mettre vert quartier construit dessus sol donc complique mettre verdure avoir eau faire grand arbres trouve certains quartiers paris defense aucune aucune culture vraiment juste quartier affaire bonde semaine bureau aucune vie quartier aucune architecture grandes tour verre surement certaines personnes ca touche pa bref pa truc,Paris
probablement avion fait probablement fait tour entre montreuil avion si envie p,Paris
offre montant aussi montant frais tout honnetement vendu pi pu probleme vendu poubelle tel quel rien cache donc stand peut rien faire combien montant vehicule,Montreal
convenient opus card load onto travel load opus card effective journey zone transfer entire trip,Montreal
common add table size tip add customer odds tip remove waiter manager involve argument slow cold main twenty nobody complain special,London
fondu chinois peux acheter version utilise moins trouve autres ensuite faut juste casserole fondu sais pa dit francais differents type bouillon trouve march chinois cote art e ca fait pa faire cours e pire peut utiliser casserole enfin utilise pa assez souvent,Paris
prends rendez sociale mairie arrondissement trouver aide toute marche suivre changer vie moins bonne jamais trop tard changer,Paris
anti safety tenant uo property return deadline property behind likely scare uo reduce offense camera,Montreal
alors semble projets cest logements logements sociaux etudiants arbres arbres plant arbres arbres histoire avoir image « »,Paris
monday release representative telecommunication customer major canadian wireless connect g text stream ttc subway system,Toronto
business reporter ctv toronto arthur vale bore monotone channel induce financial news journalist television succeed everything manage viewer sport report inform entertain tenure,Toronto
