body,subreddit
pet pleasedhttps twittercom petshopboys status drake today surprise @drake sing chorus west girl track party album credit permission request,Toronto
budget moins cher personne serum utilisable h aumetro faut queue billet puis queue rentrer confortable propre classique taxi tarif « aeroport downtown » fixe memoire uber reviendra environ pareil peu rapide confortable coup,Montreal
ligne serieusement bout allee paris seulement dessous fois j'adorais juste c'etait anime j'habite village moins habitant dont plupart vieux familles jeunes enfants niveau animation mieux fou j'envie personnes habitent paris certes campagne calme boise l'air frais quand ado jeune adulte ennui constant n'y rien amis n'habitent village aller magasin facilement n'a permis surement loin fac j'habite h fac peux dire devoir partir chez soi h commencer cours h ouf,Paris
south africa south african anthem official lesson include teach anthem anthem we've hadwe completely butthurt add already,Toronto
circle regent amaze villa regent canal towpath camden little venice across canal pristine garden grand facade i'll edit wwwgooglecom map @ ayht datamemsnxcemapfxvitpmfgeiientryttu,London
decouvrir groupe taper google nom groupe paris trouver concert acheter arrive dizaines fois maintenant demande groupe passe juste quand passe,Paris
uk reuse add equation protect historical significance church deconsecrate situate land abandon destroy convert flat bar entirely quality refurbishment church thick wall sturdy course entirely builder budchurch account reasonable however church sell individual well,London
black main basically paint black coal smoke amount smoke ashtray butt smoke everywhere routemasters colourful culture punk goth age hippy dress flamboyantly black puffer jacket trainer far eye shitter cheaper young artist bed flat fitzrovia benefit hard imagine flat renovate flat aunt inside loo yet pick dog fewer dog mechanical meter far far far fewer chain smith boot coffee chain far independent army surplus everywhere clothe dirt cheap east german army shirt flood london reunification wear air raid warden's coat warmest ever see,London
delivery far apps convenient wider range option hurt delivery pizza rotisserie chicken restos delivery,Montreal
shopper convenience store pharmacy pharmacy convenient beyond fill prescription allocate complete trash independent grocery butcher veggie instead loblaws,Toronto
american connection london pandemic turn neighbour basically untreated infestation fixture endless route little prick crawl nightmare fortnight,London
diaper cheaper walmart shopperswalmart cheaper formula sometimes stock poor amazon subscription bestetc real pain store capitalism u,Toronto
denis coderre comprenait courtisait pouvaient voter doit concue habitant allan monique viennent fois annee,Montreal
london bridge lately green london lockdown combination behaviour stick pub charge £ pint behaviour stick others lazy empty home,London
comparison transit us transit bicycle bicycle nov april dedicate bicycle path shore tend occur mostly mix road bike path,Montreal
certificate allow continue english english scholarship believe option period regard access english cap ok read international permit finish study english bc hit maximum certificate,Montreal
pompe reste l'interieur l'abris sou sol completement independant temperature exterieur toujours efficacite hiver ete l'annee longue veux rien pombe,Montreal
juste font deja travail salaire decent font strict minimum livrer courrier litteralement description tache vois absolument l'effort exceptionnel merite pourboire,Montreal
paris vu crottes trottoirs eme petits vieux baisser ramasser j'imagine alors quand thune touche crottes sais pa,Paris
reasonable doubt standard judge reasonable doubt offense head acquit judge others obviously thats goal post,Montreal
single bedroom apartment turn completely insane airbnb room share common term hotel sometimes somelease apartment key condo win win situation desirable mid town easy somenice verify recommendation safer random kijiji craigslist profit example summer charge apartment room bad,Toronto
fan blue jay playoff series texas ranger series mistake ranger allow jay tie game crucial bat game series season jose bautista hit dramatic homer ultimately win series,Toronto
francais etes t'a bouche peux parler fallu qlq d'autre fasse comprendrais jamais mentalite enplus dire apres hero mdr bouge fesse l'amis faut tremblote hein,Paris
fit together weird pre pandemic let's grow conversation exist,London
hopefully global launderers organize crime link 'families' lead connection contractor link italian organize crime union debacle,Toronto
ah cafe hookah lounge quartier latin comedie venez voir six humoristes etablis standup incluant favorite gong membre d'un ancien trio adore quebec ainsi qu'un gagnant olivier podcast scripte,Montreal
common add table size tip add customer odds tip remove caproblem manager involve argument slow cold main arrive twenty others nobody complain special,London
issue english direction who's entire insist relationship,Montreal
announcement spanish version extremely awkward unintelligble laugh cuidado el anden,Paris
personne d'un bout l'autre trajet debut croyais qu'elle etait telephone parlant vachement fort quand arrivait continuait parler langue sans telephone juste main levee faisait l'exorcisme sais quoi etait derange n'osait rien dire,Paris
copper branch bowl swap rice salad general tao bowl avocado red cabbage raw brocoli vegan general tao tao sweet treat kid,Montreal
entre cafe arrive juste derriere derriere d'autre achalande immediatement apres passe porte l's'arrete bloquant porte derriere s'arrete pognes porte escaliers pardon passer desengorger porte m'engueule citant manque patience generation entre derriere rit membre r quebeclibre sans aucun doute,Montreal
downtown exotic import candy store eaton surround south shore crazy horse tobacco grocery reserve luck,Montreal
vu mec gros chasse gueule essayaient monter ligne parce selon rame etait trop pleine allait mourir pouvoir respirer vrai rame etait bondee quand bout arrets commence echauffer rame autre mec pousse dehors rame parce devenait menacant etait violemment embrouille femme enceinte critiquait facon agir,Paris
affordable likely reduce current homeowner equity current homeowner likely ie older boomer impact millenials manage affordable shave £ k boomer equitybut devastate millenials beat odds ladder rate climb undoubtedly recent 'historic lows' rate rise millenials ladder double whammy negative equity spiral rate unable sell unable afford mortgage disclaimer ive finally manage ladder dream affordable catastrophic overall,London
cet ete massif central copain j'suis super difficile niveau bouffe deteste produits laitiers trouver resto fasse plat tente ete veritable galere paris entre quartier l'opera eme autres resto peu parservent cuisine asiatique beaucoup moins mal trouver endroit sympa manger,Paris
wwwrecycleyourelectricalsorguk electricals campaign useful recycle electricals item functional charity pat test believe interestingly waste product tax producer product,London
homeowner believe majority neither upset vote bloc via policy threaten bloc's value foreign investment add fuel fire issue address matter national economics option effective stance toward global fund equivalent corporation tax nation flurry resource consume revenue collect corner operate concern incorporate elsewhere fall behind suppose century obsession homeownership bubble risk pop,London
paris identity mi fallout mood vista obviously parisian daily basis sufficiently ground reality immersion,Paris
ligne vers h femme visiblement probablement sdf monte lance sermon abraham benit animaux compagnie pot pourris puis clou spectacle sort castagnettes poche jupe entame interpretation assez ratee balade heureux etait metre sortir avant rire ligne entre colonel fabien pigalle mecs clairement sobres rentrent parlant fort canettes ouvertes main bousculent bousculent ceux cote occasion hurlent bref clairement genre voyageurs dont envie debarrasser vite possible sais ete declencheur exactement soudainement autre mec leve balance gar genre patates dont remet difficilement tete heurtant strapontin reagir wagon,Paris
tenant involve proper save withhold separate account ltb ltb owe withhold sideways tenant arrears lead eviction credit rat impossible fresh payment eviction,Toronto
uk crime thread uk london simply society function daily occurence specific yet present action address unsafety shed society simply let crime slide much,London
fleuve baigner pancartes baignade risques sinon va jamais pouvoir profiter manque sauveteurs riviere prairie ausmeilleure gestion matieres residuelles arreter chaque logement mette sac vidange pleins bouffe rue ecureuils autres animaux mettent parcloche endroits strategiques vraiment super plusieurs bacs papier verre autre recyclage composte ordure nb provincial toilette publiques vieux montreal auto nettoyante derangerait devoir payer utiliser elles propres papier toilette masse plusieurs belle fontaines d'eau potable parville juste petite fontaines parcs belle structure reviens suisse y'en parvilles merveilleux meilleur systeme transport commun application mobile lequel acheter billet qu'on montre chauffeur directement cell voir reel rendus autometro rem capable d'entrer adresse depart adresse d'arrivee l'application donne plusieurs option duree trajet transfer necessaires qu'on obliger montrer titre transport suisse probleme autorites font confiance population controleur prend amend salees vrai reve transport commun nationalise qu'on systeme incroyable quebec rem fassent partis d'une seule compagnie qu'on seule application mobile capable ecrit haut oui passe semaines suisse systeme transport commun incroyable devrait afici,Montreal
giant tiger lad lowlaws repack expire meat till turn funny colour pre marinate meat worst offender oldest expire dunk sauce shelf extra week,Toronto
brossard longueuil repentigny terrebonne vaudreuil dorion charge montreal driver fee cross bridge montrealers toll island,Montreal
tellement genre trucs t'as d'autres etoufferait etes tt vie sociale animee voudriez animal compagnieetc,Paris
cet endroit parcequ'ils budget bons artiste va repars toujours decu endroit sympa flex papoter vrai bise coeur aim clubber,Paris
heavy people's resource idk restriction single must facility hotel must convert structure cap value square meter gutting middle men inflate value regardless location value condition location view unoccupied tax future government project choose reliquish unable sell future project renovate sell add fund base maintenance occupy worthless tax otherwise exploit monitor independant body remain protect repeat offender involve future project must sell tenancy agreement rough edge iron detail fill solution complain problem,London
throw future preach view conflict byproduct ongoing mental health crisis,Toronto
wwwrecycleyourelectricalsorguk appliance functional stick trash nothinghttps trashnothingcom beta browse completely others curry,London
it'll mostly english link page blue hf osler fasken idea calendar calendar luck,Montreal
paris weird native busy suburb small smaller mentality paris fun suburb york similarity,Paris
what's available mid november likely appointment mid november tire summer season tire shape,Montreal
payer titre transport simple cb suffit feu paris faut envoyer sm montrer conducteur trouve paiement carte tellement mieux simple edit encore sm recent avant t'avais d'espece l'appoint t'allais foutre comprends pourquoi paris n'a encore mi place,Paris
currently paris initiative travel study multiple counmeet american elsewhere expatriate adiverse situation discuss behavior online usual stereotype associate american behavioral issue anymain obnoxious loudly attention seek behavior discretion philosophy polite elegant chic behavior cultural historical relevance hotel subway act untitled lack self awareness behavior adapt countries' culture rome roman latter lack education culture country's culture counfluently cannot google watch youtube tutorial mindespecially culture thousand history tradition remain lowkey respectful curious humble ignorance fully comprehend culture act counwonder everybody english effort word english slowly articulately age struggle american pace native speaker improve pleasantly surprise waiter fluently rather everybody adapt disappoint sound body universal sort customer king misbelief study record rather customer king counpast consecutive shitty customer counalready plenty respectful customer inste,Paris
million london literally meganever london busy suggest york sao paulo bangkok… let tokyo seoul shanghai… hopefully teach literally billion million settlement special earth literally infinite possible thing,London
sorry comment faites pitie force entendre plaindre vecu derniers campagne ici s'appelle robert ginette votent fn detestent homo bill gate transmis covid vacciner g reste cassos zyva mot vocabulaire j'envisage justement demenager paris sentir vivant amis ba facile j'en fais rue,Paris
marque peu auchan vend sou marque cosmia lame dorco fabrique vietnam carrefour fabrique allemagne possiblement croma personna fabrique israel l'usine ferme deja quelque supermarche proximite moins d'en trouver hypermarche forcement gillette fabrique russie feather dur trouver,Paris
asia's major blow lizzie western europe behind measurement compare tube tokyo hong kong seoul,London
wimbledon host monday monday wwwfacebookcom meetupmondays wwwfacebookcom meetupmondays cafe pub host reduce loneliness pub repeat customer exchange tea coffee,London
answer chain across england crap arse support independent amaze independent london practically refuse chain insist,London
opinion antiquate million inhabitant rethink rely rate 's sense longer,Montreal
petite vi issy moules mal nuit notamment cote entreprises balard corentin celton permettent rentrer paname,Paris
commemorative periode laquelle cone s'y trouvait legende dit cone quitte vitrine commerce lors conquete coupe stanley canadiens montreal repose paix,Montreal
j'en dingueries transport m'a vraiment traumatisee laquelle repense encore souvent alors s'est passe prefere prevenir l'histoire va suivre nsfw plein ete mec l'epoque copine prevu s'envoler l'espagne prend lille rendre l'aeroport joie bonne humeur homme fils entrent commencent raler parce valise bloquent passage ni ni deplace permettre passer cela calme monsieur commence insulter particulierement savez genre d'insultes sexistes degradantes qu'on entend souvent quand femme robe d'ete trop content partir espagne alors gaffe gar continue insulter fils d'une douzaine d'annees laisse couler tourne passe autre choose discute dizaine d'un coup pote regarde dessus epaule visage decompose retourne voir trouble vois mec masturber quelques centimetre etait chibre l'air branler compulsivement regardant droit yeux haine indescriptible gamin etait regarder etait tranquille choque sou m'a penser souvent vu pere devant pire cette scene tellement choque qu'on rien su dire rame laissant petit seul cingle pere m'en veux beaucoup n'avoir reflexe j'aurais pu changer vie pauvre gosse j'avais appele crois j'etais trop sideree reagir correctement,Paris
quiet hill triangle easy peace quiet ideal detach placehttps wwwrightmovecouk £m invest stamp duty fee redecorate furnish scatter across south london east perfect station's real afford bed flat frankly i'll settle,London
thank reply office apparently sell travel card uk resident hard prepay credit card welp lesson travel cc back,London
grow thames air raid flood warn occur trigger occasionally elderly neighbour war listen scratchy gracie field record must go,London
rate gare marche arriere conducteur etait alcoolise s'est sortir gare sncf m'ai avis demande marche arriere,Paris
cancel random item miss grant ubereats partial refund delivery mandatory fee delivery justeat deliver delivery minute,London
currently available suspect threat locate sheppard avenue west dufferin officer search locate suspect arrest,Toronto
dog tarcontrol noisy owner murder orient express type bunch feed neighbour chip rid problem,Toronto
royal festival hall ideal it'll busy early monday tuesday quite spot even,London
doctor list oh impossible appointment gonna luck one,Montreal
grocery cook meal flyer advantage discount inflation product altogether discount vegetable pre meal mind product,Montreal
probablement d'aero sotravia mesures meteorologiques probablement vol asr paquet tour entre puteaux montreuil l'immatricule f hfrf t'as envie retrouver itineraire p,Paris
supposedly dairy yoghurt pret manger vegan wrap tear inquest death woman severe allergy newsskycom story yogurt firm bos tear inquest death woman severe allergy,London
t'en plaindre apres c'etait auparavant d'habitude singe font merde ruine choose autres apres souviens qu'a basic fit fontaine d'eau aromatisee truc genre fallait s'abonner truc acceder l'eau toilette etait chaude agreable boire quand fais sport,Paris
thanksgiving send message corporation holicollapse earth,Montreal
river thames double waterloo across ben cold air hit royal festival hall oh bench gaze across nk londoner thank heaven bless london american stick finger electrical socket love,London
quai d'orleans surtout quand pouvait voir l'arriere dame moins connu rue dieulafoy e quartier peupliers croirait partout sauf paris maisons fleurs arbres,Paris
growth slowly separate toxic unfortunately include immediate extremely lonely force deal isolation tik tok mental health hit emotional moment relate type breakthrough adhd wild mood swing characteristic borderline personality disorder fun trigger tough breakup moment extremely painful acurrent pain childhood wind allow become boundary relationship forward emotion trigger tornado inhead deal difficult teach important lesson late gym confidence boost alworth emotion prioritize love,London
chatelet fort th century protect norman viking invasion repell fierce siege paris later serve sinister prison demolition napoleon,Paris
continue future sadly complain accept strategy employ together complain effective subreddit deal issue r tenantsintheuk,London
generation serious emotional issue longer decide woman realise idiot criterion apparently strict complicate black black woman technically race largely black woman black woman london culturally personality wise black dialect london upbringing deathcore melodeath fan play video game rugby american football millwall black idk mutual goth emos grungers nowhere chavs roadman fit black woman,London
corner ever extra truck invisible they'll bike bcrunch vehicle,Montreal
multiple shelter nearby feed regularly donut meal various charity organization shortage,Toronto
simple instal system record activity neighbour film inside audio active video evidence chillaxing quiet crazy woman bang door stomp video solve issue,London
theater zingaro similar recent quite negative review online passion lessen suggestion smaller fresher,Paris
suggestion sole together rain umbrella watch romantic movie cinema quarter latin sex choose excite paris secret tattoo paris tattoo roleplay bar pretend hit book tour vintage beautiful citroen funny cv version beetle weather allow picnic photo shoot photographer box shoot ie eiffel help,Paris
l'epoque grand pere annees certaines personnes depuis chine sans connaitre ni francais ni l'alphabet aller d'une autre comptaient l'epoque utilisaient cure dent qu'ils jetaient c'etait petite anecdote historique ha,Paris
brand product colacao bean rice meat cash man grumpy meat nw expensive quality bread bakery tufnell bakery,London
quite fan takeaway coffee commute notice coffee p term £ capucino,London
man strike conversation join cigarette ruin personally tend hit issue,London
reliable option generally rah state proper reseller personally avoid stubhub viagogo royal albert hall sometimes drip feed lead well,London
anti safety tenant uo warn return prosecution deadline advise retrieve behind likely scare uo reduce offense camera entrance asap,Montreal
job expressionless concise elicit response avoid rapport passenger potentially mislead officer false incorrect answer slip false pretense,Montreal
edit probleme semble spot parisiens malheureusement risque d'difficile eviter paris sauf suivre collectifs « cool » toujours techno voir ba regles malheureusement scene techno s'est mal deportee vers hangar dehors paris qualite aleatoire y'a virage kilomsemblent correspondre cherches gore l'aspect troglodyte peu hard sinon plutot tendance rester valeurs sures petite salles gare mine glazart rex machine fonction l'artiste encore assez peu regles generalement passe h ra spotify dimanche voir truc plait envie decouvrir suivant seule constante paris plutot collectifs quelques collectifs newtrack hors sol alter paname microclimat mamies cracki organisent soiree regulierement gerant spot artiste bonne ambiance ambiance toujours techno permet s'ouvrir peu musicalement gen,Paris
hi depalot ivry directly connect paris paris far roquette bagneux farther paris wont paris deptwo subway rer huge boost perk ivry seine bagneux end,Paris
ct super slim fit slim extra slim super slim similar taperedmenswearcom blog taper blog charles tyrwhitt super slim fit alternativehttps taperedmenswearcom blog taper blog charles tyrwhitt super slim fit alternative athletic fit clothe men design wide shoulder narrow waist,London
london random stranger conversation rob sex exceptionemphasis random stranger,London
doi l'entreposage dechets jusqu'au jour collecte fonctionne partout quebec immeuble n'a poubelle commune t'en procurer jour collecte prends sac depose devant immeuble laisses poubelle chez,Montreal
id multiple ought easily say,London
alright francophones appreciate team lead surprise immersion accent hate accent,Montreal
sound hell trust instinct shoulder colleague situation safe late sorry thank share hopefully return smoothly,London
piste cyclables hidalgo j'imagine aucun autre candidat qu'elle mettre mairie coalition entre mairies peu surquand voit vieux con refractaires permettent d'emmerder majorite vraiment parrevolution cycliste selle paris suffit voir nombre velos grandes piste j'espere juste voteront consequence permettront perenniser avancees prochaines annees,Paris
wild medium report interrupt jump onto track colder desperate way,Montreal
mandatory bar accept bathroom mandatory glass water one,Paris
gang south mostly brixton sort significant gang numerous estate stockwell camberwell kennington estate literally spill nothing poverty plenty everywhere drill sub idolise pathetic postcode war thin veil music musician obviously area,London
decoration bouillon racine basic stereotypical dish quality ratio generally correct generally fast notably chartier choice classic dish budget ''postcard'' stun worth visit,Paris
surprise london nothing due culture else's job clean teacher parent additionally multicultural contribute factor,London
forever fact average ncr murderer wwwjusticegcca eng rp pr csj sjc jsp sjp rr phtml rid subway,Toronto
someryerson recent study engineer late aught amc personally concert fact desire decrease dramatically retail rise amazon sam yonge gould hmv sunrise nearly decade longer flagship store selection elsewhere entire state yonge immediately dundas gerrard awfully depress pandemic widely responsible recover somewhat ironic ryerson slc arguably stretch hard rock cafe establishment yet shopper,Toronto
government hold white attend participate elder grandmother scoopers eye execute attend event,Toronto
rule must english parent eligible english subsidise english quebec qualify english partner australian presumably attend english primary secondary therefore qualify rare narrow exception emsb lbpsb fill basically instruction exactly sole exception separate purpose serve relatively small historic minority anglophones generation recently residence latter category reside warrant school,Montreal
shoot apartment across mine begin member chill respectful davenport dupont area,Toronto
green victoria tube aka evacuate cop terrorist alert instead scar mildly annoy pret riverboat full joy wonder 'i commute london beautiful river' boat celebrate heatwave pub stand pub catch football fan crazy pack tube foreign fan let smoke bomb evacuate celebrate fan block road somehow become common occurrence shrug shoulder forward bother rain cab transport foot hurt spstupid amount fortnums selfridges christmas load nonsense excitement,London
toronto star timeline greenbelt scandal agree conclusion likely member ford caucus fall sword provide ford plausible deniability defense cut chase star editorial rcmp's sensitive international unit announce investigation ford's office government fully co operate zero tolerance wrongdoing involve decision greenbelt land letter statement sentence demonstrate investigation denial deflection defence indefensible refusal accept consequence premier fact demonstrate plenty tolerance dodgy dubious accountability scandal government cabinet minister clark rasheed senior aide dive opinion poll ford's investigation outcome relieve election political future,Toronto
prends rendez sociale mairie arrondissement pourra guider trouver d'hebergement aide psychologique gratuite toute marche suivre changer condition vie moins traumatisme possible bonne n'est jamais trop tard changer destinee,Paris
shoot bullet wave magical white flag spark international incident prompt invasion spark international incident oh delightful,Toronto
skateboard random judge wear loudly whether etiquette bonjour enter eat foreigner convention certainly paris laugh ridicule certainly whereas happy flatter rudimentary attempt eastern europe arab latin america hospitality eat urge guest eat encounter subtly shame eat highly sensitive type criticism receive downvotes,Paris
