body,subreddit
condo median wage value solution issue value drop median wage double toronto wealthy middle rollback wage happen,Toronto
berlin currently reside paris too… unaccommodating english hinder course certain nobody english,Paris
ausmontreal alors qu'avant surtout medias parlent laisses vetements valise dehors quand reviendras temperature negative ah ah,Paris
sale beef asian grocery store meat tofu bean cook tofu meat mince pork cheaper fry rice meatball recently phat popular asian grocery store,Montreal
however claim clear admit fact appear wwwadrakyorkvilleca reservation,Toronto
kill pedestrian cyclist minimal drug alcohol involve wwii woman toronto kill pedestrian sidewalk suspend licence toronto ttc,Toronto
attendre qu'elle grandir avant detruire d'avoir enfants svp n'est complete d'experiences vie decision concrete meilleure personne guide sante excellents dit,Montreal
term eye london yr anyhow peer talk,London
surprise surprise worth vp communication former staffer ford government manager communication navigator closely associate conservative politics across corruptariosubstackcom p spa casino revolve door conservative party therme clear,Toronto
others loop fell asleep waterloo heavy nye nye putney fell asleep pull waterloo eye felt realise pull waterloo sun must putney richmond twickenham wimbledon loop go,London
assessor heat pump 's towhouse room unit upfloor insist unit install worth current electrical bill,Montreal
london regret berlin amsterdam regret amsterdam paris rather paris berlin imagine paris berlin chill vibe happy aleave little individual subscribe use,Paris
pass wwweviemagazinecom woman men unattractive apps recent research,London
paris daughter strike friendly cheaper comment improvement paris something,Paris
verifier l'ont dit plusieurs entre peux d'appoint exemple peu fan chauffe radiateur portable sais trop comment s'appelle lol,Montreal
gros probleme d'acheter va toujours prix marque budget vont quand vendre shirt travail realistiquement seulement besoin genre shirt vie beaucoup difficle vendre famille monoparental enfants mettons style honnetement vois d'acheter faite chine personne va fair parce realistiquement y'a marge dessus t'es mal,Montreal
ete condamne infraction legislation stupefiants devait sortir peine agression sexuelle sexuelle precise ministere,Paris
satisfy whip whip fight caq battleground instead real health starter,Montreal
ttc midnight min uber freeze cold yet poorest suffer drink increase,Toronto
search flea regular clothe indoor outdoor flea brocante object clothe furniture sell neighbor type marche neighborhood air twice rarely brocante type regular greatly,Paris
depuis arrive paris six chaque nouvelle annee scolaire j'aime juste bouger franchement decouvrir nouveaux quartiers avant j'avais appartement vu premier j'etais solo studio apres rajoutais bon s'est arrete quatre max espoir reprendre jour,Paris
cut act intimidate job behavior beyond trip quizzically present woman ulcer think,Montreal
seine palais justice pont saint michel depuis quai saint michel paris seine palais justice saint michel quai saint michel paris th roger,Paris
flat white £ chicken sandwich £ insane coffee london generally appreciate everyday homemade chicken sandwich worth £ sell,London
treasury bond council treasury split bond holder govt ten sell buyer bond holder reasonable return,London
visa example state,Montreal
wtf ttc soon tee ontario size oh customer fuckery regular ride instead acton king orangeville horsey cruise range rover bmws state art secure palace conveyance interaction spah day,Toronto
particuliere commence recemment sais psy bonne voici comment l'ai trouve epluche doctolib regardant prend chaque fiche presentation s'il presume psy s'en fout serum avant rapport souhaitais fiche parle methodes complex regle generale passais tour fiche evoquait mot psychanalyse idem aider certains decridibilise professionnel fiche etait telle facon message etait « professionnel va aider » egalement cherchais quelqu'un quelqu'un enfin certains psy peuvent ausseule seance laquelle t'aident recommander collegues besoin bon ca,Paris
mostly english music rap middle eastern listen rap quebecois music occasionally song radio quebecois music,Montreal
cat owner mind cat real estate agent spare usual real estate agent,London
we're anyspa land profit infrastructure benefit resident pander land provide employment tax provide revenue owner subsidize,Toronto
rather amount far complaint petition worth reality happen,London
cool tax double remain vacant term lease count occupancy heavily regulate term lease term lease airbnbs similar bullshit implement vacancy tax vacant retail space,Toronto
london soon court rd tube supermarket nearby cheap sandwich lunch google map jump eta blind,London
argue rule lesson lesser moral leeway,Montreal
lmao luck block path huge they'll block grind underground navigate ttc tunnel path convoy gonna anyways fun blockade nothing,Toronto
complain online r london agree conversation gear men behave apps reverse mostly online certain approach online engage completely frustrate day,London
francais n'est bon answer english idea clothe amaze winter i'll mid february longer ski decathlon merino wool boot snow boot winter weight easier tube must mount royal slightly cross counski jean drapeau february montreal lumiere art nuit blanche activity music concert museum winter heavenly fresh ice skate rental underground cold pop hot chocolate cafe carry quebec carnival well,Montreal
europe summer roll hq position former colleague partner toronto young smart talent late,Toronto
wwwlegisquebecgouvqcca fr document lc wwwlegisquebecgouvqcca fr document lc immobiliser vehicule routier endroits suivants intersection pietons ni moins ceux ci,Montreal
budget bon depart apres peux vers marque tendance auschers balibaris budget n'est probleme recommande magasin s'appelle generale,Paris
juste paris faut trucs reguliers dehors taf sport club lecture certains t'introduiront groupe d'amis autours d'un verre exemple ause arrivee cours recherche endroits rencontrent facile lien terme quand langue culture commun quelques mois apres va falloir bout d'un moment finit voir qu'on finit manque vie sociale nouvelles idees vu qu'on voit collegues jours,Paris
michou drag bar cabaret paris death eat montmartre hi fascinate 'fact' historic personality montmartre neighbourhood,Paris
definitely worth clearly mark legal hydrant court measure argue information,Montreal
immediately angel affordable selection expensive stand camden otherwise nicest expensive selection upper street,London
uk everybody later literally later insistent provide personal suspicious random engage vague response london matter strange appear,London
medias guarantee spot elsewhere europe usa deal bed bug,Paris
eme mois juste dessous rue mouffetard vers savais c'etait arrondissement attractif j'habitais eme avant beaucoup quartier vers pere lachaise,Paris
weird all' affiliate weekend vehicle access middle lawn lmao,Toronto
individual write email catherine councillor unclear identity catherine councillor email currently merchandise topic yet email markham library initially respond monday email state email inaccurate confirm display islamic heritage remain present library remainder october,Toronto
appreciate native english simple bonjour merci appreciate,Montreal
annoy transportation argument whether hard argue plan,Toronto
everythey've option commit worth option tend essentially job requirement somelook london past uni wish commit term sex party string attach create let go,London
imo wwwwaterfrontorontoca default file rfp% %keating%channel%pedestrian%bridgepublic%design%presentation%slide%deckzeidler%final uapdf,Toronto
insurance patient protection guardsman exclude pet seam damage claim stain wine claim process super complex online detail mail send packet nothing online send technician technician fix serious cleanser older story grow montreal insist stain serious tldr claim match insurance edit assume similar,Montreal
autre ecouter musique conduisant ok instruction google map oreille eviter regarder telephone velo d'etre visuellement,Montreal
village avoid wonder although neighborhood safe,Montreal
london cool million become cheaper courtesy become nicer london london glad anymore noise cancel earphone upstairs back,London
moment steal serial killer multiple victim murder wasnt solve,London
crois moins partie contre transilien l'affluence bord reel fr search &time%a franchement assez fiable affiche panneaux quai permet placer rentrer,Paris
gros securite cette constance signalisation certaine piste cyclables dont rev beneficient virages protege usagers automobilistes cyclistes d'une certaine feu protege changement soudain cette protection entraine grande choose feu clignotant vert signale habituellement priorite virage recemment remarque certaines intersection donne feu vert pietons feu clignotant entierement conscient pietons priorites difficile d'en vouloir automobiliste croire priorite clignotants accompagnes feu pieton vert dit ceci automobilistes manque constance signalisation sorte usagers maintiennent instance,Montreal
totally highly recommend independent jewish voice peace jewish voice peace project active montreal chapter edit add anti jew anyread send message lonely isolate jewish self hat jew anti semitic fellow family… yeah little,Montreal
dependency centric infrastructure instead campaign easier driver campaign transit system suburb cyclable worth live,Montreal
rome fontaines potable tokyo toilette publiques panneaux directionnels regulierement lieux strategiques d'yeux panneaux ratp surtout bon sen oui j'assume bon sen nord bon sen pigeon bon sen sen quand leve yeux sen panneau,Paris
aim « paris » wwwgooglecom map @ayht datamemsxjtu paihhcjlyognofogeiientryttuhttps wwwgooglecom map @ayht datamemsxjtu paihhcjlyognofogeiientryttu passerelle aim help,Paris
absolument pisse chien probleme pisse rue sou ponts ruelles parcs vieux mecs crasseux pissent partout beau partout s'en deja vu gar haie pleine rue journee grand calm bande qi m'assois siege depuis vu gar,Paris
quelqu'un mi panneau chemin traverse harry potter carton suite deterioriation dernier pluie mairie remplace vrai,Paris
convoy block road snarl traffic intelligence officer send convoy anyone's gonna block road snarl traffic gonna chief,Toronto
anglo us reason cook meal practically,Montreal
depsociologique boulangerie comment t'il hello toujours francais touriste ignore bonjour ignore bienveillance baguette d'habitude t'es regulier hochement tete qu'est qu'on inner circle bonjour,Paris
london everywhere obviously lovely hole fun young stoke flat three story mad speed punk downstairs upstairs sell hash drink spare moment bog three flat room flat bathroom kitchen room divide bedroom hardboard heat entire white literally white glourious chaos pub full mainly manual job poor beer watch throw people's window everysquat speed preference squat road later hash sell load anarcho punk hippy dread gay scene party rave scene colourful mad flavour thishttps wwwinstagramcom tapeslidearchive eta london comparison nicer,London
situation paris infestation london nobody pandemic travel thread thank info,London
black cab expensive refseveral broadwater farm flat south several exotic delight forest hill,London
sidecentury hide urban garden unique entire representation ruelle literal describe hide garden eighth wonder modern r oldredditcom r accessible corner eye impossible create appear simmer decade venice amsterdam canal montreal ruelles ruelles,Montreal
ontario government block financial compensation legal expert cross mind simply focus frisimple,Toronto
fullclass definitely proactive initiative fullclass variety class separate incourse schedule frequency period significantly unclear worth luck,Montreal
manage traffic regularly officer coffee browse instagram chat construction worker intersection nothing manage traffic totally useless dime gifemotefreeemotespackfacepalm,Toronto
politician surprise purpose rental tie red real shocker none intentional canada's real country,Toronto
n'a vraiment besoin d'une ligne vers deja surpeuplee construit ligne personnes vivent fassent h transport jour aller travailler paris judicieux construire ligne inter cite deplacer banlieue d'autres banlieues motiverait entreprises aller banlieue prix locaux moins cheres,Paris
regarde radar avant savoir bout quelle piste placer spot symforcement ceux dessus voir zone toucher roue peu fun,Paris
bakery match item menu idk pastry sausage roll bun charge £,London
due imo potential match finger tip woman appreciate comfort zone somehonestly someone's profile personality revolve drink despite co drinker apps woman men visual creature motivate connection beyond physical somei've realise despite rarely suggest black women's profile hinge black woman attractive behave definitely race idea compatibility yeah white term pic,London
alors semble projets cest logements logements sociaux chambres etudiants coworking arbres arbres plant passerait conditionnel arbres arbres histoire d'avoir image « complete »,Paris
tendance restos h n'y qu'eux toujours connaissance leurs voisins table discuter d'une table l'autre entre ricains mal sans doute,Paris
viens job parce c'etait loin deja chiant puis avant commence j'espere potentiels ceci veux j'y taffe double salaire,Paris
we'd sptogether chat drink somehow finish reluctant god… girl entire we've holiday we're live,London
connect vote affect issue torontonians vote transit cancel doug ford office majority three elect tory councillor little ttc,Toronto
agree uk let's rome worse rubbish everywhere bottle clothe sometimes chair item mess culture simply acceptsomewe'll anytime soon enforce introduce extremely litter fin people,London
demande wwwinstagramcom ohpeparis wwwinstagramcom ohpeparis qu'elles peuvent t'orienter sauf pote s'installe sicherchez archis google doit trouver non,Paris
pop district's famous pub o'malley's double moldovan bar arnold schwarzenegger undercover mission fubar lakeview trinity bellwoods feature season umbrella academy feature fourth wall fan enthusiast allow breathe favourite story,Toronto
fry board fry gravy eat count recommend fry recommend fry integrity matter fry gravy period,Montreal
tory uk tax tax lower cut fair tax thrive art road fair efficient council quick court safety ruin bye,London
cold approach stranger online stranger chat ignore,London
black asylum seeker fund address ukrainian asylum seeker arrive hopefully fund provide asylum seeker,Toronto
hunt total story legal population healthy assume he's eat lake shore imitate wwii pompom mount humber bay fine,Toronto
taylor swift era tour film theater weekend decide champ elysees pathe villette villette friday champ closer saturday friday film theater midmin ride late ok friday saturday,Paris
idiot consequence crush bike huge severe punishment studity recklessness,Toronto
montant montant frais propos paprasse honnetement vendu pi pu probleme t'as vendu poubelle tel t'as rien cache rouille stand rien combien montant vehicule,Montreal
massage therapist advertise newer therapist massage therapy relatively doubt receipt insurance register order,Montreal
yeah drug insurance qualify drug insurance ramq choose coverage compare ramq inform ramq coverage help,Montreal
read article exactly clamor exactly purpose rental option imo net positive,Toronto
felt wild roll eye vladdy interpreter confuse score gonna win game killer instinct feed garbage year,Toronto
crowd montreal crazy homeless loose shut asylum mental health access support,Montreal
cheaper toronto fee hahahahaha,Toronto
hospital claim bank resp newborn birth assume child's hospital relate clearly access hospital daughter's birth back,Toronto
sorry review agree suck majority skew favour woman introvert indian ridiculously hard easier white british men apps seriously travel partner indian passport visa travel obviously personal circumstance men apps extremely hot mental physical health apps someattack previous relationship india partner okay loss okay sprest asian woman insecure introvert abandonment issue thread anxious everytime anxious match british brown sound unsure voice accent bigger someapologise drop text response anxious type rather spapps men physical trainer therapy bill everyapps sound simple screw,London
neighbourhood rather risk green p block block aeverything block toronto raise rate enforcement article fall toronto launch consultation citywide strategy lead real estate devote stationary vehicle driver exercise global trend urban redecade orthodoxy dictate ample cheap thrive proponent philosophy argue reduce amount us reduce traffic climate target proposal readily available expensive provoke pushback driver higher owner recover pandemic patrick siegman san francisco base transportation planner sea undernever reform snowball roughly quarter authority's peak weekoccupancy rate cent facility overcapacandidate higher rate range half jeff dea vice president development toronto authority agency's approach reasonable discourage term frequent turnover alspot authority typically review annually three spot pandemic rate dea acknowledge rate little agency recommend modest raise board november we're dramatic say,Toronto
