body,subreddit
typically download self personal trainer six huge preteen teen client body issue self esteem issue act bond lesson healthy mentally stronger physical aspect screen childhood obesity rise medium aspect happen,Toronto
underwhelming far exhibit density mostly queue queue min min exhibit installation enjoyment line,Toronto
seul solution ultime d'augmenter l'offre gros probleme zonage facon regler politiciens connaissent solution explication logement extension condo vont baisser prix augmenter qualite generale logements l'offre demande debalance montreal construire debut fin d'un projet immobiliers peux prendre gros frein changer zonage vieux quartiers industriels ruine politiciens savent depuis dixaines d'annees reste belle facon d'avoir faveurs,Montreal
pensais d'offres egalement l'impression calme egalement possiblement partie parce prix location explose n'arrivent trouver mieux preferent rester appart moins cher attendant qu'un truc correct sorte ca,Paris
ah man incredibly bore list quality succeed romance woman paragraph whinging ex girlfriend decide glass wine vera tv sound option woman bitch particularly reject romantic advance,London
infrastructure doctor longer impossible loose war roughly influx insane blame newcomer blame refuse accommodation million condo medical accommodation catch montreal population answer tax budget construction ugh plateau's population ease pain wwwmacrotrendsnet montreal populationhttps wwwmacrotrendsnet montreal population medical facility barely sufficient demand,Montreal
quebec june announce reform class summer francizisation class winter aware unlikely class summer lack teacher jump gun dawson highly recommend teach curriculum faster pace rather fall winter semester francisization program essentially level,Montreal
summer edit joke aside plateform april available access via invitation register earlier pick choose package three sport completely relate complete purchase however affordable blink eye pricepoints stupidely fast € fast qualifier round whatever obscure sport let athletism swim cool discipline cool fence grand palais track stade basically reach july reach phase individual sport fact available organization there'd resell platform cap avoid scalp olympics people's shitshow accessible official e shophttps ticketsparisorg nonetheless,Paris
agree pandemic standard fluctuate base charge rarely stand overcharge,London
imagine hamas massacre habitant certains village violent jeunes fille decapitent bebes tuent familles complet mettent bruler leurs maisons suite,Montreal
feed squat fund transit properly let toronto fundraise highway toll gas tax whatever let transit fail thereby problem,Toronto
speed limit pedestrian oakville suggestion km residential control bend summer total motorcyclist miss bend hit tree lawn kill gotta km time,Toronto
we're basically toronto east record ontario resident migrate due lower worry french,Montreal
grow montreal approx montreal extremely bore downtown rather suburb easily accessible compare winnipeg mtl eternally 'vivid' trip commit montreal w significant difference compare winnipeg,Montreal
due nature topic brigade evidence previous tag controversial controversial thread participate commentator must significant r toronto history prevent brigade violator receive ban warn rule action r toronto regular punish severity ie ban instead ban controversial unpopular opinion blatant racism push racist agenda careful rule engage polite respectful dialogue,Toronto
we're english send they'll lifelong advantage yr pick quick english affordable option lcc selwyn,Montreal
lucky montreal doctor quickly extra shore montreal average list ourself record yet themself list,Montreal
unfortunately worse tesco teenager throw mcdonald's rubbish lady disgust pick basically f shout racist,London
partner hinge single term relationship keen serious aleasy click engage partner three hinge,London
avon probleme pipi chien partout trottoirs oui trouveriez proprietaires tax oui j'en peux animaux j'en peux pissent n'importe avant qu'on m'en parle,Paris
recent political development stir pot visceral hatred direction hindu nationalist fuel nativist tendency indian comfort toronto neighbourhood mix include indo sikh hindu religious warm weather together important offline community,Toronto
halloween corner curious host horror performance someenter dark room pin hole torch narrow decorate scary sound vein root touch jump scare central audience artist perform similar jump scare immersive trip merci,Montreal
health screen london doctor clinic load simple lower cover basic herehttps wwwlondondoctorscliniccouk medical health screen gllhfqfngazvjsaerfnfkehkxtucxnhvttxfjrvyxsdhjqvmytgwdwnwulfpnhfnbzrqywfmvhcmwttdvouevszkng,London
rien banlieue juste trouve assez ahurissant article sujet n'expliquent jamais facon claire arrive banlieue savoir rien journalistes communiquants ratp prennent jamais rer sinon doi dire heureux s'ils donnaient vraiment alternative carton vont regulierement banlieue plupart juste carte posseder continuant trimbaler vois vraiment l'interet changement faites truc ambitieux vraiment choses genre carte solde calcule prix automatiquement plein villes faites rien,Paris
six musical write toby marlow lucy moss director lucy moss jamie armitage actor jaz robinson julia pulo maggie lacasse krystal hernandez elysia cruz lauren mariasoocompany mirvish production venue royal alexandra theatre toronto dec critic's pick queen brief edmonton's citadel theatre production toby marlow lucy moss's tony award win musical henry viii's ill fat wife finally arrive toronto luck royal beyond current dec write british duo cambridge university edinburgh fringe six reign supreme wherever play west australia broadway pre broadway include aforementioned citadel elsewhere wonder six's song catchy message female empowerment solidarity inspire design costume choreography eye poppingly fun girl pop concert pretdramatically engage piece theatre six lean stadium concept character joke consort strut onstage hold microphexclaim ya toronto tudor tour conceit six monarch early repeat gruesome classroom verse divorce behead die divorce behead survive return graf crown leader band audience vote winner winner malign ill history chronological female band rockin' lady queen present photo gallery julia pulo vivid personality impeccable comic role anne boleyn joan marcus handout winner imperious devout catherine aragon jaz robinson marry henry's older brother pass apossession anne boleyn julia pulo infamous decapitation england catholic church jane seymour maggie lacasse allegedly wife henry truly song six's crown jewel reason win tony score various cast album record download stream marlow moss cleverly write simultaneously character belt act homage past present ruler contemporary pop,Toronto
doit attendre min pleine pointe ligne min ligne vraiment fin prends jeu smartphone amuse passera vite pensais qu'avec tt punaises moins teletravail n'est obligatoire juste l'initiative l'employeur seul exaspere grand choose oui largement pire vie sais doi vouloir mets juste l'eau vin va syncope ratp satisfont peux toujours prendre velo,Paris
doctor send request mine later polyclinic maisonneuve rosemont hospital luck,Montreal
quite argument spa mad lad suggest system connection monumentally stupid idea reasonably extend streettrack reduce bathurst harbour front car,Toronto
certain difference future sue he'd edit downvoted frankly misunderstand civil theory practice,Paris
advantage fake college lie brighter future await victim currently endure crisis placate politician government political spectrum toothless policy allow success covet younger generation deny future,Toronto
hub landmark jewish safe unfortunately attack regard bedbug highly exaggerate usual british medium bash cheap headline work,Paris
ashe add member pickering anti black racism force shock upset robinson's remark ashe highlight gravity situation damage impact councillor robinson's suspension direct consequence action decision conclude ashe reflect necessity uphold integrity council maintain ethical standard strongly urge responsibility action refrain false harmful comparison sincerely apologize black hurt offence caneed guide step nimrod,Toronto
massive bed flat twenty value half mil rest cover charge forever bill travel bed comfortably relationship suit fancy,London
allotment folk hand surprise warmth gardener horticultural society everywhere pop along chat math purity result fail reward,London
shopper cheaper advantage optimum certain points' pc optimum network zehr's nofrills valumart etc,Toronto
eat young young foreigner feed political choice f'd government party generation,Toronto
montreal safe downtown neighbourhood friendly easier european style francophone rule expat regard english obviously constraint location welcome show,Montreal
canadien vient demenager paris etude americain surtout jeunes faut porter vetements 'sportifs' style ex hoodie nike souliers nike voici illustration medium photosdepopcom b cecffbdebab pjpghttps medium photosdepopcom b cecffbdebab pjpg imagesmilledcom uvmxpmbmhcfag fprhbztugnpnghttps imagesmilledcom uvmxpmbmhcfag fprhbztugnpng staticnikecom image fautocssrgb wclimit e ac ddde comment porter sweat %c%a capuche sweat shirt pr%c%af%c%ar%c%a toute occasionjpghttps staticnikecom image fautocssrgb wclimit e ac ddde comment porter sweat %c%a capuche sweat shirt pr%c%af%c%ar%c%a toute occasionjpg,Paris
i'll torontonians obsess toronto contemplate measure discourage passage subsidize resident everychange tax ttc fare breakeven fare slightly profitable improve infrastructure,Toronto
consulat instruction l'inscription consulaire demande d'une carte d'identite passeport faut apporter apres pris rdv inscrit serum jour quidams ligne diront,Montreal
va voir etant quartiers genre tant femme gere viens d'un coin calme sans beaucoup d'etrangers risques d'etre depayse surbeaucoup dehors heures abord grand ax veut dire va agresser chaque coin rue projet d'achat terme nord parisien va subir beneficier gentrification va prendre beaucoup valeur d'aubanlieues style clichy saint ouen pantin montreuil … vient aubervilliers ausdoucement va venir,Paris
butt properly ash tray drink toss bin fire smoke choose choice mindful others,London
early claim witness utterly useless montreal avoid actual luck film construction worker sham medium tag useless well,Montreal
assume beginner believe demand lower higher higher course assign immediately beginner desperate btw course start,Montreal
tough position metrolinx ct responsible construction schedule metrolinxmetrolinx protect enforce contract secret major claim compensation ct metrolinx tough legal position defend claim unfortunate rip metrolinx hire contractor renovate double promise blame construction contractor,Toronto
quand j'emmene fils l'ecole vers champ mar tour eiffel rer passe seine tour eiffel ciel rise ponts brillent dores soleil,Paris
west tecumseth upset city's respite respite early bed capaexpand bed st felix profit organization support shelter serve turn hundred coun ausma malik represent spadina fort york obligation unhoused toronto fundamental duty resident safely must act winter approach improve stability statement concern locate metre st mary catholic elementary neighbourhood block concern potential impact safety surround nick andrew across neighbourhood decide location unfair present little little vulnerable society expose preage we've hard safe safe afraid peaceful beautiful boulevard tree pollinator garden dog overandrew add he's resident malik forum resident distribute flyer include digital soon possible hire engagement facilitator barnes management manage engagement hold virtual information session establish liaison committee concern,Toronto
hem burberry trench coat front vent unpick tuck hem possibly trim mitre topstitching redo design simple fold stitch trouser hem agree £ sound cheap worry cut corner twice job,London
prix affiche seule choose qu'ils peuvent charger frais supplementaire doit clairement indique peuvent surtout facturer autre item dispendieux commende fraude,Montreal
patient roster allow schedule patient appointment regular four four xx reserve emergency appointment monvacation stint overseas doctor border typical doctor patient roster patient bat eye patient,Montreal
j'avais region parisienne depuis quelques mois reviens stage premier jour stage premiere fois rer depuis mois rentre rer bonde vois y'a endroit idiot j'avais oublie cela signifiait l'odeur d'abord melange d'urine d'alcool dejection crasse sdf rer regarde m'insulte sors sexe masturbe regardant chouette retour quotidien rer m'avait tant manque heureusement securite ferroviaire grand gaillards s'assurer personne pose pied fauteuil,Paris
entertain ah montrealers dead scar risk cry confront picture,Montreal
issue let prohibit certain age prohibit certain reason race shape,Toronto
ravioli chinois recommande ravioli nord rue saint denis maison bon rapport qualite prix sinon man'ouche rue rambuteau bon libanais enfin classique rhinoceros rue etienne marcel,Paris
traffic presentation road awareness footpath safest option opposite vehicle towards rather vehicle behind probability safe reaction require vehicle well,London
imagery completely ban artistic educational faith argument speech slippery slope,Toronto
condo median wage value solution issue value drop median wage double toronto pick wealthy hell middle rollback wage math happen,Toronto
berlin currently reside paris lifestyle too… unaccommodating english hinder course useful skill certain silly nobody english,Paris
ausmontreal alors qu'avant surtout medias parlent auspire laisses vetements valise dehors quand reviendras temperature negative ah ah,Paris
sale beef asian grocery store meat tofu bean cook tofu meat mince pork kg cheaper fry rice meatball recently kim phat popular asian grocery store,Montreal
prefer however claim clear admit fact appear wwwadrakyorkvilleca reservation,Toronto
kill pedestrian cyclist minimal drug alcohol involve wwii woman toronto kill pedestrian sidewalk suspend licence toronto ttc,Toronto
attendre qu'elle grandir avant mutile detruire d'avoir enfants svp n'est complete beneficierait d'experiences vie d'ado decision concrete meilleure personne guide professionnels sante excellents dit,Montreal
term eye london yr anyhow ridiculous peer talk,London
surprise surprise worth vp communication former staffer ford government manager communication navigator closely associate conservative politics across corruptariosubstackcom p spa casino revolve door conservative party therme clear,Toronto
others loop fell asleep waterloo heavy nye nye putney fell asleep pull waterloo eye felt realise pull waterloo sun must putney richmond twickenham kingston wimbledon loop go,London
assessor heat pump 's towhouse floor bottom floor room unit upfloor insist k unit install k worth current electrical bill $,Montreal
london regret berlin amsterdam regret amsterdam paris rather paris berlin imagine intensity paris directly berlin chill vibe happy aleave little hectic individual subscribe use,Paris
pass wwweviemagazinecom woman selective men unattractive apps recent research,London
paris daughter strike clean friendly cheaper comment improvement paris step something,Paris
verifier tal l'ont dit plusieurs entre peux t'acheter chauffage d'appoint exemple ressemble peu fan chauffe radiateur portable sais trop comment s'appelle lol,Montreal
gros probleme d'acheter va toujours prix marque budget vont quand vendre shirt travail realistiquement seulement besoin genre shirt vie beaucoup difficle vendre famille monoparental enfants mettons style ausdiffcile honnetement vois d'acheter ceinture flechee faite chine personne va fair parce realistiquement mode y'a marge dessus t'es catch mal,Montreal
ete condamne infraction legislation stupefiants devait sortir purgeait peine agression sexuelle exhibition sexuelle jusqu'en precise ministere rassurant ',Paris
satisfy whip election whip harder fight caq cultural battleground instead fruit real health starter,Montreal
ttc midnight min uber freeze cold yet poorest continue suffer drink increase,Toronto
search flea regular mix clothe indoor outdoor apparently flea brocante object clothe furniture sell pro amateur neighbor type marche occasional neighborhood air twice rarely brocante type familiar aligre regular greatly chance,Paris
depuis arrive paris six chaque nouvelle annee scolaire j'aime juste bouger franchement decouvrir nouveaux quartiers avant j'avais delire d'agrandir appartement vu premier j'etais solo studio apres rajoutais colloc bon s'est arrete quatre max perds espoir reprendre jour,Paris
cut act intimidate job behavior beyond foreign trip grill consultant quizzically sneer feminine present woman younger age ulcer think,Montreal
seine palais justice pont saint michel depuis quai saint michel paris seine palais justice saint michel bridge quai saint michel paris th wwwgalerie roger violletfr photo,Paris
flat white £ chicken sandwich £ insane coffee london generally appreciate freshly everyday standard homemade chicken sandwich worth £ sell,London
treasury bond council treasury thru split bond holder govt ten sell buyer bond holder reasonable return,London
paperwork visa example state,Montreal
wtf ttc soon tee ontario ex size oh customer fuckery suppose regular ride instead acton king orangeville horsey cruise range rover bmws state art secure palace conveyance interaction spah day,Toronto
particuliere commence therapie recemment sais psy bonne voici comment l'ai trouve epluche doctolib regardant prend chaque fiche presentation s'il presume psy s'en fout serum avant rapport pecuniaire souhaitais fiche parle methodes complex regle generale passais tour fiche evoquait mot psychanalyse idem aider certains considere decridibilise totalement professionnel fiche etait redigee telle facon message etait « professionnel va aider » zappais egalement cherchais quelqu'un m'aider… quelqu'un m'aider enfin sache certains psy peuvent ausseule seance laquelle t'aident definir besoins recommander aupres collegues besoin bon courage ca,Paris
mostly english music rap middle eastern listen arabic rap quebecois music goodbut resonate occasionally song radio quebecois music clarify,Montreal
cat owner mind cat real estate agent spare usual real estate agent dick,London
we're anyspa land profit infrastructure benefit resident pander land provide employment tax it'll provide revenue owner subsidize,Toronto
rather amount far outweigh complaint petition worth reality it'll happen,London
cool tax double remain vacant term lease count occupancy heavily regulate term lease limit term lease airbnbs similar bullshit implement vacancy tax vacant retail space,Toronto
london soon court rd tube supermarket nearby cheap sandwich lunch google map familiar jump eta blind finally sainsbury's,London
harsh motivation perhaps argue familiar rule lesson lesser moral judgement leeway judge ha,Montreal
lmao luck block path huge they'll block grind underground navigate ttc tunnel path convoy corporation gonna anyways fun blockade nothing,Toronto
complain online r london agree conversation gear men behave apps reverse mostly online certain approach online engage completely frustrate day,London
francais n'est bon answer english idea warm clothe amaze winter i'll mid february longer ski glove decathlon merino wool sock leather boot timberland snow boot decent winter jacket weight easier snowshoe tube must mount royal slightly adventurous cross counski parc jean drapeau february montreal lumiere art nuit blanche tonne activity music concert museum winter heavenly fresh snowfall ice skate plenty rental explore underground pathway cold pop hot chocolate cafe carry quebec carnival icehotel well,Montreal
europe summer roll hq position former colleague partner toronto young smart talent late,Toronto
wwwlegisquebecgouvqcca fr document lc wwwlegisquebecgouvqcca fr document lc immobiliser vehicule routier endroits suivants intersection passage pietons ni moins ceux ci,Montreal
budget bon depart apres peux evoluer vers marque tendance auschers apc balibaris budget n'est probleme recommande magasin s'appelle officine generale,Paris
juste paris trentaine faut trucs reguliers dehors taf sport club lecture jeux societe finiras sympathiser certains d'entre t'introduiront groupe d'amis autours d'un verre exemple ause arrivee cours parcours recherche endroits rencontrent facile creer lien terme quand langue culture commun quelques mois apres partiront va falloir reboulot bout d'un moment finit voir partenaire qu'on finit detester manque vie sociale nouvelles idees vu qu'on voit collegues jours,Paris
michou drag bar cabaret paris death eat montmartre hi fascinate 'fact' historic personality montmartre meaningful neighbourhood,Paris
definitely worth clearly mark legal hydrant court measure tape argue information,Montreal
kiosk immediately angel affordable selection expensive stand york camden passage otherwise nicest expensive selection dansk upper street,London
uk everybody later goodbye literally later insistent provide personal randomly suspicious random engage vague response london harmless matter strange appear,London
medium medias woul awould guarantee zero spot elsewhere europe usa deal bed bug,Paris
eme mois juste dessous rue mouffetard vers gobelins savais c'etait arrondissement attractif j'habitais eme avant j'aimais beaucoup quartier vers pere lachaise,Paris
weird all' affiliate weekend vehicle access middle lawn lmao,Toronto
individual write email catherine councillor unclear identity catherine councillor email currently merchandise topic yet email continue markham library initially respond monday email state email inaccurate confirm book display islamic heritage remain present library remainder october,Toronto
appreciate prefer native english effort simple bonjour merci appreciate,Montreal
annoy transportation argument whether hard argue plan,Toronto
everythey've option commit worth option tend everyinclude essentially extend grace job requirement somelook london past uni age wish commit term sex party string attach create let go,London
bridge imo wwwwaterfrontorontoca default file rfp% %keating%channel%pedestrian%bridgepublic%design%presentation%slide%deckzeidler%final uapdf,Toronto
insurance patient fabric protection sofa mobilier urbana guardsman exclude pet seam structural damage claim stain wine claim process super complex online photo detail mail paper send clean packet nothing online send technician technician fix serious cleanser older chatty story grow montreal insist stain serious tldr persistent claim match condition insurance edit comerco assume similar,Montreal
autre retarde ecouter musique conduisant ok instruction google map oreille eviter regarder telephone velo d'etre distrait visuellement fuck,Montreal
early village avoid wonder verdun although neighborhood rich safe,Montreal
london small cool million become cheaper courtesy become choice nicer london london glad anymore noise cancel earphone upstairs back,London
moment steal serial killer multiple victim track murder wasnt solve,London
crois moins partie systemes fonctionnent contre transilien l'affluence bord reel voiturehttps wwwtransiliencom fr itinerary search departurevaires torcy%vaires marne%&departureidstoparea%aidfm%a&arrivalgaredel%est%paris%&arrivalidstoparea%aidfm%a&datetypedeparture&havebusbypassedfalse&date &time%a franchement assez fiable affiche panneaux quai permet placer intelligemment viser rentrer train,Paris
gros securite cette constance signalisation certaine piste cyclables dont troncons rev beneficient virages protege l'ensemble usagers automobilistes cyclistes habitue rouler d'une certaine maniere feu protege changement soudain cette protection entraine grande d'incident choose feu clignotant vert signale habituellement priorite virage recemment remarque certaines intersection donne feu vert pietons feu clignotant entierement conscient pietons priorites difficile d'en vouloir automobiliste croire priorite puisque feux clignotants accompagnes feu pieton vert dit ceci excuse automobilistes manque constance signalisation sorte usagers maintiennent comportements securitaires instance,Montreal
totally highly recommend independent jewish voice peace jewish voice peace project ijv active montreal chapter edit add anti zionist jew anyread send message lonely isolate jewish self hat jew anti semitic fellow family… yeah reach little alone,Montreal
dependency centric infrastructure instead campaign easier driver campaign transit system serf outlying suburb cyclable walkable worth live,Montreal
rome fontaines potable tokyo toilette publiques panneaux directionnels ergonomiques regulierement lieux strategiques hauteur d'yeux coucou panneaux exterieurs ratp surtout bon sen oui j'assume bon sen nord bon sen pigeon voyageur bon sen sen quand leve yeux pannvois sen panneau,Paris
aim background « mud'art moderne paris » wwwgooglecom map @ayht datamemsxjtu paihhcjlyognofogeiientryttuhttps wwwgooglecom map @ayht datamemsxjtu paihhcjlyognofogeiientryttu bridge passerelle debilly therefore aim east help,Paris
absolument pisse chien probleme pisse rue sou ponts ruelles parcs vieux mecs crasseux pissent partout beau installer chiottes urinoirs partout s'en foutent deja vu gar pisser haie pleine rue passante journee grand calm bande qi negatifs pisseurs m'assois siege depuis vu gar arroser copieusement,Paris
canular quelqu'un mi panneau chemin traverse harry potter carton suite deterioriation dernier pluie mairie l'avait remplace vrai,Paris
convoy it'll block road snarl traffic intelligence officer send convoy anyone's gonna block road snarl traffic gonna chief,Toronto
anglo us reason cook meal practically family,Montreal
