body,subreddit
quiet hill love easy peace quiet ideal wwwrightmovecouk property £m invest stamp duty furnish across south london perfect real able afford bed flat next settle,London
tendance tous meme restos comme h toujours faire leurs table discuter table autre entre mal sans doute,Paris
german travel okay realise greet genuinely concern emotional state everyday sorry love,London
allow ramq drug plan pharmacy coverage insurance plan system pharmacy ramq plan able claim plan afterwards,Montreal
situation paris infestation london nobody pandemic travel thread thank,London
asylum seeker priority real immigration minister international quiet loud lucrative asset,Toronto
# upvote downvote reminder image appreciate upvote love downvote upvoting downvoting image control subreddit bot action perform automatically moderator subreddit message compose r london concern,London
grow generation london involve happy worse concern lately tory gutted fund everything strike shitshow brexit,London
tory uk lower cut fair thrive art fair efficient council quick court safety ruin,London
endroit pire techno paris si veux vibe va soiree techno collectifs inconnus niveau vibe toujours meilleurs si aim soiree toujours monarch,Paris
whole bite gravy ford brother toronto hall turn self deal benefit business greenbelt conservative accusation confession truly,Toronto
parisien quelques annees sans doute ligne longue rame type style sdf jambe bien odeur va soudain arrete pousse autour clairement jambe vois couteau main jambe petits,Paris
exhibit except massive accessible culminate deafen driver honk nearly dozen driver box,Toronto
si interim voici avoir travail tres rapidement cv interim chaque interim h apres avoir cv savoir bien ete savoir donc mission vont dire vont peut etre dire cest partie h mission ca fait pa ca pa ca montre justement veux travail sais facon matin si pense ici semaines max travail,Paris
ironically perfect donate zoo indirectly zoo biogas plant land zoosharehttps zooshareca originally design process zoo manure waste turn electricity compost whether discretion entirely dump,Toronto
downtown core impressive nathan philip square kinda impressive wtf lift concrete slab foot print fall garbage underwhelming tone rest saw reliance immersive art blah lake projector bird nature wtf lower fund art installation traffic sit onramp gardiner sensation traffic print stick traffic,Toronto
mostly english link page idea calendar calendar luck,Montreal
corner curious host horror performance room pin hole narrow touch jump scare audience sit artist perform similar jump scare love immersive trip merci,Montreal
hospital triage em patient esi straight room higher acuity patient hallway bed nurse report flex assignment patient via em doesnt er bed,Toronto
ca fait denis pa gen pouvaient meme pa voter doit etre habitant pa fois annee,Montreal
ontario cutoff onto gear income income asset arbitrary poverty remove list pretend list shorter income afford able list,Toronto
agree pandemic rarely stand,London
search flea brocante regular indoor outdoor flea brocante object furniture sell neighbor type marche neighborhood air twice rarely brocante type regular,Paris
london lately impression green space london lockdown behaviour stick pub £ behaviour stick empty,London
demande wwwinstagramcom ohpeparis wwwinstagramcom ohpeparis peut etre elles peuvent sauf si pote sinon google ca doit trouver,Paris
general deux moyens avoir etre pris visiblement serum pa ca bien ecole exemple petit etudiants quand meme si va sympa,Paris
gros probleme acheter va toujours etre prix meme marque budget vont quand meme vendre shirt $ travail maison donc realistiquement seulement besoin genre shirt vie beaucoup vendre ca famille enfants style tous aussi honnetement vois pa acheter si chine personne va fair parce realistiquement pa temp donc pa faire dessus e pa mal,Montreal
island impact construction popular outside island montreal surround benefit transit bike transit system far perfect future fill bike sou bien entendu,Montreal
english entire insist french relationship,Montreal
generation serious emotional longer decide woman realise idiot strict complicate black black woman technically race black woman black woman london personality wise black london play video game american football black idk goth nowhere fit black woman,London
older heat pump oil $ electricity heat oil average heat oil eventually expensive dual energy save hopefully natural gas oil heat effective efficient save able upgrade save,Montreal
miss sit lockdown next delight wherever upset,London
immeuble demande mois loyer comme montre solde mois loyer deux pense pa besoin avoir bon credit,Montreal
growth slowly separate unfortunately immediate extremely lonely deal mental health emotional moment relate type wild mood personality fun trigger tough moment extremely alot current allow become relationship forward emotion trigger inside head deal teach lesson late gym boost emotion love,London
suffer somaybe properly actual torontonians flee hometown study several relocate somewhere able afford cent,Toronto
poor bugger evict risk predatory landlord property eviction plan dougie possibly disadvantage advantage poor conservative,Toronto
wwwlegisquebecgouvqcca fr document lc wwwlegisquebecgouvqcca fr document lc peut vehicule endroits intersection pietons ni moins ceux,Montreal
# pool alot isopropyl dollar spray bottle kill soothe itch bite,Toronto
alberta dual fluent french v anglo quebec resident mandatory french class french amount quebec mandatory french class quebec canadian quebec nope,Montreal
etait quelque annee maintenant aubervilliers visiter musee faire quelques bref ca bonne partie journee doi prendre tram tram arret tout va si groupe jeunes gen decide voie tram comme si etait petit autour petit feu fallu regler ligne certaines faut attendre normalite logique auber chatelet entre etait premier cercle avant ratp prendre serieusement probleme,Paris
acces risques sinon va jamais pouvoir profiter manque aussi meilleure gestion arreter chaque logement sac bouffe rue autres animaux mettent partout endroits strategiques vraiment avoir plusieurs papier verre autre comme ca provincial toilette publiques comme vieux montreal auto ca meme pa devoir payer $ utiliser si elles papier toilette comme plusieurs belle fontaines eau potable partout pa juste petite fontaines comme parcs belle reviens suisse partout tout villes systeme commun application mobile lequel peut acheter billet montre voir temp reel rem capable adresse depart adresse arrivee application donne plusieurs trajet transfer pa montrer titre suisse probleme font confiance si prend vrai reve commun systeme incroyable quebec rem fassent seule compagnie seule application mobile capable tout faire oui passe deux semaines suisse systeme commun incroyable avoir meme affaire ici,Montreal
river thames double waterloo across cold air royal festival hall bite oh sit across thank heaven london american stick finger electrical love,London
piste cyclables adore pa tout aucun autre faire fait mettre mairie entre aussi peu temp surtout quand voit vieux con permettent majorite vraiment pa paris suffit voir grandes piste espere juste gen consequence annees,Paris
annees deja saxophoniste jazz dame assez agee aussi tres petit chapeau grand etait tres beau finit tout deux discuter peu americain aussi club eme gar incroyable dame agee etait tellement poche deux etait opera pouvait pa aller dit saxophoniste « etes grand alors donne sais » impression etre,Paris
folk surprise society everywhere pop along chat result fail bring,London
solution relatively hard international accomodations university provide residence international reasonable international international exactly easy review picture testimonial residence apartment unused starter,Toronto
depuis paris six chaque annee aime juste bien franchement decouvrir nouveaux quartiers aussi avant appartement tout vu premier etais apres tout bon ca arrete quatre max pa jour,Paris
baby formula diaper shopper diaper sale amazon formula diaper wal mart often stock amazon shopper pm emergency,Toronto
$ overnight guest ready intimate head present ipad payment optionslol landlord oppose tenant sex,Toronto
# upvote downvote reminder image appreciate upvote love downvote upvoting downvoting image control subreddit bot action perform automatically moderator subreddit message compose r london concern,London
hey london girl similar position hate apps coffee example along similar recently love politely approach scar body luck,London
aware troll bot thoughtful fill thread racist hateful undermine valid concern share shortage exacerbate massive surge permanent resident blame foot poor governance belong politician begin action government gaslighting canadian solution shortage immigration federal noise constituent fall poll party retreat focus crisis finally commit ten billion subsidy float idea international government solve crisis permanent resident international permit holder deficit billion subsidy double current demand pressure must government wwwstatcangcca quotidien dqa enghtm financialpostcom real estate canada cant million fix affordability,Toronto
habite aime beaucoup bien habite tour bord dalle tres jolie vue paris grand pietons enfants peuvent aller ecole pied sans traverser seule rue milieu dalle tres autour petits coin verdure contre dimanche matin dalle faut aller cote,Paris
surprise dirty london due culture teacher parent additionally contribute factor,London
rule must frequent english canada parent eligible english subsidise english quebec canadian guess french qualify english partner attend english primary canada qualify rare narrow exception fill instruction exactly france sole exception separate purpose relatively minority canadian anglophones generation recently province residence category reside warrant,Montreal
sweet summer edit joke april available access via register package three sport completely relate purchase however affordable € round sport grand palais france july individual sport fact available organization platform avoid shitshow accessible official e,Paris
paris devraient etre gratuit gratuit francais fait deja majorite budget peu navigo budget pourrait etre importe quelle supplementaire region personne ceux deux million tous gen ici parlent tarif tres ba jamais regarde vie prix navigo budget,Paris
si marque importe peu sou marque fabrique fabrique donc possiblement fabrique israel deja quelque temp moins trouver forcement peut etre meme fabrique dur trouver,Paris
yeah drug insurance plan qualify drug insurance opt ramq plan plan coverage compare ramq inform ramq coverage,Montreal
cold neo citran along grocery item loblaws $ box packet shopper product shelf $ grocery higher due convenience factor evidently,Toronto
create reduce traffic ie senior amount easier bike infrastructure bike allow bike protect space transit yet another along avoid traffic bloor mill strongly disagree cycle infrastructure,Toronto
island legallyjust allow die remove anybody subsidize fight tooth nail lifestylewhich except,Toronto
various heaven sausage roll £ peter,London
insta page flag gonna blow edit twitter page assume assume ok video insta page link x page describe love entertain welp edit twitter,Montreal
thank reply office sell travel card uk resident hard carry credit card welp lesson travel,London
chatelet fort th protect invasion siege paris prison demolition napoleon,Paris
hello alors beaucoup commentaires avis beaucoup trop voit sub rempli parisien jamais passe auber pa coupe fait pop mairie fort endroits globalement ok cliche seine denis vie auber villes va profiter grand paris jo grandes renovation jean renovation canal denis fort ligne quartiers renovation quartier fort aubervilliers gare pantin serum cela dit quartier vraiment pa tres agreable quartier tres marchands fait gen souvent dehors parce chez petit quartiers dessus plutot ligne pantin e pa loin eme eme eme avis meilleurs paris p vi ultra agreable tres auber pa encore niveau pantin ca,Paris
franco anglo us reason cook meal practically,Montreal
immediatement apres avoir passe porte homme arrete bloquant porte tout monde derriere arrete tous pognes porte escaliers ca aussi francais manque « » souvent bout escaliers porte lorsqu autres monde derriere cote cote pa assez laisser passer autre,Montreal
comprends tellement accent probleme quand quelqu toujours demander fout gueule pa faire ca inconnus gen,Paris
crazy lately literally matter woman package hot late connection matter woman tone attractive white woman older connection london often london,London
tellement genre trucs gen bien autres etes tt vie sociale avoir animal,Paris
downvoted hate moral ethical obligation french english montreal english shit able communicate suck everything write advertise suck constant reminder waste forget promote x stupid able communicate lower lower island recommend whether class fluent suffer table generally personally english french difference,Montreal
drapeau palestine cette semaine message vois etes tres contente ete ca rue tres,Montreal
example loblaws dry wallet compare pound unpackaged potato pound sale lb bag absurd,Toronto
west regional connect pickering scarborough mississauga pearson another connect markham richmond hill vaughan pearson brampton,Toronto
authority council reprimand former member view reprimand request investigate conduct resign office purpose typical hold position power responsible guess connect millionaire suffer joke,Toronto
mi sou porte cette semaine financier lie egalement raison « pluie cet ete financier lie covid ete extremement difficile ensemble velo quebec » qquun peut expliquer ca veut dire quoi concretement prets gouvernement federal pouvaient pa rembourser consommauters moins argent loisir merci,Montreal
heavy metal variety montreal metal scene absolutely fantastic metalhead saw cannibal corpse birthday couple dozen beer pat wish happy birthday couple crowd surf mayhem montreal heavy metal heavy mtl die covid,Montreal
urbansoccer app search game football desire,Paris
yeah weird alright okay greet tend intonate higher pitch yeah genuinely concern tend intonate yeah trick answer answer eg alright immediately brit general ya greet interpret exactly alright provide mouth,London
bike paris km round trip leather rainproof pant layer underneath shoe snow winter,Paris
seul solution logique ultime augmenter offre gros probleme zonage facon regler politiciens connaissent solution explication logement extension condo vont faire baisser prix augmenter qualite generale logements offre demande debalance montreal construire debut fin projet immobiliers ca peux prendre gros frein faire changer zonage vieux quartiers industriels ruine politiciens savent depuis dixaines annees ca reste belle facon avoir faveurs,Montreal
habite justement e quartier revais quand venais paris ado mi loyer pa tellement cher ailleurs paris appart pourri occupe impression avoir fait peu tour beaucoup beaucoup touristes toute economie tournee vers cafe boulevard saint germain etre ridiculement chers remplis touristes jet setter autres mondains venus exhiber statut difficile circuler certaines rue pietonnes rue buci… tant monde autochtones appartiennent principalement grande bourgeoisie pa specialement milieu prefererais cotoyer meme si moyens permettaient quartier autrefois populaire artistique vit image alors devenu oppose etait epoque rendu celebre artiste laisse marchands art petits commerce salles spectacle boutique luxe con rue belle send toujours paris historique enfin celui xxe siecle emplacement ideal deplacer quartier lequel reve passer temp libre,Paris
romantic tinder match romantically blast decide instead love bite current partner hinge success story,London
beaudry blood everyday gym,Montreal
classic example enshittification tech eventually platform extremely appeal customer customer screw customer attract business platform finally business whole descend pointless shamble,London
toronto screw become unaffordable hole government cater investor condo developer monthly shit apartment deal loser insane gas insurance shitty ttc hour somewhere quality anymore average joe toronto,Toronto
wild guess report besides interrupt jump onto colder desperate,Montreal
remind encounter creep swastika draw star yorkdale dishevel homeless stand infront didnt word stand nod gesture im brown pride pin bag pray didnt thankfully didnt,Toronto
ete plutot surpris trajet lorsqu compagnon voyage mi hurler operation nightmare jeter sou siege deja attire attention miroir princesse plastique tenait ostensiblement deux moignons,Paris
another protest yesterday armenia armenian demonstrator march september yerevan urge solidarity ethnic armenian breakaway azerbaijani region nagorno karabakh baku launch military offensive karabakh armenian separatist anti government protest armenia demonstrator government stronger action azerbaijan,Toronto
yo aussi montreal alors avant surtout medias parlent aussi pire laisses vetements valise dehors quand reviendras si temperature negative ah ah,Paris
london half half ghost lie various mainly height tall lie,London
concrete tool voice ontarioplaceforallcomhttps ontarioplaceforallcom savesciencecentrecomhttps savesciencecentrecom petition volunteer donate e newsletter ontario instagram twitter save ontario science instagram twitter latest update premier ford destructive plan iconic toronto landmark write councillor mpp mp ontario science fall ordinary folk fight save space di pasquale david crombie powerful next elect representative councillor mpp mp ontario federal government intervene impact assessment act review province plan waterfront mp,Toronto
dface third real shadow michael reeder yet cover maphttp collection carte saint laurent avenue,Montreal
theory current rental demolition protection threat province wwwolaorg legislative business parliament session wwwolaorg legislative business parliament session push doug ford axe policy perfect enemy deal government,Toronto
vient demenager paris etude etre americain surtout jeunes faut porter vetements style nike nike voici illustration photosdepopcom b cecffbdebab pjpghttps photosdepopcom b cecffbdebab pjpg imagesmilledcom uvmxpmbmhcfag fprhbztugnpnghttps imagesmilledcom uvmxpmbmhcfag fprhbztugnpng staticnikecom image fautocssrgb wclimit e ac ddde porter sweat capuche sweat shirt pr af ar toute occasionjpghttps staticnikecom image fautocssrgb wclimit e ac ddde porter sweat capuche sweat shirt pr af ar toute occasionjpg,Paris
opinion unpopular antiquate million inhabitant rethink rely longer,Montreal
ontarians province clamor spa mind carpet dead migratory bird perimeter decade lease transparency environmental assessment ontario taxpayer,Toronto
wwwrecycleyourelectricalsorguk hypnocat electricals campaign recycle electricals item functional charity pat test believe interestingly waste product producer product,London
technologically advance piece kit solve grand pocket remote earpiece surely easy fix nick another sale,London
eg crosstown finally currently mess heck yonge eg simply forward head west,Toronto
homeowner believe majority nationally neither upset vote bloc via policy threaten bloc property value investment add fuel fire address matter national economics effective stance toward global fund nation flurry resource consume revenue collect corner operate concern incorporate elsewhere fall behind obsession homeownership bubble risk pop,London
inform landlord write mine extra google template rental tenant,Montreal
warden route specially morning rush hour express often half regular route cram sardine,Toronto
flat white £ chicken sandwich £ insane coffee london generally pret another appreciate freshly everyday homemade chicken sandwich £ sell,London
steal nail plant pot bike porch furniture garden furniture gnome rock name security camera door next door share video,Toronto
available mid november likely cancellation appointment mid november tire summer season tire shape,Montreal
dispose butt properly ash tray drink toss bin fire smoke mindful,London
paris weird native busy hang suburb smaller town mentality paris fun suburb similarity,Paris
weird older upstairs couple young infant cry ever baby fact disturb noise flat stair oddly louder silence v elephant bizarre inconsistent definitely ordinary three board creak assume creak bedroom weirdest completely suddenly significant noise realise unlike neighbor shrug beyond cease human activity unreasonable,London
infrastructure doctor longer incoming loose war roughly influx insane blame blame refuse accommodation million condo medical accommodation montreal answer budget construction plateau wwwmacrotrendsnet montreal wwwmacrotrendsnet montreal medical facility demand,Montreal
avoir supporter commentaires certains franco canadiens sujet accent francais depuis surtout monde travail alors famille depuis e siecle,Paris
famous bakery match item menu idk pastry sausage roll belgium guess £,London
viens quitter parce etait loin donc deja bien puis avant commence espere tous ceci si veux double salaire,Paris
elicit response avoid rapport potentially officer false answer slip false pretense,Montreal
typically download self promote personal trainer six preteen teen client body self esteem act bond lesson healthy mentally stronger physical aspect screen obesity aspect,Toronto
underwhelming far exhibit density mostly queue queue exhibit installation enjoyment hang,Toronto
currently paris initiative travel study multiple american elsewhere situation discuss behavior usual stereotype associate american main loudly attention behavior discretion philosophy behavior historical hotel subway act self behavior adapt culture rome culture culture fluently cannot google watch culture remain curious ignorance fully another culture act everybody english word french english slowly french american pace native french surprise waiter fluently everybody adapt body universal customer king misunderstand belief study customer king france french shitty customer customer,Paris
ca boulangerie adresse hello toujours pa francais touriste ignore bonjour ignore aussi comme habitude e tete fait circle bonjour,Paris
ok dog behaviour recommend dog advantage,London
chaque fois vois monde dis si surement dude meilleurs endroits apres pi genre semble couteau rentre pa si bien ca veux vite fait,Montreal
appreciate french native english bonjour merci appreciate,Montreal
rome fontaines eau potable tokyo toilette publiques panneaux regulierement strategiques yeux panneaux ratp surtout bon sen oui assume bon sen nord pa bon sen pa bon sen sen quand leve yeux panneau vois meme sen panneau,Paris
epoque grand pere annees certaines personnes france depuis chine sans ni francais ni meme aller autre epoque etait petite historique,Paris
due imo potential match finger tip woman able appreciate outside comfort zone profile personality revolve drink despite love co apps woman men connection beyond physical realise despite rarely suggest black woman profile hinge black woman attractive behave definitely race idea yeah white term pic,London
montreal apart downtown neighbourhood friendly easier style francophone rule regard english french french obviously welcome,Montreal
feed province dick squat fund transit properly toronto fundraise highway toll gas transit fail thereby,Toronto
speed pedestrian oakville ballistic suggestion km residential control bend summer total motorcyclist miss bend tree lawn kill gotta km,Toronto
establish massage therapist advertise therapist massage therapy relatively doubt receipt insurance register,Montreal
joint totally highly recommend independent jewish voice canada peace jewish voice peace canada project active montreal chapter edit add anti jew read send message lonely isolate jewish self hat jew anti fellow yeah little,Montreal
due nature topic likelihood brigade evidence previous tag controversial controversial thread participate commentator must significant r toronto prevent brigade violator ban rule action r toronto regular punish severity ie ban instead ban controversial unpopular opinion blatant racism push racist agenda careful rule engage dialogue,Toronto
doctor send request mine hospital luck,Montreal
love minimum wage hard french easier montreal french comply french bilingual bilingual easy bilingual bedroom rare $ except temperature extreme degree next winter montreal decide constant,Montreal
personally conversation route court,London
favour join climb wall brixton weight often climb climb fantastic body exercise core joint stability control fun satisfy trust,London
doit attendre pleine heure pointe ligne ligne vraiment fin monde prends temp vite pensais tt punaises moins monde pa tout ca pa juste initiative seul etre pa grand oui largement pire vie sais doi vouloir juste eau va pa faire ca si ratp pa peux toujours prendre velo,Paris
recent political development canada india stir pot visceral hatred hindu nationalist canada fuel nativist tendency indian canadian comfort toronto neighbourhood indo canadian sikh hindu religious weather together offline,Toronto
ttc midnight uber lyft freeze cold yet poorest suffer drink,Toronto
american connection london pandemic turn neighbour infestation route little crawl nightmare,London
term coverage network recent compare provider orange sometimes crazy higher cheap network network poor customer,Paris
