body,subreddit
title six musical write toby marlow lucy moss director lucy moss jamie armitage actor jaz robinson julia pulo maggie lacasse krystal hernandez elysia cruz lauren mariasoosay mirvish production venue royal alexandra theatre toronto dec critic queen brief edmonton citadel theatre canadian production toby marlow lucy moss tony award musical henry viii ill fat wife finally toronto luck royal beyond current dec write british cambridge university edinburgh fringe six reign supreme wherever play west australia broadway pre broadway aforementioned citadel elsewhere six song catchy message female empowerment solidarity inspire design costume choreography poppingly fun girl pop concert pretend dramatically engage piece theatre six lean stadium concept character joke consort strut onstage hold microphone exclaim ya toronto tudor tour conceit six monarch repeat gruesome classroom verse divorce behead die divorce behead survive return graf crown leader band audience vote winner winner malign ill chronological female band rockin lady queen present gallery julia pulo bring vivid personality impeccable comic role anne boleyn joan marcus handout winner imperious devout catherine aragon jaz robinson marry henry older brother pass along possession anne boleyn julia pulo infamous decapitation england catholic church jane seymour maggie lacasse allegedly wife henry truly love song six crown jewel reason tony score various cast album download stream marlow moss cleverly write simultaneously character belt act homage present ruler contemporary pop,Toronto
certain difference future edit downvoted misunderstand theory,Paris
satisfy whip whip harder fight instead hang real health starter,Montreal
another argument province spa mad lad suggest mover system connection monumentally stupid idea reasonably streetcar reduce bathurst harbour,Toronto
va meme voir etant quartiers genre meme tant femme si viens coin tres calme france sans beaucoup risques etre surtout beaucoup gen dehors tout heures abord grand ca veut pa dire va faire chaque coin rue si projet terme tout nord parisien va gentrification bien va prendre beaucoup comme autres banlieues style clichy saint pantin montreuil vient aubervilliers aussi ca va venir,Paris
advantage slumlords fake college lie brighter future await canada victim canadian currently endure crisis placate politician government political spectrum toothless policy allow success covet generation deny future,Toronto
vu certains thread celui autre oldredditcom r paris meme sujet parce gen ratp idfm etait trop dur,Paris
ashe add member pickering anti black racism task shock upset robinson remark ashe highlight gravity situation damage impact councillor robinson suspension direct consequence action decision conclude ashe reflect necessity uphold integrity council maintain ethical strongly urge responsibility action refrain false harmful comparison sincerely apologize black hurt offence guide nimrod,Toronto
cancel hour prepare item miss delivery mandatory delivery deliver delivery another,London
london soon court tube supermarket nearby cheap sandwich lunch google name jump eta blind finally,London
shopper advantage optimum certain $ whole pc optimum network zehr nofrills valumart,Toronto
canada young suckle young foreigner feed political government party generation,Toronto
$ grocery cook meal flyer advantage discount inflation product discount pre meal mind name product,Montreal
salary immigrant higher variety product slightly necessarily relate brexit notice amount rubbish,London
fellow torontonians obsess toronto contemplate measure discourage subsidize resident property ttc fare $ breakeven $ fare slightly profitable infrastructure,Toronto
sorry faites plaindre vecu derniers campagne ici tout monde appelle covid g reste mot justement demenager paris vivant faire amis ba si facile fais meme rue,Paris
announcement spanish version extremely laugh,Paris
wimbledon host monday monday wwwfacebookcom meetupmondays wwwfacebookcom meetupmondays cafe pub host reduce pub repeat customer coffee,London
vehicle often bar district sub higher,Montreal
homme entre cafe juste derriere derriere autre gen immediatement apres avoir passe porte homme arrete bloquant porte tout monde derriere arrete tous pognes porte escaliers fait passer porte manque generation tout monde entre derriere membre r sans aucun doute,Montreal
pedestrian bike path red menace behaviour driver commute bike bike path infrastructure cycle montrealers laugh complain mostly complain everything,Montreal
tough position metrolinx ct entity responsible construction schedule metrolinxmetrolinx protect enforce contract secret major claim compensation ct metrolinx tough legal position defend claim unfortunate rip metrolinx hire contractor renovate double promise blame construction contractor,Toronto
edit probleme semble pa etre ca malheureusement ca risque etre difficile eviter paris sauf suivre collectifs « » pa toujours techno voir ba pa regles malheureusement scene techno pa mal vers dehors paris qualite virage kilometre semblent correspondre aspect peu hard sinon plutot tendance rester petite salles gare mine machine fonction artiste encore assez peu regles passe h dimanche voir si truc envie decouvrir suivant seule paris plutot collectifs quelques collectifs sol paname soiree regulierement artiste bonne ambiance ambiance pa toujours techno ca permet peu gen,Paris
adelaide west tecumseth upset plan hour respite respite next bed capacity expand bed felix profit organization support shelter turn coun ausma malik represent spadina fort obligation unhoused toronto fundamental duty resident safely must act winter approach stability statement concern locate metre mary catholic elementary neighbourhood concern potential impact safety surround nick andrew across neighbourhood decide unfair present little little vulnerable society expose preschool hard afraid peaceful beautiful boulevard tree pollinator garden dog overnight andrew add resident malik plan forum resident next distribute flyer digital soon hire engagement facilitator barnes management manage engagement hold virtual information session establish liaison committee concern,Toronto
man strike conversation join outside cigarette ruin personally tend,London
guess avoid program gang drug possibly frustrate drink idiot camera extreme often organize neighborhood watch,Montreal
changer sexe medecins font enfants partie main alors medecins vont creer,Montreal
crois declaratif moins partie contre bord temp reel fr search aidfm paris aidfm franchement assez affiche panneaux quai ca permet placer rentrer,Paris
quelques mois musique regardant portable quand entend bruit tres fort travers casque bruit leve yeux vois tout monde regarde mec tete contre porte pa peu fort arret suivant,Paris
prohibit certain prohibit certain reason elderly race shape,Toronto
francais etes pa peux pa parler fallu autre fasse jamais dire apres bouge amis faut pa avoir,Paris
girl court display love,London
nazi imagery completely ban canada outside artistic educational faith argument speech slippery slope,Toronto
guarantee appointment loophole waste page glitchy appointment km doctor trouble clinic montreal covid appointment message pre covid clinic bonjour sante appointment tip appointment clinic claim province health card appointment ramq card appointment next $ appointment claim ramq card bonjour sante provincial federal bring bureau attention unfair business clinic bonjour sante sante clinic refer dead fall,Montreal
condo ratio median wage property value solution property value drop median wage double toronto wealthy middle rollback property wage,Toronto
agree uk exaggerate rome worse rubbish everywhere bottle sometimes item mess culture simply able anytime soon enforce introduce extremely litter fin,London
personne bout autre tout trajet debut etait telephone parlant fort quand parler langue sans telephone juste main comme si tout monde sais quoi tout monde etait rien dire,Paris
couple till segment far river segment rest connect airport,Montreal
din however claim clear admit fact appear wwwadrakyorkvilleca reservation,Toronto
penalty kill pedestrian cyclist minimal drug alcohol involve wwii woman toronto kill pedestrian sidewalk suspend licence toronto ttc,Toronto
laquelle cone dit cone quitte commerce coupe canadiens montreal,Montreal
treasury bond council treasury split bond holder ten sell buyer bond holder reasonable return,London
surprise surprise vp communication former staffer ford government manager communication navigator closely associate conservative politics across canada corruptariosubstackcom p spa casino revolve door conservative party therme clear,Toronto
# upvote downvote reminder image appreciate upvote love downvote upvoting downvoting image control subreddit bot action perform automatically moderator subreddit message compose r london concern,London
single francophone interact pin sub bet reverse nearly often toronto edmonton winnipeg sub,Montreal
hi alot ivry connect paris paris far bagneux paris paris subway rer boost ivry seine bagneux,Paris
recently pre pret raise inflation maintain turnover swear boot meal deal lunch e pop article hat pre covid transaction september transaction london worker ouch london london west london suburb london airport,London
tesco boot meal deal easier pack lunch sandwich office fresh roll supermarket lunch,London
entre prix quartier touristes bonne partie cafe deux touristes font monde pa gagne,Paris
beau tellement beau chef grand pense pourquoi pa grand region,Paris
claim witness utterly useless montreal avoid actual luck construction worker tag useless,Montreal
hi quick ive purchase london cant figure terrible name sell slightly,London
wtf ttc soon tee hee ontario size oh customer fuckery regular ride instead acton king orangeville horsey cruise range rover bmws state art secure palace conveyance interaction spah,Toronto
spa land profit infrastructure benefit resident pander land provide employment guess provide revenue subsidize,Toronto
double property remain vacant term lease count occupancy heavily regulate term lease space property term lease airbnbs similar bullshit implement vacancy vacant retail space,Toronto
maker pret manger vegan wrap tear inquest woman severe allergy story tear inquest woman severe allergy,London
orange downtown transfer outside flat zone taxi surge uber slightly value likely expensive taxi,Montreal
headquarter lmao luck path grind underground navigate ttc tunnel path convoy gonna fun blockade absolutely,Toronto
europe summer ama roll hq position former colleague partner toronto young smart talent late,Toronto
village name avoid although neighborhood,Montreal
cherche pensais egalement impression tres calme egalement possiblement partie parce prix gen pa trouver mieux rester appart moins cher truc sorte ca,Paris
patient roster allow schedule patient appointment regular four hour four reserve hour emergency appointment monday vacation overseas doctor border typical doctor patient roster patient patient,Montreal
favorite london church religious beautiful quiet peaceful sit surround anytime london,London
cinema easy literally showtime exorcist ever appreciate tip thread,Toronto
weird access affiliate vehicle access middle lawn lmao,Toronto
individual write email directive catherine councillor unclear identity catherine councillor email currently merchandise topic yet email markham library initially respond monday email state email inaccurate confirm display islamic heritage remain present library remainder october,Toronto
plan annoy opt transportation argument whether plan hard argue plan,Toronto
montreal doctor quickly extra shore montreal average infinite list yet list,Montreal
citizen brain ray range unlike range brain system power brain ray peace democracy collapse,Montreal
instal system activity neighbour inside active video evidence quiet crazy woman door video landlord solve,London
cat property mind cat real estate agent spare usual real estate agent dick,London
si moyens peux gros suivant trouver visiter attention contre quand etais etait €,Paris
pa unique plusieurs intersection rev denis sans lumiere velo ca tout temp semble trop aveugle faire entre cercle complet vois tous jours sans piste cyclable,Montreal
budget moins cher $ personne serum h autres faut faire queue avoir billet puis faire queue rentrer pa tres confortable pa tres propre classique taxi tarif « aeroport downtown » $ uber environ pareil peu rapide confortable coup,Montreal
si aime ravioli chinois recommande ravioli nord rue saint denis fait maison tres bon rapport qualite prix sinon man rue tres bon enfin classique rue,Paris
convoy sir snarl traffic intelligence officer send convoy gonna snarl traffic gonna chief,Toronto
francais pa tres bon answer english idea amaze winter mid february longer ski leather boot snow boot winter weight easier tube must mount royal slightly cross ski jean drapeau february montreal lumiere art nuit activity music concert museum winter fresh ice rental explore underground cold pop hot chocolate cafe carry quebec,Montreal
ah metre carres rue bretagne eme € salaire € vivais relativement bien fait truc complique k€ trouver metre carres sinon largement faisable,Paris
ontario government financial compensation legal expert cross dougie mind simply focus,Toronto
grow montreal abroad approx montreal extremely bore downtown suburb everything accessible compare winnipeg mtl eternally vivid trip commit montreal w significant difference compare winnipeg,Montreal
manage traffic regularly officer sip coffee browse instagram chat construction worker hang intersection absolutely manage traffic totally useless dime gifemotefreeemotespackfacepalm,Toronto
neighbour loud xbox tv loud pm tv loud pm… dog bark loud dog,London
london necessarily picture celebrity special comfortable share picture read discuss,London
emmenage eme deux mois juste dessous rue mouffetard vers gobelins savais pa etait arrondissement aussi attractif habitais eme avant aimais beaucoup quartier vers pere lachaise,Paris
possibilite devenir jour proprietaire avoir femme enfants juste celibataire pa meme gagne pa ca femme gosse donc moins vouloir acheter vais loyer jusqu fin,Paris
pa recommandation particuliere commence therapie recemment donc sais pa si psy bonne voici trouve epluche doctolib regardant donc ca prend temp chaque fiche pa presume psy fout donc serum avant tout rapport pecuniaire souhaitais pa si fiche parle methodes complex regle generale passais tour si fiche evoquait mot ca peut aider certains ca totalement professionnel si fiche etait redigee telle facon message etait « professionnel va aider » zappais egalement cherchais quelqu aider… pa quelqu aider enfin sache certains psy peuvent aussi faire seule seance laquelle aident definir besoins recommander aupres collegues si besoin bon courage tout ca,Paris
exactly london closest reckon victorian tenement communal garden laundry toilet guess communal laundry facility indoor toilet peer wash machine scale laundry facility bigger london victorian access laundry copper garden,London
connect vote affect torontonians vote transit cancel doug ford office majority three elect tory councillor little ttc,Toronto
va mayfair tier club gymbox mayfair club upgrade plumb gym busy london gym,London
tinder champagne taste republique passerelle douanes amelie hang cafe mini tour paris,Paris
pop entertainment district famous pub malley double moldovan bar arnold schwarzenegger undercover mission fubar lakeview trinity bellwoods feature season umbrella academy feature fourth wall enthusiast allow breathe favourite story,Toronto
allez consulat tout instruction inscription consulaire demande carte identite passeport faut apporter apres avoir pris rdv inscrit serum bien jour quidams ligne diront,Montreal
capacity flat £m contribute supply endorse development everywhere exception,London
sorry review agree suck majority diss skew favour woman introvert indian immigrant ridiculously hard easier white british men apps seriously travel partner indian passport visa exposure travel obviously personal circumstance men apps ugly extremely hot mental physical health apps shit previous relationship india partner okay loss okay rest south asian woman insecure introvert abandonment thread anxious everytime anxious match app british brown unmatched unsure voice accent bigger apologise drop text response anxious type apps men physical trainer therapy apps curse mediocrity screw,London
room colorful roof constantly picture tbh annoy vigilant pull curtain hang room peace aware inside constantly peace annoy bedroom window picture picture hide definitely defend picture,Montreal
black asylum seeker fund divert address ukrainian asylum seeker hopefully fund provide asylum seeker,Toronto
necessarily hunt total story legal healthy assume plan lake shore imitate wwii pompom mount humber bay,Toronto
drag bar paris montmartre hi fact personality montmartre neighbourhood,Paris
idiot consequence crush bike severe punishment studity recklessness,Toronto
zone stick faster major camera zone idiot incident idiot upset zone lane afterwards dude pass stare star blood idiot speed zone driver wish worst,Montreal
sidewalk hide urban garden unique entire artist kilometre describe hide garden r oldredditcom r space space accessible corner create appear decade venice amsterdam canal montreal ruelles ruelles,Montreal
supporter habitant certains village jeunes fille familles complet mettent leurs maisons suite,Montreal
read article exactly redevelopment clamor exactly purpose rental imo net positive,Toronto
berrios felt wild roll vladdy interpreter confuse score gonna game killer feed garbage,Toronto
certificate allow english english believe period regard access english ok read international permit study english bc certificate,Montreal
toronto hahahahaha,Toronto
hospital claim td bank resp newborn birth assume hospital relate clearly access outside hospital birth,Toronto
major blow western europe behind compare tube tokyo seoul,London
neighbourhood risk green p everything driveway toronto raise enforcement article fall toronto launch consultation citywide strategy lead real estate devote stationary vehicle driver exercise global trend urban reconsider decade plan orthodoxy dictate ample cheap thrive proponent philosophy argue reduce amount space us reduce traffic climate target proposal readily available expensive provoke pushback driver higher business recover pandemic patrick siegman san francisco transportation planner sea underway reform snowball roughly quarter authority weekday occupancy cent facility overcapacity candidate higher range $ $ half hour jeff dea vice president business development toronto authority agency approach reasonable discourage term frequent turnover allow business authority typically review annually three pandemic dea acknowledge little bite agency recommend modest raise board november dramatic,Toronto
