body,subreddit
heavy metal variety montreal metal scene fantastic saw cannibal corpse birthday dozen beer pat wish happy birthday crowd surf mayhem course montreal heavy metal heavy mtl die covid death,Montreal
honnetement internet sel n'a besoin d'etre refrigere garde longtemps fais tremper min avant t'en servir garde facilement mois peux trouver petits pot bouchers general saumure fois sortis vendre gardera va acheter gros seau,Paris
bonjour deja paris j'avais autour transport billet paris cdg ausvalable l'interieur paris sais valable exemple strasbourg st denis gare nord ligne puis rer b l'aeroport savais pouvais l'utiliser ausl'interieur paris rejoindre gare rer exemple prendre ligne direction gare nord ensuite rer l'aeroport faudrait autre billet rer ratp n'est clair voulais demander,Paris
autres humains probleme apres proprio chiens respectent ramasser crote franchement fois demande crottes chiens vu taille eim pire pire petite rue,Paris
chef instead cut kitchen chef thoughwe desperate cook,Montreal
exact asian compare serve lockdown quality dramatically trust medon't ask,London
kill reckless cadeath higher suspension license license suspend suspension reasonable risk idiot,Toronto
actual southbound ramp mccowan sadly wonder attempt cross ebike egregious though,Toronto
honnetement vais honnete sans physiquement impossible oublie suite personne louera arnaques moins moyens mirobolants deja etant galere sans nom alors distance,Paris
vivre vivre possibilite jour proprietaire femme enfants juste vivre celibataire choose gagne k femme gosse moins vouloir acheter vais vivre loyer jusqu'a fin life,Paris
maire vient d'etre placee garde vue e prise illegale d'interet projets construction mondehttps wwwlemondefr decodeurs article brigitte marsigny maire noisy grand placee garde vue affaire financierehtml#xtoral %bdefault%d %bandroid%d,Paris
drapeau palestine cette semaine envoie message vois etes contente civils israeliens ete tues teroristes shani louk cafavre paradee rue resultat previsible,Montreal
what's ban pet renter encounter scenario lucky permit dog dog owner clause unreasonable longer dog allikely engage antisocial behaviour attentive dog owner claim clause hard comply dog several someelse lodge however however accommodate one,London
man half meal deal fancy decline dont common older men flirt manner uk rather bold shut soon possible sorry experience,London
vivant passer veux t'assurer matelas securite niveau finance projets ambitieux qu'une vie jour jour doit complique,Paris
article clear batey shock lynn deutscher kobayashi president national association japanese najc greater toronto chapter fast complete october bell rewant notify particular piece dismantle estimate timeline later provide najc ontario's ministry infrastructure bell relocate location ontario timeline state dismantle removal bell slat begin monrun october storage oct construction begin thereafter,Toronto
moyens peux kokoon gros suivant criteres chargent trouver apparte visiter attention contre quand m'etais renseigne c'etait €,Paris
popular opinion race instead class lower class disproportionally minority commit crime white lower class exempt commit crime higher systematically discriminate poor class require major nearly measure affirmative action class base race base,Toronto
shortsighted stupidity enable mode transportation beneficial possible traffic hard really…,Toronto
risk whenever signage bonus fire hydrant gonna assume ticket's windshield wiper what's legal clearer,Montreal
entre prix quartier touristes bonne partie cafe flore magots procope sacres attrape touristes milliardaires tels bollore font pression l'edition gagne,Paris
package nearby office verify otherwise amazon specifically delievery amazon drop package front door steal trash package theft neighborhood,Montreal
store paris beautiful sell wax bust napoleon cheap € unique definitely store beautiful,Paris
attract suburb font transport commun faut cave pire vouloir traverser auto visiter montreal suburb anywhere adequate functional competent transit system ny tokyo ferais pa,Montreal
defense pendant longtemps j'avoue n'apprecie cet endroit extremement betonne malgre recentes tentatives mettre vert quartier construit dessus sol complique mettre verdure l'eau pousser grand arbres trouve contrairement certains quartiers paris defense n'a aucune ame aucune culture vraiment juste quartier d'afbonde semaine vide weekend parvis simplement commercial bureau aucune vie quartier n'ai aucune sensibilite l'architecture grandes tour beton immeubles verre surement photogenique certaines personnes touche bref truc,Paris
weird older upstairs young cry ever they'd baby fact disturb noise flat stair oddly louder others complete silence v sound elephant bizarre inconsistent definitely anyordinary three wake floor board creak assume fee creak directly bedroom weirdest somecompletely suddenly significant noise realise unneighbor shrug imagine beyond cease human activity unreasonable,London
i'll hate truth moral ethical obligation frenchor english montreal english 'getting by' communicate suck write advertise suck constant reminder outsider basic insult waste forpromote x stupid communicate fraction lower lower island recommend effort basic whether duolinclass whatever fluent struggle basic convo suffer tgenerally respectful acclimate personally english polite zero difference,Montreal
hello femme ici pris plein fois rer b tard souvent dernier d'ailleurs aller antony massy jamais trouve notamment antony encore beaucoup pire vu mec vomi wagon l'odeur c'etait horrible bon c'etait degueu craignos vrai rer globalement plutot rempli trouve craint trop cote sud jamais allee loin massy moins fan prendre rer gare nord contre beaucoup craignos chatelet soir trouve tant fille auspris plusieurs fois noctilien denfert antony peux comprendre reserve certaines globalement va peu folklorique,Paris
monday medium release representative customer major wireless connect g text stream ttc subway system,Toronto
ctv toronto arthur vale bore monotone channel induce financial news journalist television succeed determine manage viewer sport report inform entertain tenure,Toronto
underwear basic plain colour shirt wash fit glove vest wear everyday fade wash comfortable warm worth imo outerwear play dress clothe,London
beau tellement beau chef connerie grand genie pense tiens pourquoi emmenerai prisonniers courir bois grand region,Paris
full brit fly orlando daily book crap hotel tend bed bug fake far,London
bank draft fake clear bank anymore bank draft interac daily limit bank wire expensive safest option seller buyer trust seller transfer ownership wire complete,Montreal
notice bag block others become amount bag astound,London
asylum seeker real immigration minister international quiet loud lucrative asset,Toronto
ok dog behaviour recommend dog advantage free,London
fella who's girl catch earl's court huge display affection,London
va mayfair club gymbox mayfair club upgrade plumb decent gym busy central london gym,London
stranger others desperate comment suggest message type woman seek girlfriend easy drama fun calm interracially girlfriend asian,London
exhibit except accessible culminate deafen driver honk nearly dozen driver block box,Toronto
london value £k main residence council tax adjust council tax value £ million london £k council additional £k ownership,London
downtown someimpressive nathan philip square kinda central past they've impressive wtf lift concrete slab foot print bottom fall garbage incredibly underwhelming tone rest saw reliance immersive art blah lake projector fee bird imagine nature wtf lower effort i'll enter fund art installation i'll traffic onramp gardiner sensation traffic i'll print imagine stick traffic work,Toronto
inform write mine extra nothing google rental agreement tenant sign,Montreal
others system quality treatment timely fashion example dad curable cancer girlfriend neurological illness access doctor easily access expensive medication parent financially ruin dad simply dead opposite doctor random doctor assume immigrant,Montreal
agree suggestion thread reality crash reduce overnight economic solve issue therefore approach focus three stability k worth k save supply attractive empty restrict predatory activity limit rental inflation stricter policy repair fault eviction purchase cheaper young buyer eg suggest stamp duty payable sale rather purchase guarantee zero stamp duty buyer benefit inflation fair share introduce rental purchaae tax higher subsidise conveyancing ftb cost,London
chez femmes sotype tire quatre epingles probablement veulent absolument ressembler touristes semblent deguisees genre petite robe fleur panier osier l'ete recemment portant genre chapeafeutre l'automne portant panoplie defile ensemble apprete semble copie colle d'ailleurs sinon stereotype panoplie touriste moins moins quand portent beaucoup hoodies basket curiosite tendances s'habiller pareil reste groupe,Paris
ontario onto gear inlow inlow asset arbitrary poverty remove list pretend list shorter incan't afford list,Toronto
theatre box office sell programme theatre pop programme definitely fix let ruin trip,London
merci gar malheureusement paris connais personne effet pense vais rechercher pendant deja paris j'etais conscient c'etait probablement impossible louer sans mentionner risque d'arnaques italie difficile quand faisable s'agit furieux marche immobilier parisien haha merci,Paris
parisien quelques annees sans doute ligne longue rame continue type style sdf jambe moche l'odeur va circule soudain s'arrete pousse cris rale enerves passagers autour s'enfuient clairement jambe grattait terriblement vois couteau main s'entaillait jambe retirait petits lambeaux putrides,Paris
montreal salaire net d'environ cad loyer pense mettre cote pourrais mettre cote clairement appartement emplacement boulot equivalent,Paris
fais skip uber doordash eat dish trouver restos loin chez tentent pi ensuite cherche resto google partir regarde livrent meme,Montreal
hello alors beaucoup commentaires avis beaucoup trop voit sub rempli parisien n'ont jamais passe periph auber n'est coupe gorge front pop mairie fort endroits globalement ok cliche seine st denis vie dure auber villes va profiter grand paris jo grandes transformation renovation jean jaures renovation canal st denis piscine olympique fort ligne quartiers renoves npru renovation urbaine l'etat eco quartier fort d'aubervilliers gare pantin secteur serum transforme cela dit chemins quartier vraiment agreable fortioti femmequartier dense marchands sommeil restent souvent dehors zoner parce chez petit insalubre conseillerai quartiers dessus plutot ligne pantin positif t'es loin eme eme eme avis parmi meilleurs arrondissements paris p vi hoche pantine ultra agreable mixte auber n'en encore niveau pantin viendra,Paris
yeah september shock hell they've cross justify expense convenience,London
immeuble administrateurs paye mois avon compagnie gestion egalement n'avez compagnie gestion considerez engager administrateurs doivent probablement passer beaucoup gestion qu'ils veulent gros salaire,Montreal
london half half lie various mainly height tall lie start,London
miss lockdown i'll delight wherever upset you… cherry cake,London
suffer properly actual torontonians flee hometown study several relocate somewhere afford basic cent,Toronto
poor bugger evict risk eviction dougie possibly disadvantage rich advantage poor conservative way,Toronto
minimum wage hard easier montreal serve bilingual bilingual job doable easy difficult bilingual competition… bedroom rare except temperature extreme quite mild variation degree celsius rain minus degrees…feel winter montreal bipolar decide constant weather…,Montreal
issue # clean store anywhere alot isopropyl dollar store spray bottle kill soothe itch bite,Toronto
rich sound american military diplomatic paris ww american presence paris fun parisschool,Paris
idea blind eye appointment specialist h appointment pm finally pm doctor min they'd medication optometrist min mind prescribe blind mind hurt opto medication likely everyone's quebec compare alberta immediately propose expert refuse stupid early symptom much,Montreal
neighbour loud tv loud pm tv loud pm… dog bark loud dog,London
quand j'etais vendeur boutique velo montreal scooter reparer crevaison explique c'etait velo electrique voir oui viens d'acheter velo electrique vendeur disait tse peux reparer velo boutique velo specialisee n'as velo carrement scooter electrique tellement dangereux piste cyclables peux pedaler lever souvent battery plomb,Montreal
pet folk pet trouble imagine pet due fair animal,London
solution relatively simple hard international arrive university provide residence international reasonable international cap international exactly easy review picture testimonial residence apartment unused starter unit school,Toronto
vu certains thread celui l'autre jourhttps oldredditcom r paris comment oaagp findesticketsratpdem%c%atrobusetrerquelles sujet parce ratp idfm convaincus c'etait trop dur,Paris
baby formula diaper shopper diaper sale amazon formula diaper mart stock amazon shopper pm we're emergency,Toronto
charge overnight guest we're ready intimate head present ipad payment optionslol oppose tenant sex life,Toronto
weird liken spareroom tick list preference blank realise pinnacle lovely little distant she'd grandparent hit hard middle divorce almust strange drop message we'd happy pass archive whatsapp profile pic wed photo,London
obviously suck however shock travel concert young man slice music festival five mile gaza border nothing rich overseas buddy party drug glamor selfies automatically deserve fate kharkiv piece advice,Montreal
example enshittification tech eventually platform extremely appeal customer customer base screw customer attract platform finally descend pointless shamble time,London
certains parlent fort s'ils n'y qu'eux personne d'autre certaines deguisent parisienne cliche overdress beret mariniere rayures certains mangent plat d'hiver prevus donner chaud plein ete soupe l'oignon bourguignon servent pendant canicule expres seuls client touristes plutot amusant,Paris
grow generation london involve happy mug worse comment biggest concern lately tory gutted fund nh dentist transport strike shitshow brexit ha,London
citizen brain ray range unlike russia's range brain reprogramming system power brain ray afternoon peace democracy anxiety evaporate reassure slight tingle spine collapse worth,Montreal
bonjour cette association paris d'aide femmes battue hafbfr psychologues juristes travailleurs sociaux possibilite mise l'abri disponibles accueille egalement enfants base c'etait reserve femmes sans abri maintenant accueille femmes victimes violence qu'elles sans abri contre beaucoup parfois l'attente longue voila horaires lundi matin h h apres midi h h mardi mercredi h h jeudi rendez vendredi h h numero violence femmes anonyme gratuit h jours,Paris
cold citran along grocery item loblaws box packet shopper exact product shelf grocery store's higher due convenience factor evidently,Toronto
create alternative reduce traffic ie senior transport amount easier bike infrastructure bike anyfeel safe allow road they'll bike protect transit yet option along avoid traffic bloor mill strongly disagree safe cycle infrastructure one,Toronto
island everycan't legallyjust allow others die remove anybody subsidize fight tooth nail lifestylewhich except lucky ago,Toronto
london picture celebrity special comfortable ahead share picture read discuss hindsight,London
fee guarantee appointment apparently loophole unserviceable waste refresh page desperately glitchy appointment km doctor choice trouble clinic montreal covid appointment automate message pre covid clinic bonjour sante impossible appointment pro tip appointment clinic claim health card book appointment online ramq card they'll book appointment fee appointment claim ramq card fee zero governmental oversight bonjour sante provincial federal competition bureau's attention unfair practice clinic bonjour sante alternative monopoly clic sante clinic refer dead deem fall purview,Montreal
however onto partner general direction travel single sentence reply bore partner tend bore lately term lack depth conversation cultural avoid neurotic whatsapp text communication frequently rather fuel empty online chat trigger frienships,London
terme € seance renforcement poids corp appartement petite course pied semaine techniquement chaussures course peuvent couter peu cher fonction parcourues peuvent tenir bonne annee regulierement bonnes promos genre chaussures peux t'en tirer € paire regarde dealabs exemple souvent %,Paris
ramq three arrival wrong similar situation eligible reason fight argue politely possible complaint specialist turn decision base assumption send proof later receive wife's card automatically apply,Montreal
l'endroit cool pire publique techno paris veux vraie vibe va shotgun choppes soiree techno collectifs presques inconnus niveau l'aventure vibe toujours meilleurs t'aimes soiree backroom y'a toujours monarch,Paris
allow ramq drug obligate pharmacy coverage insurance bill system pharmacy receive bill ramq portion luckily claim past charge afterwards,Montreal
ligne heures pointe souvent retard regulation bagage oublie autrebref connais statistiques regularite cette ligne doit rise,Paris
ai've attack blood everyday gym thing,Montreal
deck parisian landmark ceiling toque wasnt experience,Paris
example loblaws wallet compare pound unpackaged potato pound sale lb bag absurd,Toronto
east west connect pickering scarborough york mississauga pearson connect markham richmond hill vaughan pearson brampton,Toronto
authority council reprimand former member view reprimand request conduct resign office serve purpose typical hold position power responsible connect millionaire suffer joke,Toronto
study permit license suppose situation suppose behind inside intersection spot turn literally till pm what's correct behavior behind till spot genuinely wonder roundabout i'm,Montreal
cad mobile include mobile g g g mexico argentina brazil dozen cad mobile include unlimited legit sim card mobile whenever mobile cad loool internet provider provider insane work,Montreal
advance piece kit solve grand worth phpocket small remote earpiece surely easy fix bottom nick phanother sale care,London
trouble track erables highway rue camille bank petty theft violence drugsso drug avoid tunnel montreal ouest night,Montreal
unique plusieurs intersection rev st denis sans lumiere velo l'arrive conducteurs semble trop aveugle distinction entre fleche cercle complet j'en vois jours sans piste cyclable,Montreal
sort recommend hot club hike friendly travel idea want,Montreal
cinema cinema loud watch original special screen director cut listen voice message whatsapp,London
ete plutot trajet lorsqu'un compagnon voyage s'est mi hurler operation nightmare jeter sou siege deja attire attention miroir rise princesse plastique tenait ostensiblement moignons,Paris
# upvote downvote reminder image appreciate upvote downvote upvoting downvoting image control fee subreddit bot action perform automatically moderator subreddit message compose r london concern,London
toronto screw become unaffordable hell hole government nothing foreign investor condo developer dont k monthly apartment deal loser dont insane gas insurance rate shitty ttc somewhere min quality anymore average joe toronto,Toronto
recommend colonial describe smell taste closely link recommend someplace wine taste beer beer taste recommend l'amere boire excellent quality pick subtlety aroma flavor,Montreal
remind encounter swastika draw hand star yorkdale dishevel random homeless stand infront hand didnt word stand nod gesture quite scary im brown pride pin bag pray didnt track thankfully didnt get,Toronto
protest armenia armenian demonstrator march september capital yerevan urge solidarity ethnic armenian breakaway azerbaijani region nagorno karabakh baku launch military offensive karabakh armenian separatist anti government protest armenia demonstrator government stronger action azerbaijan,Toronto
pristine clear lakewater 'omg paris incredibly dirty' overrate american dude complain 'piss smell' among bitch paris forest smell 'dirty' dudeit's forest dirt paris smell piss 'everywhere' river restaurantetc,Paris
# upvote downvote reminder image appreciate upvote downvote upvoting downvoting image control fee subreddit bot action perform automatically moderator subreddit message compose r london concern,London
concrete voice ontarioplaceforallcomhttps ontarioplaceforallcom savesciencecentrecomhttps savesciencecentrecom petition volunteer donate e newsletter ontario instagram twitter save ontario's science instagram twitter medium latest update five premier ford's destructive iconic toronto landmark write councillor mpp mp ontario science fall ordinary folk fight save di pasquale david crombie somepowerful 'five issue' among reach elect representative include councillor mpp mp ontario federal government intervene impact assessment act review province's waterfront someworth mp,Toronto
pedestrian wander bike path red menace behaviour driver respectful commute bike evolution bike path infrastructure resistance acceptance cycle montrealers laugh complain mostly complain anyway,Montreal
sound city's current rental demolition protection threat wwwolaorg legislative bill parliament session bill wwwolaorg legislative bill parliament session bill push doug ford axe policy let perfect enemy deal government,Toronto
transport paris gratuit quasiment gratuit francais deja payons l'enorme majorite budget peu navigo rapporte budget pourrait complete n'importe quelle ressource supplementaire region additionnant tax biens personne ceux patrimoine million d'euros utilisent ici parlent tarif ba n'ont jamais regarde vie representait prix navigo budget,Paris
island impact construction popular island centropolis weekend populous montreal surround benefit transit bike transit system far perfect future fill bike cleaner healthier population sou entendu,Montreal
clamor spa mind carpet dead migratory bird perimeter decade lease foreign lack transparency lack environmental assessment ontario taxpayer,Toronto
# upvote downvote reminder image appreciate upvote downvote upvoting downvoting image control fee subreddit bot action perform automatically moderator subreddit message compose r london concern,London
inquietez s'entendent toujours dire francais serum langue parler grace montreal d'ici generation b va inquietez pa,Montreal
eg crosstown finally road currently force mess heck yonge eg simply forward head west,Toronto
whenever unusual fun london viktor wynd museum curiositieshttps wwwthelasttuesdaysocietyorg museum novelty automationhttps novelty automationcom gender freaky club pedestalhttps wwwclubpedestalcom mainhtml exceptional,London
quelques mois musique regardant portable quand j'entend bruit frappement fort travers casque reduction bruit leve yeux vois regarde direction y'a mec frappe tete contre porte peu fort descendu l'arret suivant,Paris
route specially morning rush express half full regular route cram sardine,Toronto
opinion courtois savent comporter japon contraire bordel vivant qu'est mourrial tokyo genre million d'habitant ordonne propre mourrial ba surplie caprice minorites veux vivre japon parle japonais agit japonais s'attendent etranger normalite meme,Montreal
steal anynail pot bike porch furniture garden furniture gnome rock security camera house's front door online door share video,Toronto
exactly central london reckon victorian tenement communal garden laundry toilet later communal laundry facility indoor toilet peer wash machine scale laundry facility bigger london victorian access laundry copper garden,London
illegal settlement jew scatter none jerusalem palestinian capital minuscule jewish today jewish virtually palestinians… hindsight acquaint history behind birth israel objective mind cannot faith blind cruelest contemptuous injustice story ill intent total contempt towards palestinian britain america israel frankly disturb certain become geopolitical super volcano guarantee wreak design oil virtuous crusader human democracy decade aware situation petty hypocrisy nobody lift finger raise eyebrow outmiddle east fear reprisal america ever raise eyebrow upon medieval israeli government deal treat palestinian population voice outrage wrong folk laugh accuse support terrorism anti semite anti democracy subject slippery explosive word field potentially derail career lead job loss ready fist fight insist they'll bully beat narrative deep aby human darkness… dangerous potentially lethal subject opine jump wade murky water shark infest water atheist rural quebec belief freedom award earth numerous jewish sadly dare ongoing tragedy displacement population criticize israel's criminal behaviour respect palestinian brother sister vive palestine libre,Montreal
term coverage network recent compare provider orange sometimes crazy higher bouygues cheap network sfr crappy network stupidly poor customer freeorangebouyguessfr,Paris
ride island yell twice south shore summer block window yell bike path bike path nearby lack civility unacceptable,Montreal
romantic wake early snowy bord seine utterly magical spontaneous seize moment river picnic rooftop terrace george btw,Paris
hey london base girl similar position hate apps prefer coffee example along similar recently politely approach scar sense someone's body luck,London
ass limit zstick faster full major camera zcopsi useful idiot road rage incident idiot upset cuz full zlane afterwards dude pass stare realize star would've kick coward nothing blood boil idiot speed limit zinfluence driver safe wish nothing worst,Montreal
