body,subreddit
j'y habite j'aime beaucoup habite tour bord dalle jolie vue paris grand pietons enfants peuvent aller l'ecole pied sans traverser seule rue milieu dalle mineral autour petits coin verdure contre dimanche matin dalle faut aller cote ville,Paris
immeuble m'a demande mois loyer l'ai montre solde restant moyenne mois loyer pense besoin d'avoir bon credit,Montreal
crazy lately cool literally matter woman package hot late connection others matter woman darker skin tone attractive white woman herritage exclusively older connection london london,London
control apartment currenter empty unit value tenant unit blank envelope receipt previous door increase,Toronto
favorite london church religious beautiful quiet peaceful surround anytime london,London
metro's orange cheapest option downtown transfer flat rate zone taxi surge uber slightly value uberxl luggage likely expensive taxi,Montreal
beaucoup commentaires parlent perso quelques connaissances derniers mois vois beaucoup beaucoup matelas affaire abandonnes rue « punaises »,Paris
alberta dual citizenwho fluent v anglo quebec resident mandatory class amount quebec mandatory class quebec nuanced quebec nope tuition better,Montreal
course english province,Montreal
photograph england strict privacy monetise possibly interest,London
unfortunately opinion complicate various detail version view,London
pareil aucommentaires n'y va bon techno d'un dj adore decu qualite sonore ba contre e tant dj veux passer bon moment l'endroit sympa,Paris
accuse threaten identifiable warrant charge arrest cp accuse suggest minor target identifiable statement harm jew vagueness article suggest indeed weird report utm jewish otherwise deserve threat jewish fundamentalist threaten harm muslim bigotted fundamentalist article seldom restrict bigotry group,Toronto
read councillor pedestrianize majority resident vote pedestrianize ignore favour loud nimby louder help,Toronto
jean sartre rock river let perfect rule agree exist,Montreal
z definition unbelievably globe similar 'barbarossa' 'hasdrubal' wow gaza'd eastern,Montreal
toyota lexus fix product majority theft victim rx toyota lexus profit,Toronto
# upvote downvote reminder image appreciate upvote downvote upvoting downvoting image control fee subreddit bot action perform automatically moderator subreddit message compose r london concern,London
parisian sweatpants legging rip jean loud conversation pub loud eat loudly stare certain rule litter outfit nobody care,Paris
multiple cross cross south cross south week,London
mauvaise trouve etonnant vont passer leurs vie prison faut montrer qu'on confiance contre gu sais s'ils bon j'imagine vont retrouve rapidement j'ose esperer retour prison serum auscool,Paris
recommend rather agent manager blanket pet policy success happy cat,London
release ignore advisory whether perpetrator race religion personally believe,Toronto
infant he's mannered dinner fantastic idea appropriate parent entitlement presence impact enjoyment around,Toronto
buddhist gta buddhism stretch accord panaioti expert buddhist philosophy toronto metropolitan university trace construction railroad worker railroad buddhism chinese arrive railroad lorna fandrich nearly later member buddhist toronto cent city's population accord statistic data wide variety buddhist worship slightly version religion however panaioti rely cash donation target,Toronto
room horoof constantly picture tbh annoy vigilant pull room peace aware somemight inside constantly observe peace annoy bedroom window picture picture hide asshole definitely defend picture,Montreal
story asign lease permission spweek load preliminary organize shelf clothe closet lock bin refill load relevant sleep lie yet teem bed bug infestation final lock midsettle sleep brand bed pre furnish previous tenant turn crux bed turn sleep charge pillow beside eye little dot scurry across screen spider somequickly turn literally dozen upon dozen tiny dot across headboard pillow swarm word describe immediately leap bed abject horror tear pajama fresh clothe grab recent bag grab wallet key several block shock flag taxi forever none little bugger hitch ride cab flee straight partner's soon door strip fully naked clothe double seal garage bag shower manage lease thank goodness swear idea let begarage fumigator apartment salvage tenant spconcrete garage everylaundry quarantine trash category officially partner store everyoutside balcony double seal bin wrap garbage bag fully treat fully inttogether anyway suddenly original w,Toronto
correctly answer application timeline reply cite universitaire cheap foreigner apartment add complication,Paris
insta page flag gonna edit twitter page assume assume ok video insta page link x page describe quirky humor entertain welp edit delete twitter,Montreal
montreal vegan montreal favorite vegan vegan coffee delicious vegan pasrecommdanoise amaze montreal burger fiance vegan burger style homemade burger contain allergic fry vegan chicken sandwich amaze swap impossible burger double highlight fry twice trip sushi vegan sushi regret sooner return fantastic across board sushi roll happy highly recommadditionally copper branch umami ramen delicious vegan italian burger fiance folk upstairs jazz vegan eggplant menu music worry food,Montreal
ah metre carres rue bretagne eme € salaire € vivais relativement truc complique k€ trouver metre carres sinon vivre largement faisable,Paris
folk legacy margaret howell oliver uniqlo ymc goodhood carhartt wip project worth brand gramicci patagonia bell outdoor layer functional style function,London
caf wonder receive conflict information whether whereas others accord discrimination ibans appreciate merci,Paris
reddit passport office yet passport reddit passport,Montreal
svp l'effet l'effet rapide aveugle difficile perception autant pietons automobilistes autres cyclistes merci,Montreal
attract woman chin counter da secret eh hai karatehttps watchvvqcxecw,London
recently thief approach bicycle throw behind pixel others thief iphones,London
internet camany become comfortable online real sadly pandemic accelerate everywhere device sometimes hold reduce attention avoid real real,London
issue bag milk appear fidget bag milk certain switch closure tab expiry odd occasion milk tend expiry cartoned milk,Toronto
hi season paris bedbug population bedbug july th fly bag infest likelihood rid,Paris
state scene base half dozen interracially specifically black woman black woman simply approach black woman fetishising clear usual opener hey chocolate momma somedaft black woman simply rather approach someelse concern however delight approach,London
cannot internet consent privacy regard land although allow picture inside internet consent cop renounce man picture complain cu b,Montreal
quebec reasonable privacy picture permission photograph photograph picture shoot portrait permission,Montreal
garage downtown toronto head islands' residents' committee downtown toronto bungalow somewhere,Toronto
sais bon master sorbonne science apres crois mal faut dauphine t'as surement prepas j'y connais rien dessus,Paris
document inform garage prior province's announcement firm secure contract ontario revitalization fact clear doc obligation assume responsibility situation contradict original development state taxpayer financial contribution design construction propose facility ontario place,Toronto
convenient opus card load onto travel load opus card effective option include zone seamless transfer entire trip,Montreal
personal evict condo later fight count pray weak fight back,Toronto
forget remind rob ford november keelesdale mayor rob ford premier dalton mcguinty officially grind project ttc staff release report completion eglinton crosstown realistic main reason project management transfer ttc infrastructure ontario us finance procurement strategy strategy contractor complete project effectively require contractor redo design complete ttc ttc metrolinx's aggressive timeline lead severe construction relate disruption traffic stretch eglinton avenue tear concurrently deadline enwikipediaorg wiki lineeglintonhttps enwikipediaorg wiki lineeglinton damn ttc right,Toronto
gta completely transit abysmal mississauga oakville match vast gta exacerbate touch jurisdiction europe city,Toronto
pilot waste anymore let drink disorderly conduct deal allow toronto baby citizen drink laughable drink condo hot summer turn cool drink inside basement apartment lol toronto grip,Toronto
# upvote downvote reminder image appreciate upvote downvote upvoting downvoting image control fee subreddit bot action perform automatically moderator subreddit message compose r london concern,London
favour join climb wall brixton full weight climb bonus climb fantastic full body exercise joint stability control movement fun satisfy trust,London
watch unbreakable kimmy schmidt three anyways scene roller coaster junkie play joke episode basically let scream soul eyelid entire fever ramble roller coaster,London
suck insidious bug suck bug travel anybody jump onto unfortunate advise stand ttc thank tip,Toronto
shelter worker mental health impossible medical province's solution ttc worker ttc rider somehow manage issue ttc bandaid solution insult bandaids bloc torontois,Toronto
semaine quand rentre bureau banlieue proche passe bande cyclable personne respecte plein voitures garees droite belle piste cyclable panneau paris,Paris
potential little installation meh conceptual art fan conceptual art imagine art art fund involve art helm excite contemporary art associate party terrible they're,Toronto
bullhead toronto supercars across lane slow crawl piss elicit honkening clearly attempt create highway stupid drag race funniest beater jeep shoulder lmao,Toronto
chaque fois vois enthousiasme poignarder surement dude meilleurs endroits cacher corp apres pi genre semble couteau rentre veux j'te l'aiguise vite fait,Montreal
ontario worst brunt multiple issue scammy college lure international false pretense fake promise employment ghost hotel unoccupied worst doctor shortage bc fix issue latest reform poor infrastructure development alright alberta worse mile behind bc quebec,Toronto
app search game football option ticket's desire,Paris
typical tag specialist appointment amount correctly clinique privee montreal quick opinion treatment clinic term clinic example refer system,Montreal
single francophone daily faq pin sub bet reverse nearly toronto vancouver calgary winnipeg sub wonder,Montreal
sorry pillar eiffel maintenance picture pillar specifique renovation november,Paris
yeah weird alright okay greet tintonate higher we're yeah we're genuinely concern tintonate yeah answer answer eg alright immediately brit general ya how's greet interpret exactly alright provide mouth speak,London
bike paris km round trip layer underneath shoe snow winter problem,Paris
champagne taste passerelle amelie's cafe tour paris,Paris
systeme navigo n'est surtout depuis navigo toujours prendre origine destination j'espere prevu avant jo h queue machine merci etait indique mettre lien sub idfm,Paris
capitalism capitalism raise poverty western policy refuse inflation slow economy elsewhere instead resource citizen capitalism supply chain issue grow imo thank,Toronto
control apartment nearly amount evict reason apartment literally door layout currently court situation unique sustainable we're past sleep evict,Toronto
romantic match blast decide instead current partner hinge success story happen,London
maurilca maurilca radio listen english tv radio content luck welcome montreal,Montreal
alsolve essentially unaffordable due demand supply hard revenue stream fight vacant owner perfect scenario investor perfect target luck gather support %,Toronto
y'a quelques annees avenue charles j'avais mec super menace frapper compagne deja scooter personne rue j'appelle seulement mal venir arrive tard mec allait tabasser pendant s'est contente partir apres menace j'avais pris montre note description tout,Paris
apartment officer gilot frequency smell source random corner dog skip sidewalk ankle trotinettes rid boulangerie client road hazard block traffic frequently muslim mine illegal muslim laugh common period british courteously regardless racism chamber initially immigration reform idea transform outright racism touchy subject sweep mainly witness full member ethnic table peak cup season,Paris
article highlight accord ontario rental registry design profit vivre launch transpareliable information renter policy maker tenant opportunity basically comparison mike moffatt found director smart prosperity institute partner launch vivre university toronto deal rip vary widely longtime tenant control apartment hold relatively affordable ontario control occupy tenant charge renter black hole information neighbour voluntary transparency otherwise operate matter worst behavior relation tenant reference link article relevant rentalregistryca registry,Toronto
comprends tellement probleme quand quelqu'un qu'on toujours demander s'il fout gueule arretez inconnus gen,Paris
c'etait y'a quelque annee maintenant aubervilliers visiter musee quelques bref prit bonne partie journee doi prendre tram tram l'arret va biensauf t'as groupe jeunes decide voie tram regroupe c'etait petit autour petit feu camp fallu regler souci ligne certaines faut s'attendre normalite logique duo auber chatelet entre etait premier cercle avant ratp vienne prendre serieusement probleme,Paris
various famine heaven sausage roll £ peter,London
report claim tag policy brand identify vehicle receive base deny,Montreal
currently energy rarely meter somemention prmess reason appliance neighbour shenanigan everyexcept appliance meter read min apart repeat appliance anydrain test energy action anyway,London
mid grow play grass lie play witness share weird village gay wave gentrification poor push room descendant faubourg safety gay necessity neighborhood wave feed settle preshistorically poor aanglophones plate ontario village neighborhood prescontinue frontenac hoflipper chase population anowhere poor frifamily drug link mentally ill cast ahome crack homale female prostitute split saint catherine ontario aroof network anymore situation revert balance somewhat era current situation worst angel v rock machine skinhead cobut sad invest communal kitchen roof reduce harm fight chase serious investment hohoflip contribute buyer rental neighbourhood extra income rant lest faubourg people,Montreal
aftermarket tracker properly instal havoc vehicle communication system control unit awake send signal improper wire tap cover manufacturer warranty factory instal lexus toyota steal news steal,Toronto
j'habite justement e quartier dont quand paris ado mi loyer tellement cher paris l'appourri j'occupe l'impression d'en peu tour beaucoup beaucoup touristes toute tournee vers cafe boulevard saint germain d'etre ridiculement chers touristes setter autres venus statut difficile circuler certaines rue rue tant appartiennent grande bourgeoisie milieu cotoyer moyens quartier populaire image alors devenu etait l'epoque l'a rendu celebre artiste laisse marchands d'art petits commerce salles spectacle boutique con rue belle send toujours paris historique enfin celui siecle ideal deplacer n'est quartier lequel reve passer libre,Paris
animal pet whose owner vacation basically fee pet french,Paris
# upvote downvote reminder image appreciate upvote downvote upvoting downvoting image control fee subreddit bot action perform automatically moderator subreddit message compose r london concern,London
lexus vehicle steal levine he's upset ttc provide security brutal steal elsewhere ttc,Toronto
read somewhere vincent office toronto sear merchandise loft curate artworkshttps jamiebradburnwritingwordpresscom vintage toronto ad vincent collection art sell sear roebuck catalogue neat piece,Toronto
toronto association civilian worker join suitable union teamster effectively isolate support netcan't union card hold certification vote employee specific successfully form union join,Toronto
patrick covid return wife mid busy stage hall various performance half hall display sale sale litter room otherwise remind everywhatca dad inherently pointless tee shirt lanyard patrick tee shirt lanyard everyjealous daughter boyfriolder wiser research decide mystery box con anyway mystery box confirm indeed con mystery box wife chat indiana jones someco play patrick recognise chat peter cullen voice prime stand afterwards shock he'd yet fantastic thexway conversation indiana jones forward quietly toy story laugh truly worth go,London
europe phd program anglo recent phd specific project specific supervisor phd institution affiliate detail research unit supervisor landscape academic institution complicate include overlap complex relationship institution affiliate murky anyclear stage specific unit fund opportunity phd polytechnique university reason particular institution specific research unit supervisor academic,Paris
let reflect fact original deadline announcement metrolinx totally imagine organization via vester horrible manager via political interference totally bust,Toronto
vegan mi fake chicken beef vegan type vegan ice oh card reader tip super nice,Montreal
believe wfh agree wfh society article interviewee's completely tone deaf beaverton spin,Toronto
greenhouse specifically allow photoshoots several aware request special permission garden several greenhouse well,Montreal
commentaires certains canadiens sujet accent francais depuis trente surtout travail alors famille continent depuis e siecle compatis,Paris
suggest success drink pilot fentanyl meth pilot project allen garden,Toronto
soy protein baby formulai imagine isoflavones read ithttps wwwhealthlinecom nutrition soy formula#benefits sad quickly mind study galactosemia hereditary lactase deficiency medical prevent baby natural sugar milk soy formula harm isoflavones heavy effect hormone treatment menopause promensilcouk product original,Toronto
branche voici travail rapidement envoy cv boites t'interessent chaque h apres cv ete recu ss'ils mission vont dire vont dire qu'ils rappeler cest partie rappelles h s'ils mission n'est cringe montre justement veux travail sais communiquer facon matin pense d'ici semaines max travail,Paris
research project agree organization staff glad meal holiday,Toronto
german travel okay realise greet genuinely concern emotional state everyday nah sorry,London
sais cela imago jamais sainte font ausbar chapelle peniche chapelle pourrait correspondre peux demander d'y tourner scene souvent semaine n'y monde,Paris
tour abandon proper secret tunnel tour round secret tunnel cool tunnel,London
winner dinner jules verne atop eiffel view paris observation deck iconic landmark tour montparnasse grand arch triomphe cigarette nothing dinner l'avenue ciel atop tour montparnasse scoot cafe luna clichy caulaincourt late prior eclectic quai grenelle pont grenelle porte cloud traffic circle billancourt pipos latin quarter,Paris
windmill 'just' london barnet convenient wife's son's football perfect actual windmill indoor dibs example wwwrightmovecouk # channelresbuyhttps wwwrightmovecouk # channelresbuy,London
general y'a moyens d'avoir pris charge visiblement serum ecoles futurs exemple amene petit pourboir etudiants quand va sympa,Paris
pense necessairement vivre confortablement paris faut smic vu prix probleme pose qu'en gagnant smic sans garant t'as aucune trouver logement prive,Paris
personally random conversation route ball court let,London
flat £m contribute supply development everywhere exception,London
toronto alot queer friendly bar drink saw white supremacist recruit black girlmid they've embolden figure recruit,Toronto
lifedrive manufacturer minimum essentially necessity specifically kid,Montreal
information steal newborn baby childcare information imply receive childcare mainly baby newborn pregnant woman clarification nimmediate baby period minor affect,Toronto
specific wild assume somewithin year,Montreal
semaine passee j'y passee velo dame avant velo tenter voiture alors qu'elle traversait l'intersection c'etait vert velo voiture voulait tourner droite reste priorite pietons vont droit voiture passer l'intersection feu etait passer rouge attendre tour m'a laisse voir autre belle infraction rachel bloquee voie tourner gauche provenant lorimier bouge n'a dame file voie depassement droite tourne gauche devant file sauf rachel etant toujours bloquee arreter pieton video,Montreal
older heat pump oil electricity heat cool include tank oil average heat oil eventually expensive unavailelectric dual energy save hopefully propane natural gas oil heat effective efficient save upgrade save case,Montreal
real launch development ellington crosstown disaster road disaster chow must sleep fund,Toronto
recently analysis basically pre pret raise inflation maintain turnover swear boot meal deal lunch e whopper pop article hat pre covid transaction september transaction london worker london london west london suburb london airport,London
y'a annees deja saxophoniste jouait jazz y'a dame assez agee elegante petit gants grand fourrure c'etait beau finit discuter peu americain joue club eme gar incroyable dame agee etait tellement emue qu'elle sorti poche c'etait garnier pouvait aller dit saxophoniste « etes grand alors donne sais apprecierez » l'impression d'etre figurante film,Paris
hi quick ive purchase london figure wwwlondonnyefireworkscouk terrible sell slightly anyexperience method,London
violation notice require minimum cent yard must soft landscape state must violation compliance trivanoic install turf concern remove file ignorance bylaw win defense government personal enjoyment personal personal property,Toronto
sorry london western easier population wise spare sample size encounter exactly robust reddit,London
avoid program gang drug possibly drink idiot camera extreme organize neighborhood watch sound,Montreal
trip single london worth trust,London
earn salary stable job toronto spouse infrastructure woefully insufficient grow population toronto toronto list medical educational scarcity density lead tension along socioeconomic racial negatively impact mental health teenager today trade cottage country…,Toronto
pet pleasedhttps twittercom petshopboys status drake today surprise @drake sing chorus west girl party album credit permission request,Toronto
budget moins cher personne serum h faut queue billet puis queue rentrer confortable propre classique taxi tarif « downtown » fixe memoire uber environ pareil peu rapide confortable coup,Montreal
ligne serieusement bout allee paris seulement dessous fois juste c'etait anime j'habite village moins habitant dont plupart vieux familles jeunes enfants niveau mieux fou j'envie personnes paris certes campagne calme l'air frais quand ado jeune ennui constant n'y rien amis n'habitent village aller magasin facilement n'a surement loin fac j'habite h fac peux dire devoir partir chez h cours h ouf,Paris
south africa south african anthem official lesson include teach anthem anthem we've hadwe completely butthurt add already,Toronto
circle regent amaze villa regent canal camden little venice across canal pristine garden grand i'll edit wwwgooglecom map,London
decouvrir groupe taper google nom groupe paris trouver concert acheter arrive dizaines fois maintenant demande groupe passe juste quand passe,Paris
uk add equation protect historical church situate land abandon convert flat bar entirely quality refurbishment church thick wall sturdy course entirely builder reasonable however church sell individual well,London
black main basically black smoke amount smoke ashtray butt smoke everywhere routemasters colourful culture punk goth hippy dress flamboyantly black puffer trainer far eye cheaper young artist bed flat benefit hard imagine flat renovate flat inside loo yet dog fewer dog meter far far far fewer chain boot coffee chain far independent army surplus everywhere clothe cheap german army shirt flood london air raid coat warmest ever see,London
delivery far apps convenient wider range option hurt delivery pizza rotisserie chicken restos delivery,Montreal
shopper convenience store pharmacy pharmacy convenient beyond fill prescription allocate complete trash independent grocery butcher veggie instead loblaws,Toronto
american connection london pandemic turn neighbour basically infestation fixture route little crawl nightmare,London
diaper cheaper walmart shopperswalmart cheaper formula sometimes stock poor amazon subscription bestetc real store capitalism u,Toronto
denis comprenait courtisait doit concue habitant fois annee,Montreal
london lately green london lockdown combination behaviour stick pub charge £ behaviour stick others lazy empty home,London
comparison transit us transit bicycle bicycle nov april bicycle path shore tend occur mostly road bike path,Montreal
certificate allow english english believe option period regard access english ok read international permit finish study english bc certificate,Montreal
pompe reste l'interieur sou sol completement independant temperature exterieur toujours efficacite ete l'annee longue veux rien,Montreal
juste font deja travail salaire font strict minimum livrer description tache vois absolument l'effort,Montreal
paris vu crottes trottoirs eme petits vieux baisser ramasser j'imagine alors quand thune touche crottes sais pa,Paris
reasonable doubt reasonable doubt offense head acquit others obviously thats post,Montreal
single bedroom apartment turn completely insane room share common term hotel sometimes somelease apartment key condo win win situation desirable mid town somenice verify recommendation safer random kijiji craigslist profit example summer charge apartment room bad,Toronto
fan jay playoff series texas ranger series mistake ranger allow jay tie game crucial game series season jose bautista dramatic homer win series,Toronto
