body,subreddit
accord autres probleme apres chiens pa fait ramasser franchement fois demande si crottes chiens vu eim pire pire petite rue,Paris
twickets reliable generally rah state proper reseller personally avoid stubhub viagogo royal hall sometimes drip feed lead,London
item peut pa avoir deux prix affiche seule peuvent faire frais supplementaire ca doit etre clairement indique peuvent surtout pa autre item ca,Montreal
toronto roncessvalles alot queer friendly bar drink saw white supremacist recruit sit next black girlfriend mid embolden figure recruit,Toronto
curiosity ontario worst brunt multiple scammy college lure international false pretense fake promise employment ghost hotel unoccupied worst doctor shortage province bc fix latest reform poor infrastructure development alright alberta worse mile behind bc quebec,Toronto
million metropolitan london literally london busy suggest tokyo seoul hopefully teach literally billion million settlement special earth literally infinite,London
immediately outside angel affordable bite selection another expensive stand outside camden otherwise expensive selection upper,London
corner ever extra careful bike vehicle,Montreal
specific wild assume,Montreal
mum personal evict condo fight landlord count pray weak fight,Toronto
london shit everywhere obviously lovely shit hole fun young flat three story mad speed punk upstairs sell hash drink spare moment three flat room flat bathroom kitchen room bedroom heat entire white literally white pub mainly highlight slip poor beer watch throw window squat speed preference whole squat hash sell load punk hippy gay scene party scene colourful mad wwwinstagramcom eta london comparison nicer,London
real $mm launch development ellington crosstown disaster disaster chow must sleep fund,Toronto
paris bourne identity mi fallout mood vista obviously parisian basis sufficiently ground reality immersion,Paris
reasonable doubt reasonable doubt offense head technically acquit obviously thats goal,Montreal
quand etais vendeur boutique velo montreal scooter faire reparer etait pa velo electrique voir oui viens acheter velo electrique vendeur si peux pa faire reparer velo boutique velo specialisee peut etre pa velo carrement scooter electrique tellement dangereux piste cyclables peux pa pedaler ca lever ca souvent battery plomb,Montreal
touristic hub landmark jewish unfortunately regard bedbug highly exaggerate usual british french bash cheap headline,Paris
hi paranoia press season paris bedbug bedbug july th fly bag infest likelihood rid,Paris
solve essentially unaffordable due demand outpace supply hard revenue stream fight vacant perfect scenario investor perfect target luck gather support,Toronto
decrease infrastructure instead campaign easier driver campaign transit system suburb cyclable,Montreal
bother french toronto ontario resident due lower worry french,Montreal
pilot waste prohibition anymore drink disorderly conduct deal allow canada toronto baby citizen drink laughable drink outside condo hot summer turn drink inside basement apartment toronto grip,Toronto
doi gerer meme jusqu jour collecte comme ca ca partout quebec si immeuble pa poubelle jour collecte prends sac devant immeuble laisses poubelle chez,Montreal
maurilca maurilca tool radio canada listen english french canadian tv radio content luck french welcome montreal,Montreal
beaucoup choses comme commentaires concert architecture seine truc particulier travailler lorsqu fait beau,Paris
report claim tag policy brand vehicle deny,Montreal
information whether french whereas accord appreciate merci,Paris
heavy resource idk single must bring name facility hotel must convert value square meter middle men value regardless value view unoccupied future government project landlord property unable sell future project renovate sell add fund maintenance property occupy property otherwise exploit independant body remain protect repeat offender property involve future project bring must sell detail fill solution complain,London
# upvote downvote reminder image appreciate upvote love downvote upvoting downvoting image control subreddit bot action perform automatically moderator subreddit message compose r london concern,London
vivant comme ca peut passer veux assurer matelas securite niveau finance avoir projets ambitieux vie jour jour ca doit etre bien complique,Paris
era tour theater decide champ villette villette friday champ saturday friday theater midnight ride late ok friday saturday,Paris
deja problemes famille trucs quand meme tres jamais avoir rendez telephone ligne pointe rendez rapidement ca peut etre,Montreal
release name ignore meteorologist advisory whether perpetrator race religion personally believe,Toronto
london bite stranger conversation rob sex emphasis stranger,London
theatre box office sell programme theatre bite bet pop another programme definitely fix ruin trip,London
ca budget uniqlo bon depart apres peux vers marque tendance aussi chers comme si budget pa probleme recommande magasin appelle generale,Paris
recommend hot club friendly travel idea,Montreal
landlord ban outright renter encounter scenario landlord permit dog dog clause unreasonable longer dog likely engage behaviour dog claim clause hard comply dog several hour however however another landlord,London
bullshit couple head toronto smalldicks supercars across lane slow crawl piss elicit honkening clearly attempt create highway stupid drag race guess funniest shit beater jeep shoulder lmao,Toronto
asian compare lockdown quality dramatically trust,London
fry board fry gravy count recommend fry province recommend fry integrity matter fry gravy period,Montreal
toronto association actively civilian worker join suitable union teamster effectively isolate support network union card hold certification vote employee specific successfully form union join,Toronto
jeudi ah cafe quartier latin fait voir six faire favorite membre adore quebec ainsi gagnant,Montreal
black cab expensive refuse journey several flat refuse south several exotic delight forest hill,London
story lease permission landlord gradually bite bite another load preliminary organize shelf hang closet lock bring bin refill another load next relevant sleep lie yet absolutely teem bed bug infestation final lock midnight bring settle sleep brand bed pre furnish previous tenant turn whole crux bed turn sleep pillow beside little dot scurry across screen spider quickly sit turn literally dozen upon dozen tiny dot across headboard pillow swarm word describe immediately leap bed abject horror tear pajama fresh grab recent bag bring grab wallet key several shock finally flag taxi forever none little bugger hitch ride cab flee straight partner soon door strip fully naked double seal garage bag shower hour next manage lease thank goodness landlord swear idea belong garage bring fumigator apartment salvage tenant hour concrete garage everything laundry quarantine trash category officially partner everything outside balcony double seal bin wrap garbage bag fully treat fully intend together suddenly original w,Toronto
uk everybody literally provide personal engage response london matter strange appear,London
information steal newborn baby mother childcare information imply childcare mainly baby newborn pregnant woman clarification none immediate baby period minor affect,Toronto
windmill lane london convenient wife football perfect actual windmill indoor pool example wwwrightmovecouk property # wwwrightmovecouk property #,London
ligne heure pointe rentre travail casque epoque rame bondee comme habitude pose donc contre porte oppose sdf etait meme air bien alcoolise pa attention pa faire bien ca marche pa leve casque pousse personne juste cote dit rien gros metal bon file casque sauf pa arret tout monde chemin rame excuse aupres jolie dame pousse rame deux carres loin devant porte peu epaule dit crois casque ah vrai desole rend descend ensuite peu dis merci tous aide wagon arret ensuite peu honte pa avoir honte bon,Paris
control apartment nearly amount evict reason apartment literally next door layout $ currently landlord court situation unique sustainable sleep evict,Toronto
paris strike friendly paris,Paris
accuse threaten identifiable degree warrant arrest cp name accuse suggest minor target identifiable statement harm jew vagueness article suggest indeed weird report utm jewish otherwise deserve threat jewish fundamentalist threaten harm canadian muslim bigotted fundamentalist article seldom restrict bigotry,Toronto
brossard longueuil montreal driver cross montrealers toll island,Montreal
folk trouble due fair animal,London
recommend direct landlord agent property manager policy success happy cat,London
hem coat hem possibly redo design hem agree £ cheap worry cut corner twice,London
black main black smoke amount smoke butt smoke everywhere colourful culture punk goth hippy dress black trainer far young artist bed flat benefit hard flat renovate flat inside yet dog shit fewer dog meter far far far fewer chain boot coffee chain far independent army everywhere cheap german army shirt flood london air raid warden coat ever,London
e e vers aime beaucoup cet arrondissement vecu pendant etude quitter quand emmenage compagnon pa assez rester appartement,Paris
animal bite vacation french,Paris
mandatory bar bathroom mandatory glass water,Paris
rer devait etre h crois copine allait vers peu avant villiers remarque type ultra passe plusieurs fois travers rame air regard fou main cache copine jamais villiers pa mal monde descend mec quai comme quelqu coup commence femme passe quitter juste apres vois litteralement meme meme moment route impression niveau sortie gare ca pa mal destination signale truc staff nuit gare dit ceux devraient etre tout ca espere cette femme rien avoue avoir entendu aucune,Paris
# upvote downvote reminder image appreciate upvote love downvote upvoting downvoting image control subreddit bot action perform automatically moderator subreddit message compose r london concern,London
space research project agree wonderful organization staff glad meal able,Toronto
forget remind rob ford plan refresher november keelesdale mayor rob ford premier dalton mcguinty officially grind project ttc staff release report completion eglinton crosstown realistic main reason project management transfer ttc infrastructure ontario us finance procurement strategy strategy contractor project effectively require contractor redo design ttc ttc metrolinx aggressive timeline lead severe construction relate disruption traffic stretch eglinton avenue tear concurrently deadline enwikipediaorg wiki lineeglintonhttps enwikipediaorg wiki lineeglinton damn ttc,Toronto
whenever fun london museum museum novelty novelty club,London
currently energy today property rarely meter mess reason appliance neighbour landlord everything except appliance meter read apart repeat appliance power test energy action,London
jean rock river perfect rule agree,Montreal
wow soy protein baby formulai isoflavones read ithttps wwwhealthlinecom nutrition soy formula#benefits sad quickly mind study galactosemia hereditary lactase deficiency medical prevent baby natural sugar milk soy formula harm isoflavones heavy effect hormone treatment menopause promensilcouk product original,Toronto
berlin currently reside paris french french english french certain nobody english,Paris
answer chain across england crap support independent business amaze independent london practically refuse chain insist,London
multiple shelter nearby feed regularly donut meal various charity organization shortage,Toronto
employee send message collapse earth,Montreal
english send french elementary french advantage quick english affordable,Montreal
svp effet aussi effet rapide aveugle rend difficile pietons automobilistes autres cyclistes merci,Montreal
document january inform garage prior province announcement secure contract ontario revitalization fact province clear doc obligation assume responsibility situation contradict original development state taxpayer financial contribution design construction propose facility ontario,Toronto
decouvrir groupe taper google nom groupe paris trouver concert acheter fois maintenant demande meme si groupe passe juste quand passe,Paris
green tube evacuate cop whole instead scar annoy pret often commute london beautiful river another celebrate pub stand outside pub whole football crazy pack tube smoke evacuate celebrate somehow become common shrug shoulder forward bother cab foot hurt stupid amount christmas load,London
coffee commute notice coffee couple p term £,London
reste interieur sou sol independant temperature donc ca toujours meme hiver comme ete ca annee longue si veux ca rien,Montreal
potential dud little plan installation meh conceptual art conceptual art art art fund involve art helm excite contemporary art associate party terrible,Toronto
unfortunately worse tesco teenager sit throw rubbish outside lady racist,London
internet become comfortable real sadly pandemic everywhere sometimes hold reduce attention avoid real real,London
toddler infant mannered sit whole dinner fantastic idea appropriate parent entitlement presence impact enjoyment,Toronto
colour shirt wash fit everyday bite wash comfortable imo play dress,London
doctor list oh appointment gonna luck,Montreal
c$ garage downtown toronto head island resident committee downtown toronto whole province bungalow somewhere,Toronto
capitalism capitalism raise poverty western policy refuse inflation slow growth economy elsewhere instead resource citizen capitalism supply chain grow imo thank,Toronto
pense pa paris faut smic vu prix probleme pose aussi gagnant smic meme sans aucune trouver logement,Paris
cut act behavior beyond business trip present woman,Montreal
ca quelqu mi panneau chemin carton suite dernier pluie mairie vrai,Paris
reflect fact original deadline announcement metrolinx gutted totally organization via vester manager via political interference totally bust,Toronto
aim « musee art paris » wwwgooglecom @ayht datamemsxjtu wwwgooglecom @ayht datamemsxjtu passerelle aim,Paris
package nearby office verify otherwise amazon specifically amazon drop package door steal trash package often theft neighborhood,Montreal
ride island yell twice south shore summer window yell bike path bike path nearby pleasant,Montreal
sais tres bon master sorbonne science upmc jussieu ancienne apres crois pa mal faut croiser psl dauphine surement prepas connais rien dessus desole,Paris
bag milk stocker appear fidget bag milk certain switch closure tab expiry odd occasion milk tend expiry cartoned milk,Toronto
ouch harsh motivation perhaps argue rule lesson lesser moral,Montreal
gros problemes securite cette constance signalisation certaine piste cyclables tous troncons rev beneficient virages protege ensemble usagers automobilistes cyclistes habitue rouler certaine maniere feu protege changement soudain cette protection entraine donc grande incident meme feu clignotant vert signale priorite virage recemment remarque certaines intersection donne feu vert pietons meme temp feu clignotant conscient pietons ca difficile vouloir priorite ca pa feu pieton vert dit pa ceci excuse automobilistes manque constance signalisation peut faire sorte usagers pa,Montreal
montreal vegan montreal favorite vegan couple vegan coffee delicious vegan pastry recommend amaze montreal burger fiance vegan burger style homemade burger fry vegan chicken sandwich amaze swap burger double highlight fry twice trip sushi vegan sushi regret love return absolutely fantastic across board sushi roll absolutely happy highly recommend additionally copper branch delicious vegan italian burger fiance folk upstairs jazz vegan menu music worry,Montreal
gta completely unconnected outside transit abysmal mississauga oakville match vast gta exacerbate touch jurisdiction europe space,Toronto
alright french appreciate lead surprise french immersion accent hate accent,Montreal
sais pa si cela si jamais aussi font aussi bar chapelle chapelle sers pourrait correspondre peux peut etre demander tourner scene souvent semaine pa monde,Paris
tous semaine quand rentre bureau banlieue passe bande cyclable personne plein droite belle piste cyclable panneau paris,Paris
boy pleasedhttps twittercom petshopboys status drake today surprise @drake sing chorus west girl party album credit permission request,Toronto
romantic bord seine utterly magical moment river picnic,Paris
english french french french province,Montreal
ligne vers h femme visiblement pa tres probablement sdf tous animaux compagnie pot puis spectacle castagnettes poche jupe entame interpretation assez ratee balade gen heureux etait metre sortir avant rire ligne entre colonel fabien deux mecs clairement pa parlant fort main bousculent bousculent tous ceux cote meme occasion bref clairement genre envie vite sais pa ete autre mec leve balance gar genre tete fait reagir tout wagon,Paris
absolument pa pisse chien probleme pisse rue sou ponts ruelles parcs vieux mecs pissent partout beau installer partout deja vu gar pleine rue journee grand calm bande meme siege depuis vu gar,Paris
certains parlent tres fort comme personne autre certaines parisienne cliche certains plat hiver plein ete servent ca pendant client touristes tout ca plutot amusant,Paris
prescott couple love massive bed flat twenty value half mil rest cover forever travel bed comfortably relationship suit fancy,London
semaine passee passee velo dame avant velo aussi failli faire tenter dedans voiture alors traversait intersection etait vert velo voiture aussi tourner droite ca reste priorite pietons vont tout droit arreter laisser voiture passer temp meme intersection feu etait passer attendre tour ca tout laisse loisir voir autre belle infraction rachel bloquee donc voie tourner gauche bouge pa ca pa dame file sortie voie fait droite tourne gauche devant file sauf rachel etant toujours bloquee arreter pieton comme video,Montreal
france cad mobile plan mobile data g g g france canada dozen french cad mobile plan france canada card mobile plan france whenever mobile plan canada cad canadian absolutely shit canadian internet provider canadian provider insane,Montreal
bonjour deja paris autour billet paris aussi valable interieur paris sais valable exemple denis gare nord ligne puis rer b aeroport savais pa si utiliser aussi interieur paris gare rer exemple prendre ligne gare nord ensuite rer aeroport autre billet rer ratp pa tres donc demander,Paris
cet endroit budget avoir tres artiste si va ca toujours decu endroit sympa flex vrai si aim,Paris
comparison transit us transit bicycle bicycle april bicycle path shore tend occur mostly bike path,Montreal
gang south mostly brixton significant gang numerous estate estate literally poverty everywhere sub war music obviously name,London
tous quand fils ecole vers champ tour eiffel rer passe seine tour eiffel ciel tout ponts tout,Paris
trip abroad single london awful trust,London
another recently selfies thief approach bicycle throw behind thief,London
cold approach stranger stranger chat ignore,London
gare fait marche arriere conducteur etait alcoolise fait sortir gare gen avis pa demande faire marche arriere,Paris
france uk encounter interim pleasant,Paris
quitte region parisienne depuis quelques mois reviens stage premier jour stage fois rer depuis mois rentre rer bonde vois endroit idiot oublie cela odeur abord urine sdf rer regarde sexe regardant retour quotidien rer tant manque securite grand assurer personne pose pied,Paris
# upvote downvote reminder image appreciate upvote love downvote upvoting downvoting image control subreddit bot action perform automatically moderator subreddit message compose r london concern,London
risk whenever fire hydrant gonna assume windshield legal,Montreal
politician landlord surprise purpose rental tie red real shocker none intentional canada real,Toronto
folk universal uniqlo project brand bell outdoor layer functional style function,London
maire vient etre placee garde vue e interet projets construction article maire noisy grand placee garde vue affaire,Paris
french loudly whether bonjour foreigner certainly paris french laugh certainly whereas happy attempt eastern europe latin america urge guest france encounter french highly sensitive type,Paris
ligne serieusement ca fait bout temp pa allee paris seulement dessous fois juste fait etait habite village moins habitant plupart vieux familles jeunes enfants niveau fait mieux fou comme envie personnes habitent paris certes campagne bien calme boise air frais quand ado jeune adulte ennui constant rien faire si amis habitent pa meme village peut pa aller magasin facilement si pa permis surement loin fac habite h fac peux dire devoir partir chez h commencer cours h pa ouf,Paris
hello femme ici pris plein fois rer b tard tres souvent dernier ailleurs aller antony massy jamais trouve ca craignait notamment antony encore beaucoup monde pire vu mec vomi wagon odeur etait bon etait degueu pa craignos vrai comme rer globalement plutot rempli trouve craint pa trop cote sud jamais allee loin massy moins prendre rer gare nord contre beaucoup craignos chatelet soir trouve tant fille aussi pris plusieurs fois noctilien fait denfert antony peux comprendre reserve certaines meme si globalement ca va peu folklorique,Paris
suck bring awful insidious bug suck bug travel anybody jump onto unfortunate stand ttc thank tip,Toronto
shelter worker concurrent mental health medical province solution ttc worker ttc rider somehow manage ttc plan bandaid solution bite bandaids bloc torontois,Toronto
equinox imo wwwwaterfrontorontoca default file rfp keating channel pedestrian bridgepublic design slide deckzeidler final uapdf,Toronto
grow thames air raid flood occur trigger occasionally elderly neighbour war listen must shit,London
quelques annees avenue charles mec menace deja scooter personne rue appelle seulement mal venir tard mec allait pendant temp contente partir apres avoir menace pris montre tout,Paris
toronto star lay timeline greenbelt scandal agree conclusion likely member ford caucus fall sword provide ford plausible deniability defense cut chase star editorial rcmp sensitive international announce investigation ford office government fully co operate tolerance wrongdoing involve decision greenbelt land letter statement sentence demonstrate investigation denial deflection defence indefensible refusal consequence premier fact demonstrate tolerance dodgy dubious accountability scandal government cabinet minister clark rasheed senior aide dive opinion poll ford investigation outcome relieve political future,Toronto
terme € seance appartement petite pied semaine chaussures peuvent peu cher fonction peuvent bonne annee regulierement genre chaussures peux € regarde exemple souvent,Paris
honnetement internet ca pa besoin etre ca garde longtemps fais avant ca garde facilement mois peux trouver petits pot general fois vendre ca pa va pa acheter gros,Paris
flight brit fly crap hotel tend bed bug fake far,London
couple lexus vehicle steal levine upset ttc provide security brutal another steal elsewhere ttc,Toronto
london million become become nicer london love london glad anymore noise cancel sit upstairs,London
pareil deux autres commentaires va pa ecouter bon techno dj adore decu qualite tres tres ba contre si e pa tant ca dj veux passer bon moment endroit sympa,Paris
photograph england france strict privacy object possibly,London
partner hinge single term relationship serious easy everything click engage partner three hinge,London
often moment steal killer multiple victim murder wasnt solve,London
read somewhere vincent office toronto sear warehouse merchandise loft curate artworkshttps jamiebradburnwritingwordpresscom vintage toronto ad vincent collection art sell sear roebuck catalogue neat piece,Toronto
honnetement vais etre brutal sans etre oublie tout suite personne arnaques moins moyens deja etant galere sans nom alors,Paris
opinion gen savent japon tout vivant mourrial tokyo genre million habitant propre mourrial ba surtout gen pa veux japon parle japonais agit japonais ca normalite meme,Montreal
mechanic aftermarket tracker properly instal havoc vehicle communication system control awake send signal improper wire tap cover manufacturer warranty factory instal lexus toyota steal news another steal,Toronto
control apartment current renter empty value tenant slide blank envelope receipt previous door,Toronto
quebec bear announce reform french class summer class winter aware class summer teacher jump french $ highly recommend teach faster pace whole fall winter program essentially,Montreal
uk space space add protect historical church land abandon convert flat bar entirely quality church wall entirely budget church reasonable however church sell individual,London
juste font deja travail salaire tres font strict minimum litteralement vois absolument pa,Montreal
article highlight accord ontario rental registry design profit launch tuesday bring transparent reliable information renter landlord policy maker province tenant opportunity comparison mike moffatt found director smart prosperity institute partner launch university toronto deal rip vary widely province longtime tenant control apartment often hold relatively affordable ontario control occupy tenant landlord renter black hole information neighbour voluntary transparency otherwise operate matter worst behavior landlord relation tenant reference link article relevant rentalregistryca registry,Toronto
idea blind appointment specialist h appointment pm finally pm doctor medication mind blind mind hurt medication likely quebec compare alberta immediately propose expert next refuse stupid,Montreal
ete infraction devait sortir sexuelle sexuelle jusqu,Paris
